tipo,fecha,titulo,url,texto,filename
Discurso,2025-10-10,Encuentro con los participantes en el Jubileo de la Vida Consagrada (10 de octubre de 2025),https://www.vatican.va/content/leo-xiv/es/speeches/2025/october/documents/20251010-giubileo-vita-consacrata.html,"ENCUENTRO CON LOS PARTICIPANTES EN EL JUBILEO DE LA VIDA CONSAGRADA
DISCURSO DEL SANTO PADRE LEÓN XIV
Aula Pablo VI Viernes, 10 de octubre de 2025
[ Multimedia ]
____________________________________
En el nombre del Padre, y del Hijo, y del Espíritu Santo.
¡La paz sea con ustedes!
Queridos hermanos y hermanas, ¡buenos días y bienvenidos!
Me alegra estar con ustedes, que representan a todos los consagrados y consagradas del mundo, en esta semana de su Jubileo en Roma . Los recibos con un abrazo que sale del corazón y deseo que llegue hasta los rincones más lejanos de la tierra, donde sé que puedo encontrarlos. Particularmente, recordando lo que ya les dijo el Papa Francisco , quiero declarar a mi vez que la Iglesia necesita de ustedes y de toda la diversidad y la riqueza de las formas de consagración y ministerio que representan (cf. Mensaje para la Jornada Mundial de la Vida Consagrada , 2 febrero 2023).
Con su vitalidad y con el testimonio de una vida en la que Cristo es el centro y el Señor, pueden contribuir a «despertar al mundo» (cf. Francisco , Carta apost. a todos los consagrados con motivo del Año de la Vida Consagrada , 21 noviembre 2014, II, 2). Esto lo hemos escuchado esta mañana, que pueden hacer despertar al mundo. En este sentido, habría que reiterar siempre lo importante que es para todos ustedes estar arraigados en Cristo. Solo así, de hecho, podrán cumplir la misión de manera fecunda, viviendo la vocación como parte de la maravillosa aventura de seguir más de cerca a Jesús (cf. CONC. ECUM. VAT. II , Decr. Perfectae caritatis , 1). Unidos a Él, y en Él entre ustedes, sus pequeñas luces se convierten en el trazado de un camino luminoso en el gran proyecto de paz y salvación que Dios tiene para la humanidad. Por eso, a ustedes, hijas e hijos de Fundadores y Fundadoras, les dirijo una cálida exhortación a “volver al corazón”, como el lugar en el cual redescubrir la chispa que animó los inicios de su historia, entregando a quienes les precedieron una misión específica que no pasa y que hoy se les confía a ustedes. En efecto, es en el corazón donde se produce la «paradójica conexión entre la valorización de uno mismo y la apertura a los demás, entre el encuentro personalísimo con uno mismo y el don de uno mismo a los demás» ( Francisco , Carta enc. Dilexit nos , 18). Es en la interioridad, cultivada en la oración y en la comunión con Dios, donde echan raíces los mejores frutos del bien según el orden del amor, en la plena promoción de la singularidad de cada uno, en la valorización del propio carisma y en la apertura universal de la caridad.
Ustedes se han preparado para estos días con un largo camino, en sus países, dentro de sus Institutos, Sociedades y Asociaciones, dentro de las diversas Conferencias, inspirados por el lema: « Peregrinos de esperanza, en el camino de la paz ». Hay una profunda necesidad de esperanza y paz que habita en el corazón de cada hombre y mujer de nuestro tiempo, y ustedes, consagradas y consagrados, quieren ser portadores y testigos de ello con su vida, como divulgadores de la concordia a través de la palabra y el ejemplo, y antes aún como personas que llevan en sí mismas, por la gracia de Dios, la huella de la reconciliación y la unidad. Solo así podrán ser, en los diversos ambientes en los que viven y trabajan, constructores de puentes y difusores de una cultura del encuentro (cf. Francisco , Carta enc . Fratelli tutti , 215), en el diálogo, en el conocimiento recíproco, en el respeto por las diferencias, con esa fe que les hace reconocer en cada ser humano un único rostro sagrado y maravilloso: el de Cristo.
Ayer por la noche , muchos de ustedes entablaron diálogo con la ciudad de Roma en algunas plazas, con momentos de intercambio, de fraternidad y de testimonio en torno a temas importantes, como el compromiso por construir una fraternidad universal , la atención a las personas más pobres y el cuidado de la creación . Son puntos focales que hablan de su esfuerzo constante por establecer y promover ambientes y estructuras de fraternidad, donde se venza la pobreza, se ponga en el centro la dignidad de la persona humana y se escuche el clamor de la «casa común». Se trata de ámbitos de servicio por los que, a lo largo de los siglos, la vida consagrada siempre ha mostrado un interés y un cuidado especiales y hacia los que, aún hoy, su actuar cotidiano y oculto da testimonio de una atención privilegiada. ¡Sigan haciéndolo así! ¡Sigan siendo guardianes y promotores de esta gran tradición, por el bien de los hermanos!
Sin embargo, me gustaría invitarles a reflexionar sobre otro tema importante para la Iglesia de nuestro tiempo: el de la sinodalidad, exhortándoles a permanecer fieles al camino que todos estamos recorriendo en esta dirección. San Pablo VI hablaba de ello en términos muy hermosos. Escribía: «¡Cuánto desearíamos disfrutar en plenitud de fe, de caridad, de obras este diálogo doméstico; cuánto desearíamos que fuera intenso y familiar! ¡Cuán sensible a todas las verdades, a todas las virtudes, a todas las realidades de nuestro patrimonio doctrinal y espiritual! ¡Cuán sincero y conmovedor en su genuina espiritualidad! ¡Cuán dispuesto a recoger las múltiples voces del mundo contemporáneo! ¡Cuán capaz de hacer de los católicos hombres verdaderamente buenos, hombres sabios, hombres libres, hombres serenos y fuertes!». (Carta enc. Ecclesiam suam , 6 agosto 1964, 117). Es la descripción de una misión apasionante: un «diálogo doméstico» que hoy se confía también a ustedes, es más, a ustedes de manera especial, para una continua renovación del Cuerpo de Cristo en las relaciones, en los procesos, en los métodos. Su vida, la forma misma en que están organizados, el carácter frecuentemente internacional e intercultural de sus Institutos, los colocan de hecho en una condición privilegiada para poder vivir cotidianamente valores como la escucha recíproca, la participación, el intercambio de opiniones y capacidades, la búsqueda común de caminos según la voz del Espíritu.
De todo esto, la Iglesia les pide hoy que sean testigos especiales en las diferentes dimensiones de su vida, en primer lugar, caminando en comunión con toda la gran familia de Dios, sintiéndola como Madre y Maestra, compartiendo en ella la alegría de su vocación y también, cuando sea necesario, superando divisiones, perdonando injusticias sufridas, pidiendo perdón por las cerrazones provocadas por la autorreferencialidad. Trabajen para convertirse, día a día, cada vez más en «expertos en sinodalidad», para ser profetas al servicio del pueblo de Dios.
Para terminar, me gustaría hacerles una invitación a ver el mañana con serenidad y confianza, y a no tener miedo de tomar decisiones valientes. Quisiera, a este respecto, recordar lo que el papa Francisco escribió en la Carta apostólica a los consagrados con motivo del Año de la Vida Consagrada . Nuestra esperanza, escribía, «no se basa en los números ni en las obras, sino en Aquél en quien hemos puesto nuestra confianza (cf. 2Tm 1,12) y para quien “nada es imposible” ( Lc 1,37). Esta es la esperanza que no defrauda y que permitirá a la vida consagrada seguir escribiendo una gran historia en el futuro, hacia el cual debemos mantener nuestra mirada, conscientes de que es hacia él hacia donde nos impulsa el Espíritu Santo para seguir haciendo grandes cosas con nosotros» (n. 3). Y añadía: «Escudriñen los horizontes de su vida y del momento actual con vigilante atención» ( Ibíd. ).
Queridas hermanas y hermanos, ¡sigan con esta confianza su camino! Les agradezco su fidelidad y el gran bien que hacen en la Iglesia y en el mundo. Les prometo un recuerdo especial en mi oración y los bendigo de corazón.
Gracias.",2025-10-10_discurso_encuentro_con_los_participantes_en_el_jubileo_de_la_vida_consagrada_10_de_octubre_de_2025
Homilia,2025-10-09,Santa Misa - Jubileo de la Vida Consagrada (9 de octubre de 2025),https://www.vatican.va/content/leo-xiv/es/homilies/2025/documents/20251009-giubileo-vita-consacrata.html,"JUBILEO DE LA VIDA CONSAGRADA
SANTA MISA
HOMILÍA DEL SANTO PADRE LEÓN XIV
Plaza de San Pedro Jueves, 9 de octubre de 2025
[ Multimedia ]
____________________________________
«Pidan y se les dará, busquen y encontrarán, llamen y se les abrirá.» ( Lc 11,9). Con estas palabras, Jesús nos invita a dirigirnos con confianza al Padre en todas nuestras necesidades.
Nosotros las escuchamos en el marco de la celebración del Jubileo de la Vida Consagrada , que los ha reunido aquí en gran número, venidos desde muchas partes del mundo —religiosos y religiosas, monjes y contemplativas, miembros de los institutos seculares, los pertenecientes a la Orden de las Vírgenes , eremitas y miembros de “nuevos institutos”— que llegados a Roma para vivir juntos la peregrinación jubilar, para confiar nuestra vida a esa misericordia de la cual, a través de la profesión religiosa, se han comprometido a ser signo profético, porque vivir los votos es abandonarse como niños en los brazos del Padre.
“Pedir”, “buscar”, “llamar” —los verbos de la oración usados por el evangelista Lucas— son actitudes familiares para ustedes, habituados por la práctica de los consejos evangélicos a pedir sin exigir, dóciles a la acción de Dios. No es casual que el Concilio Vaticano II hable de los votos como un medio útil «para traer de la gracia bautismal fruto copioso» (Const. dogm. Lumen Gentium 44). “Pedir”, de hecho, es reconocer, en la pobreza, que todos es don del Señor y dar gracias por todo; “buscar” es abrirse, en la obediencia, a descubrir cada día el camino que debemos seguir para alcanzar la santidad, según los designios de Dios; “llamar” es pedir y ofrecer a los hermanos los dones recibidos con corazón puro, esforzándose en amar a todos con respeto y gratuidad.
Podemos leer en este sentido, las palabras que Dios dirige al profeta Malaquías en la primera lectura. Él llama a los habitantes de Jerusalén «mi propiedad exclusiva» ( Ml 3,17) y dice al profeta: «tendré compasión de ellos, como un hombre tiene compasión de su hijo» ( íbid. ). Son expresiones que nos recuerdan el amor con el que el Señor, al llamarnos, nos ha precedido: una ocasión, en particular para ustedes, para hacer memoria de la gratuidad de su vocación, comenzando desde los orígenes de las congregaciones a las que pertenecen hasta el momento presente, desde los primeros pasos de su itinerario personal hasta este instante. Todos nosotros estamos aquí, ante todo, porque Él nos ha querido y elegido desde siempre.
“Pedir”, “buscar”, “llamar”, entonces, quiere decir también mirar hacia atrás la propia existencia, trayendo a la mente y al corazón todo lo que el Señor ha realizado, a lo largo de los años, para multiplicar los talentos, para acrecentar y purificar la fe, para hacer más generosa y libre la caridad. A veces esto ha sucedido en circunstancias alegres, otras veces por caminos más difíciles de entender, tal vez a través del crisol misterioso del sufrimiento. Siempre, sin embargo, en el abrazo de esa bondad paternal que caracteriza su actuar en nosotros y a través de nosotros, por el bien de la Iglesia (cf. Cost. dogm. Lumen Gentium , 43).
Y esto nos lleva a una segunda reflexión, sobre Dios como plenitud y sentido de nuestra vida: para ustedes, para nosotros, el Señor es todo. Lo es en distintos modos, ya sea como Creador y fuente de la existencia, como amor que llama e interpela, como fuerza que impulsa y anima a la donación. Sin Él nada existe, nada tiene sentido, nada vale, y el “pedir”, “buscar” y “llamar” de ustedes, tanto en la oración como en la vida, hacen referencia a esta verdad. San Agustín, a este propósito, describe la presencia de Dios en su existencia con imágenes bellísimas. Habla de una luz que trasciende el espacio, de una voz que no se ve abrumada por el tiempo, de un sabor que nunca se ve empañado por la voracidad, de un hambre que nunca se apaga con la saciedad, y concluye: «Esto es lo que amo cuando amo a mi Dios» (S. Augustín, Confesiones , 10,6.8). Son palabras de un místico, y aun así nos resultan cercanas, pues manifiestan la necesidad de infinito que habita en el corazón de todo hombre o mujer de este mundo. Precisamente por esto la Iglesia les confía la tarea de ser, con su despojarse de todo, testigos vivos del primado de Dios en su existencia, también ayudando lo más que puedan a los demás hermanos y hermanas que encontrarán para cultivar su amistad con Él.
Por lo demás, la historia nos enseña que de una experiencia de Dios brotan siempre impulsos generosos de caridad, como ha sucedido en la vida de sus fundadores y fundadoras, hombres y mujeres enamorados del Señor y por eso dispuestos a hacerse «todo para todos» ( 1Co 9,22), sin hacer distinciones, en los modos y ámbitos más variados.
Es verdad que también hoy, como en tiempos de Malaquías, hay quienes dicen: «Es inútil servir a Dios» ( Ml 3,14). Es un modo de pensar que lleva a una auténtica parálisis del alma, por la cual uno se contenta con una vida hecha de instantes fugaces, de relaciones superficiales e intermitentes, de modas pasajeras, todas ellas, cosas que dejan vacío el corazón. Para ser verdaderamente feliz, el hombre no necesita de eso, sino de experiencias de amor consistentes, duraderas, sólidas, y ustedes, con el ejemplo de su vida consagrada, como los árboles exuberantes de los que hemos cantado en el Salmo responsorial (cf. Sal 1,3), pueden difundir en el mundo el oxígeno de ese modo de amar.
Hay sin embargo una última dimensión de su misión sobre la que quisiera detenerme. Hemos escuchado al Señor decir a los habitantes de Jerusalén: «brillará el sol de justicia que trae la salud en sus rayos» ( Ml 3,20). Es decir, les invita a esperar en la realización de su destino que va más allá del presente. Esto evoca la dimensión escatológica de la vida cristiana, que nos quiere comprometidos en el mundo, pero al mismo tiempo constantemente orientados hacia la eternidad. Es una invitación a que ustedes extiendan el “pedir”, el “buscar” y el “llamar” de la oración y de la vida al horizonte eterno que transciende las realidades de este mundo, para orientarlas hacia el «domingo sin ocaso en el que la humanidad entrará en tu descanso» (Misal Romano, Prefacio X dominical del Tiempo Ordinario ). El Concilio Vaticano II, al respecto, les confía una misión específica, cuando afirma que los consagrados están llamados en modo particular a ser testigos de los “bienes futuros” (cf. Const. dogm. Lumen Gentium 44).
Queridos hermanos y hermanas, el Señor, al que han dado todo, les ha correspondido con tanta hermosura y riqueza, y yo quisiera exhortarles a atesorarlas y a cultivarlas, evocando como conclusión algunas expresiones de san Pablo VI : «conservad —escribía a los religiosos— la sencillez de los “más pequeños” del Evangelio. Sabed encontrarla en el íntimo y más cordial trato con Cristo o en el contacto directo con vuestros hermanos. Conoceréis entonces “el rebosar de gozo por la acción del Espíritu Santo” que es de aquellos que son introducidos en los secretos del Reino. No busquéis entrar a formar parte de aquellos “sabios y prudentes”, […] para quienes tales secretos están escondidos. Sed verdaderamente pobres, mansos, hambrientos de santidad, misericordiosos, puros de corazón; sed de aquellos, gracias a los cuales el mundo conocerá la paz de Dios» ( S. Pablo VI , Exhort. ap. Evangelica testificatio , 54).",2025-10-09_homilia_santa_misa_jubileo_de_la_vida_consagrada_9_de_octubre_de_2025
Discurso,2025-10-09,A los participantes en la conferencia de la Asociación MINDS International (9 de octubre de 2025),https://www.vatican.va/content/leo-xiv/es/speeches/2025/october/documents/20251009-minds-international.html,"DISCURSO DEL SANTO PADRE LEÓN XIV A LOS PARTICIPANTES EN LA CONFERENCIA DE LA ASOCIACIÓN MINDS INTERNATIONAL
Sala Clementina Jueves, 9 de octubre de 2025
[ Multimedia ]
____________________________________
En el nombre del Padre, del Hijo y del Espíritu Santo. Amén.
¡La paz esté con ustedes!
¡Queridos hermanos, queridas hermanas, bienvenidos, buenos días a todos!
Me dirijo a ustedes con gusto en estos días, en los que los eventos urgen al discernimiento y la responsabilidad, y se manifiesta el papel crucial de los medios de comunicación en la formación de las conciencias y del pensamiento crítico.
Podríamos definir una paradoja que en la era de la comunicación las agencias de información y de comunicación atraviesan un período de crisis. Y que también los usuarios de la información están en crisis, intercambiando a menudo lo falso por lo verdadero, lo que es auténtico con lo que es artificioso.
Y, sin embargo, nadie hoy debería poder decir ""no sabía"". Por esto los animo en su servicio, tan importante; y animo a los momentos de encuentro asociativo, que les permiten reflexionar juntos.
La información es un bien público que todos debemos proteger. Por lo tanto, lo que es realmente constructivo es la alianza entre los ciudadanos y los periodistas bajo el signo del compromiso con la responsabilidad ética y civil. Una forma de ciudadanía activa es estimar y sostener a los operadores y las agencias que demuestran seriedad y verdadera libertad en su trabajo. Entonces se verifica un círculo virtuoso que beneficia al cuerpo social.
Cada día hay reporteros que arriesgan sus vidas para que la gente pueda saber cómo están las cosas. Y en un tiempo como el nuestro, de conflictos violentos y difusos, muchos pierden la vida al cubrir noticias desde el terreno: víctimas de la guerra y de la ideología de la guerra, que quiere impedir a los periodistas estar allí. ¡No debemos olvidarlos! Si hoy sabemos qué ha sucedido en Gaza, en Ucrania y en cualquier otra tierra ensangrentada por las bombas, se lo debemos en buena parte a ellos. Pero estos testimonios extremos son la cima del tributo de fatiga diaria de muchísimos que trabajan para que la información no esté contaminada por otros fines, contrarios a la verdad y a la dignidad de la persona.
Como saben, en mi primer encuentro con los periodistas de todo el mundo, justo después del Cónclave, quise lanzar mi llamamiento para la liberación de sus colegas injustamente perseguidos y encarcelados por haber tratado de contar. Reitero hoy esta solicitud. Hacer periodismo no puede nunca ser considerado un delito, sino un derecho que proteger.
La información libre es un pilar que sostiene la construcción de nuestras sociedades y, por lo tanto, estamos llamados a defenderla y garantizarla.
Como ha subrayado el Papa Francisco , ""necesitamos empresarios valientes, ingenieros informáticos valientes, para que no se corrompa la belleza de la comunicación"" ( Discurso a los participantes en el Jubileo de la comunicación, 25 de enero de 2025 ). Es necesario liberar la comunicación de la contaminación cognitiva que la corrompe, de la competencia desleal, de la degradación del llamado clickbait . Las agencias de prensa están en primera línea, y deben actuar en el contexto comunicativo actual según principios -desafortunadamente no siempre compartidos- que conjugan la sostenibilidad económica de la empresa con la protección del derecho a una información correcta y plural.
Los periodistas de las agencias de prensa, por su parte, están llamados a ser los primeros en llegar y, a ser los primeros en dar la noticia. Y esto vale aún más en la era de la comunicación permanentemente en vivo, de la digitalización cada vez más invasiva de los medios de comunicación. Quien trabaja para una agencia, lo saben bien, está llamado a escribir con rapidez, bajo presión, también en situaciones muy complejas y dramáticas. A mayor razón, su servicio es precioso y debe ser un antídoto al proliferar de la información ""basura""; por lo tanto, requiere competencia, coraje y sentido ético.
No estamos destinados a vivir en un mundo donde la verdad ya no sea distinguible de la ficción. Al respecto, debemos plantearnos algunos importantes interrogantes.
Los algoritmos generan contenidos y datos en una dimensión y con una velocidad que no se había visto antes. Pero ¿quién los gobierna? La inteligencia artificial está cambiando la forma en que nos informamos y comunicamos, pero ¿quién la guía y con qué fines? Debemos vigilar para que la tecnología no se sustituya al ser humano, y para que la información y los algoritmos que hoy la gobiernan no estén en manos de pocos.
Queridos amigos, gracias por su trabajo. Felicitaciones por su reflexión sobre los desafíos que tienen por delante.
El mundo necesita una información libre, rigurosa, objetiva. Vale la pena recordar, en esta circunstancia, la advertencia de Hannah Arendt, según la cual ""el súbdito ideal del régimen totalitario no es el nazi convencido ni el comunista convencido, sino la persona para la que ya no hay diferencia entre realidad y ficción, entre lo verdadero y lo falso"" ( Los orígenes del totalitarismo ).
Con su trabajo, paciente y riguroso, ustedes pueden ser una barrera contra aquellos que, a través del arte antigua de la mentira, apuntan a crear confrontaciones para mandar dividiendo; un baluarte de civilidad frente a las arenas movedizas de la aproximación y de la posverdad.
La economía de la comunicación no puede ni debe separar su destino del compartir la verdad. Transparencia de las fuentes y de la propiedad, rendición de cuentas , calidad, objetividad son las claves para devolver a los ciudadanos su papel de protagonistas del sistema, convenciéndolos a exigir una información digna de este nombre. Les recomiendo: ¡no vendan nunca su autoridad!
El Espíritu de Dios, que es verdad y fuerza y, infunde mansedumbre y coraje, los sostenga. Y los acompañe mi bendición. Gracias.
_____________________ Boletín de la Oficina de Prensa de la Santa Sede, 9 de octubre de 2025",2025-10-09_discurso_a_los_participantes_en_la_conferencia_de_la_asociacion_minds_international_9_de_octubre_de_2025
