tipo,fecha,titulo,url,texto,filename
Audiencia,2025-10-08,"Audiencia general del 8 de octubre de 2025 Ciclo de catequesis - Jubileo 2025. Jesucristo, nuestra esperanza. III. La Pascua de Jesús. 10. Volver a encender. «¿No ardía acaso nuestro corazón, mientras nos hablaba en el camino y nos explicaba las Escrituras?». (Lc 24, 32)",https://www.vatican.va/content/leo-xiv/es/audiences/2025/documents/20251008-udienza-generale.html,"LEÓN XIV
AUDIENCIA GENERAL
Plaza de San Pedro Miércoles, 8 de octubre de 2025
[ Multimedia ]
___________________________________
Ciclo de catequesis - Jubileo 2025. Jesucristo, nuestra esperanza. III. La Pascua de Jesús. 10. Volver a encender. «¿No ardía acaso nuestro corazón, mientras nos hablaba en el camino y nos explicaba las Escrituras?». (Lc 24, 32)
Queridos hermanos y hermanas, ¡buenos días!
Hoy quisiera invitaros a reflexionar sobre un aspecto sorprendente de la resurrección de Cristo: su humildad. Si recordamos los relatos evangélicos, nos damos cuenta de que el Señor resucitado no hace nada espectacular para imponerse a la fe de sus discípulos. No aparece rodeado de huestes de ángeles, no hace gestos sensacionales, no pronuncia discursos solemnes para revelar los secretos del universo. Al contrario, se acerca discretamente, como un viandante cualquiera, como un hombre hambriento que pide compartir un poco de pan (cf. Lc 24,15.41).
María de Magdala lo confunde con un jardinero (cf. Jn 20,15). Los discípulos de Emaús creen que es un forastero (cf . Lc 24,18). Pedro y los demás pescadores creen que es un simple transeúnte (cf . Jn 21,4). Habríamos esperado efectos especiales, signos de poder, pruebas abrumadoras. Pero el Señor no busca eso: prefiere el lenguaje de la proximidad, de la normalidad, de la mesa compartida.
Hermanos y hermanas, en esto hay un mensaje precioso: la Resurrección no es un giro teatral, es una transformación silenciosa que llena de sentido cada gesto humano. Jesús resucitado come una porción de pescado delante de sus discípulos: no es un detalle marginal, es la confirmación de que nuestro cuerpo, nuestra historia, nuestras relaciones no son un envoltorio para tirar. Están destinados a la plenitud de la vida. Resucitar no significa convertirse en espíritus evanescentes, sino entrar en una comunión más profunda con Dios y con nuestros hermanos, en una humanidad transfigurada por el amor.
En la Pascua de Cristo, todo puede convertirse en gracia. Incluso las cosas más ordinarias: comer, trabajar, esperar, cuidar de la casa, apoyar a un amigo. La Resurrección no resta vida al tiempo y al esfuerzo, sino que cambia su sentido y su ""sabor"". Cada gesto realizado en gratitud y comunión anticipa el Reino de Dios.
Sin embargo, hay un obstáculo que a menudo nos impide reconocer esta presencia de Cristo en lo cotidiano: la pretensión de que la alegría debe ser sin heridas. Los discípulos de Emaús caminaban tristes porque esperaban otro final, un Mesías que no conociera la cruz. A pesar de haber oído que la tumba está vacía, son incapaces de sonreír. Pero Jesús está a su lado y, con paciencia, les ayuda a comprender que el dolor no es la negación de la promesa, sino el modo en que Dios ha manifestado la medida de su amor (cf. Lc 24, 13-27).
Cuando por fin se sientan a la mesa con Él y parten el pan, se les abren los ojos. Y se dan cuenta de que su corazón ya ardía, aunque no lo sabían (cf . Lc 24, 28-32). Esta es la mayor sorpresa: descubrir que bajo las cenizas del desencanto y del cansancio siempre hay un rescoldo vivo, a la espera de ser reavivado.
Hermanos y hermanas, la resurrección de Cristo nos enseña que no hay historia tan marcada por el desengaño o el pecado que no pueda ser visitada por la esperanza. Ninguna caída es definitiva, ninguna noche es eterna, ninguna herida está destinada a permanecer abierta para siempre. Por distantes, perdidos o indignos que nos sintamos, no hay distancia que pueda apagar la fuerza infalible del amor de Dios.
A veces pensamos que el Señor sólo viene a visitarnos en momentos de recogimiento o de fervor espiritual, cuando nos sentimos con fuerzas, cuando nuestra vida parece ordenada y luminosa. En cambio, el Resucitado se acerca en los lugares más oscuros: en nuestros fracasos, en las relaciones desgastadas, en los trabajos cotidianos que pesan sobre nuestros hombros, en las dudas que nos desaniman. Nada de lo que somos, ningún fragmento de nuestra existencia le es ajeno.
Hoy, el Señor resucitado viene junto a cada uno de nosotros, tal como recorremos nuestros caminos -los del trabajo y el compromiso, pero también los del sufrimiento y la soledad- y con infinita delicadeza nos pide que nos dejemos calentar el corazón. No se impone con clamores, no exige ser reconocido inmediatamente. Con paciencia espera el momento en que nuestros ojos se abran para ver su rostro amigo, capaz de transformar la decepción en confiada espera, la tristeza en gratitud, la resignación en esperanza.
El Resucitado sólo desea manifestar su presencia, hacerse nuestro compañero de camino y encender en nosotros la certeza de que su vida es más fuerte que cualquier muerte. Pidamos, pues, la gracia de reconocer su presencia humilde y discreta, de no esperar una vida sin pruebas, de descubrir que todo dolor, si es habitado por el amor, puede convertirse en lugar de comunión.
Y así, como los discípulos de Emaús, también nosotros volvemos a nuestras casas con un corazón que arde de alegría. Una alegría sencilla, que no borra las heridas, sino que las ilumina. Una alegría que nace de la certeza de que el Señor está vivo, que camina con nosotros y nos da en cada momento la posibilidad de recomenzar.
_________________
Saludos
Saludo cordialmente a los peregrinos de lengua española. Los invito a pedir la gracia de reconocer la presencia humilde y discreta de Dios en todos los momentos de nuestra vida, especialmente en los más difíciles. Que no haya nada que pueda arrebatarnos la alegría de experimentar a Cristo vivo. Que el Señor los bendiga. Muchas gracias.
_________________
Resumen leído por el Santo Padre en español
Queridos hermanos y hermanas:
En esta catequesis contemplamos un rasgo sorprendente del misterio de la Resurrección de Cristo, la humildad. El Señor resucitado no se manifiesta de manera espectacular, no irrumpe forzando la fe de los discípulos, al contrario, se acerca con discreción: mientras María Magdalena lo confunde con el jardinero, los discípulos de Emaús creían que era un forastero. De este modo, Jesús resucitado tiene gestos tan ordinarios como comer con sus discípulos un trozo de pescado.
Jesús, con su Resurrección, nos enseña, además, que ninguna caída es definitiva. Si bien la historia humana está herida por la desilusión y el pecado, por este misterio de amor tenemos la esperanza de que no existe nada, ni siquiera la muerte, que pueda separarnos del amor de Dios. A veces pensamos que Él está con nosotros sólo cuando las cosas van bien, sin embargo, nos acompaña también en los momentos más oscuros.",2025-10-08_audiencia_audiencia_general_del_8_de_octubre_de_2025_ciclo_de_catequesis_jubileo_2025_jesucristo_nuestra_esper
Discurso,2025-10-06,A los Caballeros de Colón (6 de octubre de 2025),https://www.vatican.va/content/leo-xiv/es/speeches/2025/october/documents/20251006-cavalieri-colombo.html,"DISCURSO DEL SANTO PADRE LEÓN XIV A LOS CABALLEROS DE COLÓN
Sala del Consistorio Lunes, 6 de octubre de 2025
[ Multimedia ]
____________________________________
En el nombre del Padre,
del Hijo y del Espíritu Santo.
¡La paz esté con ustedes!
Excelencia, queridos amigos,
Me complace darles la bienvenida esta mañana a todos ustedes, miembros del Consejo Directivo de los Caballeros de Colón, junto con sus familias que los acompañan esta mañana en su peregrinación en este Año Jubilar de la Esperanza. Qué importante es la palabra en sí misma: esperanza.
Decenas de millones de fieles han venido como ustedes a Roma en este Año Santo para visitar las tumbas de los Apóstoles, atravesar las Puertas Santas y fortalecerse en su fe. Una de las obras de arte del Vaticano que sin duda admiran al atravesar la Puerta Santa y entrar en la Basílica es el Baldaquino de Gian Lorenzo Bernini, que hoy resplandece en toda su belleza original tras la primera restauración completa de su historia. Otra, en el ábside de la Basílica, es el hermoso monumento de bronce de Bernini que protege la Cátedra de San Pedro, restaurado en el mismo período. Estas obras maestras ayudan a quienes las contemplan a meditar sobre dos de los principales pilares de nuestra fe: la presencia real de Jesús en la Eucaristía y el Papa como Sucesor de Pedro, que une y guía a la Iglesia.
Quisiera expresar mi profunda gratitud a ustedes, Caballeros de Colón, por su generosidad al hacer posibles estos proyectos. Son un signo visible de su constante devoción al Vicario de Cristo. A lo largo de su historia, la Orden ha apoyado de diversas maneras la labor caritativa del Romano Pontífice, incluso a través del Fondo Vicarius Christi, que le permite expresar su solidaridad con los pobres y los más vulnerables de todo el mundo.
A través de una serie de iniciativas promovidas por los Consejos locales, ustedes y sus hermanos Caballeros también tratan de llevar la compasión y el amor del Señor a sus comunidades locales, incluso a través de sus esfuerzos por defender la santidad de la vida humana en todas sus etapas, ayudar a las víctimas de guerras y desastres naturales y apoyar las vocaciones sacerdotales. Por estas acciones concretas, así como por sus oraciones y sacrificios diarios por el bien de todo el pueblo de Dios, expreso sinceramente mi más profundo agradecimiento.
Queridos hermanos y hermanas, les deseo una fructífera peregrinación y rezo para que su tiempo de estancia en Roma, la Ciudad Eterna, alimente su fe, les confirme en la esperanza y profundice su amor por la Iglesia. Que así puedan fortalecerse para continuar la admirable misión iniciada por su noble fundador.
Con estos sentimientos, los encomiendo a todos a la intercesión de Nuestra Señora, María, Madre de la Iglesia, y también del beato Michael McGivney, y les imparto de corazón mi bendición a cada uno de ustedes, a sus familias y a sus seres queridos. Muchas gracias. _________________
Boletín de la Oficina de Prensa de la Santa Sede, 6 de octubre de 2025",2025-10-06_discurso_a_los_caballeros_de_colon_6_de_octubre_de_2025
