tipo,fecha,titulo,url,texto,filename
Homilia,2025-06-08,"Domingo de Pentecostés – Santa Misa en el Jubileo de los Movimientos, Asociaciones y Nuevas Comunidades (8 de junio de 2025)",https://www.vatican.va/content/leo-xiv/es/homilies/2025/documents/20250608-omelia-pentecoste.html,"SANTA MISA EN LA SOLEMNIDAD DE PENTECOSTÉS JUBILEO DE LOS MOVIMIENTOS, DE LAS ASOCIACIONES Y DE LAS NUEVAS COMUNIDADES
CAPILLA PAPAL
HOMILÍA DEL SANTO PADRE LEÓN XIV
Plaza de San Pedro Domingo, 8 de junio de 2025
[ Multimedia ]
________________________________________
Hermanos y hermanas:
«Brilla para nosotros, hermanos, el día grato en que […] Jesucristo, el Señor, después de resucitado y glorificado por su ascensión, envió al Espíritu Santo» (S. Agustín, Sermo 271, 1). Y también hoy se reaviva lo que sucedió en el cenáculo; desciende sobre nosotros el don del Espíritu Santo como un viento impetuoso que sacude, como un fragor que nos despierta, como un fuego que nos ilumina (cf. Hch 2,1-11).
Como hemos escuchado en la primera lectura, el Espíritu lleva a cabo algo extraordinario en la vida de los Apóstoles. Ellos, después de la muerte de Jesús, se habían encerrado en el miedo y en la tristeza, pero ahora reciben finalmente una mirada nueva y una inteligencia del corazón que les ayuda a interpretar los eventos que han sucedido y a tener una íntima experiencia de la presencia del Resucitado: el Espíritu Santo vence su miedo, rompe las cadenas interiores, alivia las heridas, los unge con fortaleza y les da el valor de salir al encuentro de todos para anunciar las obras de Dios.
El texto de los Hechos de los Apóstoles nos dice que, en Jerusalén, en ese momento, había una multitud de las más variadas procedencias, y, aun así, «cada uno los oía hablar en su propia lengua» (v. 6). Y entonces, es así que en Pentecostés las puertas del cenáculo se abren porque el Espíritu abre las fronteras. Como afirma Benedicto XVI : «El Espíritu Santo da el don de comprender. Supera la ruptura iniciada en Babel —la confusión de los corazones, que nos enfrenta unos a otros», y abre las fronteras. […] La Iglesia debe llegar a ser siempre nuevamente lo que ya es:  debe abrir las fronteras entre los pueblos y derribar las barreras entre las clases y las razas. En ella no puede haber ni olvidados ni despreciados. En la Iglesia hay sólo hermanos y hermanas de Jesucristo libres ( Homilía de Pentecostés , 15 mayo 2005).
Esta es una imagen elocuente de Pentecostés sobre la que quisiera detenerme con ustedes para meditarla.
El Espíritu abre las fronteras, ante todo, dentro de nosotros. Es el Don que abre nuestra vida al amor. Y esta presencia del Señor disuelve nuestras durezas, nuestras cerrazones, los egoísmos, los miedos que nos paralizan, los narcisismos que nos hacen girar sólo en torno a nosotros mismos. El Espíritu Santo viene a desafiar, en nuestro interior, el riesgo de una vida que se atrofia, absorbida por el individualismo. Es triste observar como en un mundo donde se multiplican las ocasiones para socializar, corremos el riesgo de estar paradójicamente más solos, siempre conectados y sin embargo incapaces de “establecer vínculos”, siempre inmersos en la multitud, pero restando viajeros desorientados y solitarios.
El Espíritu de Dios, en cambio, nos hace descubrir un nuevo modo de ver y de vivir la vida. Nos abre al encuentro con nosotros mismos, más allá de las máscaras que llevamos puestas; nos conduce al encuentro con el Señor enseñándonos a experimentar su alegría; nos convence —según las mismas palabras de Jesús apenas proclamadas— de que sólo si permanecemos en el amor recibimos también la fuerza de observar su Palabra y, por tanto, de ser transformados por ella. Abre las fronteras en nuestro interior, para que nuestra vida se convierta en un espacio hospitalario.
El Espíritu abre también las fronteras en nuestras relaciones. En efecto, Jesús dice que este Don es el amor entre Él y el Padre que viene a habitar en nosotros. Y cuando el amor de Dios mora en nosotros, somos capaces de abrirnos a los hermanos, de vencer nuestras rigideces, de superar el miedo hacia el que es distinto, de educar las pasiones que se sublevan dentro de nosotros. Pero el Espíritu transforma también aquellos peligros más ocultos que contaminan nuestras relaciones, como los malentendidos, los prejuicios, las instrumentalizaciones. Pienso también —con mucho dolor— en los casos en que una relación se intoxica por la voluntad de dominar al otro, una actitud que frecuentemente desemboca en violencia, como desgraciadamente demuestran los numerosos y recientes casos de feminicidio.
El Espíritu Santo, en cambio, hace madurar en nosotros los frutos que ayudan a vivir relaciones auténticas y sanas: «amor, alegría y paz, magnanimidad, afabilidad, bondad y confianza» ( Gal 5,22). De este modo, el Espíritu expande las fronteras de nuestras relaciones con los demás y nos abre a la alegría de la fraternidad. Y este es un criterio decisivo también para la Iglesia; somos verdaderamente la Iglesia del Resucitado y los discípulos de Pentecostés sólo si entre nosotros no hay ni fronteras ni divisiones, si en la Iglesia sabemos dialogar y acogernos mutuamente integrando nuestras diferencias, si como Iglesia nos convertimos en un espacio acogedor y hospitalario para todos.
Para concluir, el Espíritu abre las fronteras también entre los pueblos . En Pentecostés los Apóstoles hablan las leguas de aquellos que encuentran y el caos de Babel es finalmente apaciguado por la armonía generada por el Espíritu. Las diferencias, cuando el Soplo divino une nuestros corazones y nos hace ver en el otro el rostro de un hermano, no son ocasión de división y de conflicto, sino un patrimonio común del que todos podemos beneficiarnos, y que nos pone a todos en camino, juntos, en la fraternidad.
El Espíritu rompe las fronteras y abate los muros de la indiferencia y del odio, porque “nos enseña todo” y nos “recuerda las palabras de Jesús” (cf. Jn 14,26); y, por eso, lo primero que enseña, recuerda e imprime en nuestros corazones es el mandamiento del amor, que el Señor ha puesto en el centro y en la cima de todo. Y donde hay amor no hay espacio para los prejuicios, para las distancias de seguridad que nos alejan del prójimo, para la lógica de la exclusión que vemos surgir desgraciadamente también en los nacionalismos políticos.
Precisamente celebrando Pentecostés, el Papa Francisco observaba que «Hoy en el mundo hay mucha discordia, mucha división. Estamos todos conectados y, sin embargo, nos encontramos desconectados entre nosotros, anestesiados por la indiferencia y oprimidos por la soledad» ( Homilía , 28 mayo 2023). Y de todo esto son una trágica señal las guerras que agitan nuestro planeta. Invoquemos el Espíritu de amor y de paz, para que abra las fronteras, abata los muros, disuelva el odio y nos ayude a vivir como hijos del único Padre que está en el cielo.
Hermanos y hermanas: ¡Por Pentecostés se renueva la Iglesia y el mundo! Que el viento vigoroso del Espíritu venga sobre nosotros y dentro de nosotros, abra las fronteras del corazón, nos dé la gracia del encuentro con Dios, amplíe los horizontes del amor y sostenga nuestros esfuerzos para la construcción de un mundo donde reine la paz.
Que María Santísima, Mujer de Pentecostés, Virgen visitada por el Espíritu, Madre llena de gracia, nos acompañe e interceda por nosotros.",2025-06-08_homilia_domingo_de_pentecostes_santa_misa_en_el_jubileo_de_los_movimientos_asociaciones_y_nuevas_comunidades_8_de_junio_de_2025
Angelus,2025-06-08,"Regina Caeli, 8 de junio de 2025",https://www.vatican.va/content/leo-xiv/es/angelus/2025/documents/20250608-regina-caeli.html,"PAPA LEÓN XIV
REGINA CAELI
Plaza de San Pedro Domingo, 8 de junio de 2025
[ Multimedia ]
________________________________________
Antes de concluir esta celebración , dirijo un afectuoso saludo a todos ustedes que han participado y también a cuantos se han conectado a través de los medios de comunicación.
Mi agradecimiento va a los señores cardenales y obispos presentes y a todos los representantes de las asociaciones y movimientos eclesiales y de las nuevas comunidades. Queridas hermanas y queridos hermanos, con la fuerza del Espíritu Santo, partan renovados de este Jubileo dedicado a ustedes. ¡Vayan y lleven a todos la esperanza del Señor Jesús!
Italia y otros países concluyen en estos días el año escolar. Deseo saludar a los jóvenes y a todos los estudiantes y profesores, especialmente a los estudiantes que en los próximos días realizarán los exámenes al final del ciclo de estudios.
Y ahora, por intercesión de la Virgen María, supliquemos al Espíritu Santo el don de la paz. Ante todo, la paz en los corazones: sólo un corazón pacífico puede difundir la paz en la familia, en la sociedad, en las relaciones internacionales. Que el Espíritu de Cristo resucitado abra caminos de reconciliación dondequiera que haya guerra; ilumine a los gobernantes y les dé el valor de realizar gestos de distensión y diálogo.",2025-06-08_angelus_regina_caeli_8_de_junio_de_2025
Discurso,2025-06-07,A los participantes en el Simposio Ecuménico dedicado al 1700º aniversario del Concilio de Nicea (7 de junio de 2025),https://www.vatican.va/content/leo-xiv/es/speeches/2025/june/documents/20250607-simposio-nicea.html,"DISCURSO DEL SANTO PADRE LEÓN XIV A LOS PARTICIPANTES EN EL SIMYMPOSIO “NICEA Y LA IGLESIA DEL TERCER MILENIO: HACIA LA UNIDAD CATÓLICO-ORTODOXA”
[Pontificia Universidad de Santo Tomás de Aquino, 4-7 de junio de 2025]
Sala Clementina Sábado, 7 de junio de 2025
[ Multimedia ]
___________________________________
¡La paz esté con ustedes!
Eminencias, Excelencias, distinguidos Profesores, queridos hermanos y hermanas en Cristo.
Les doy la más cordial bienvenida a todos ustedes que participan en el Simposio “Nicea y la Iglesia del Tercer Milenio: Hacia la Unidad Católico-Ortodoxa” , organizado conjuntamente por el Œcumenicum ― Instituto para Estudios Ecuménicos del Angelicum― y la Asociación Internacional Teológica Ortodoxa. Saludo especialmente a los representantes de las Iglesias ortodoxas y orientales, muchos de los cuales me honraron con su presencia en la Misa de inauguración de mi pontificado .
Antes de continuar con los comentarios normales, quisiera disculparme por llegar un poco tarde, y también pedirles que tengan paciencia conmigo. Aún no llevo ni un mes en el nuevo trabajo, así que me queda mucho por aprender. Pero estoy muy contento de estar con ustedes esta mañana.
Me alegra ver que el Simposio esté firmemente orientado hacia el futuro. El Concilio de Nicea no es sólo un evento del pasado sino también una brújula que debe seguir sirviéndonos de guía hacia la plena unidad visible de los cristianos. El primer Concilio ecuménico es fundamental para el itinerario común que católicos y ortodoxos han emprendido juntos desde el Concilio Vaticano II . Para las Iglesias orientales, que conmemoran esa celebración en sus calendarios litúrgicos, el Concilio de Nicea no es simplemente un concilio entre otros o el primero de una serie, sino el Concilio por excelencia , que promulgó la norma de la fe cristiana, la confesión de fe de los “318 Padres” (cf. Jesucristo, Hijo de Dios, Salvador , n. 43).
Los tres temas de este Simposio son particularmente relevantes para nuestro camino ecuménico. En primer lugar, la fe de Nicea . Como la Comisión Teológica Internacional ha puesto de relieve en su reciente Documento con motivo del 1700º aniversario de Nicea , el año 2025 representa «una oportunidad inestimable para subrayar que lo que tenemos en común es mucho más fuerte, cuantitativa y cualitativamente, que lo que nos divide: todos creemos en el Dios Trinidad, en Cristo verdadero hombre y verdadero Dios, en la salvación en Jesucristo, según las Escrituras interpretadas en la Iglesia y bajo la moción del Espíritu Santo. Todos creemos en la Iglesia, el bautismo, la resurrección de los muertos y la vida eterna» ( Ídem ). Estoy convencido de que volviendo al Concilio de Nicea y aprovechando juntos esta fuente común, seremos capaces de ver bajo una óptica diferente los puntos que todavía nos separan. A través del diálogo teológico y con la ayuda de Dios, obtendremos una mejor comprensión del misterio que nos une. Celebrando juntos esta fe de Nicea y proclamándola juntos , avanzaremos hacia el restablecimiento de la completa comunión entre nosotros.
El segundo tema del Simposio es la sinodalidad . El Concilio de Nicea inauguró un camino sinodal que la Iglesia debe seguir para tratar las cuestiones teológicas y canónicas, a nivel universal. La contribución de los delegados fraternos de las Iglesias y comunidades eclesiales de oriente y de occidente en el reciente Sínodo sobre la Sinodalidad que se tuvo aquí en el Vaticano, fue un valioso estímulo para una más amplia reflexión sobre la naturaleza y la práctica de la sinodalidad. El documento final del Sínodo notaba que «el diálogo ecuménico es fundamental para desarrollar una comprensión de la sinodalidad y de la unidad de la Iglesia. Nos empuja a imaginar prácticas sinodales auténticamente ecuménicas, incluso hasta formas de consulta y discernimiento sobre cuestiones urgentes de interés común» ( Por una Iglesia sinodal: comunión, participación y misión , n. 138). Tengo la esperanza de que la preparación y la conmemoración conjunta del 1700º aniversario del Concilio de Nicea será una ocasión providencial «para profundizar y confesar juntos la fe cristológica y poner en práctica formas de sinodalidad entre los cristianos de todas las tradiciones» (cf. Íbid ., n. 139).
El Simposio tiene un tercer tema relacionado con la fecha de la Pascua . Como sabemos, uno de los objetivos del Concilio de Nicea fue establecer una fecha común para la Pascua, con el fin de expresar la unidad de la Iglesia en toda la oikoumene. Lamentablemente, la diferencia en sus calendarios ya no permite a los cristianos celebrar juntos la fiesta más importante del año litúrgico, lo que provoca problemas pastorales en las comunidades, divide a las familias y debilita nuestra credibilidad como testigos del Evangelio. Se han propuesto varias soluciones concretas que, respetando el principio de Nicea, permitirían a los cristianos celebrar juntos la “Fiesta de las fiestas”. En este año, en el que todos los cristianos han celebrado la Pascua el mismo día, quisiera reafirmar la apertura de la Iglesia católica para buscar una solución ecuménica que favorezca una celebración común de la resurrección del Señor, dando así mayor fuerza misionera a nuestra proclamación del “el nombre de Jesús y la salvación que nace de la fe en la verdad salvífica del Evangelio” ( Discurso a las Obras Misionales Pontificias , 22 mayo 2025).
Hermanos y hermanas, en esta víspera de Pentecostés, recordemos que la unidad que anhelan los cristianos no será fruto, ante todo, de nuestros propios esfuerzos, ni se realizará mediante un modelo o esquema preconcebido. Más bien, la unidad será un don recibido “como Cristo quiere y por los medios que Él quiere” (cf. Oración por la Unidad del Padre Paul Couturier ), mediante la acción del Espíritu Santo. Por eso, los invito ahora a ponerse de pie y recemos juntos para suplicar el don de la unidad del Espíritu. La oración que voy a recitar a continuación, en la que se implora la unidad del Espíritu, está tomada de la tradición oriental:
“Rey celestial, Consolador, Espíritu de la Verdad, que estás en todas partes y todo lo llenas, Tesoro de bienes y Dador de la vida, ven y mora en nosotros, y purifícanos de toda mancha Tú, que eres bueno, salva nuestras almas"". Amén
Que la bendición de Dios todopoderoso, Padre, Hijo y Espíritu Santo descienda sobre ustedes y permanezca siempre. Amén
Muchas gracias.",2025-06-07_discurso_a_los_participantes_en_el_simposio_ecumenico_dedicado_al_1700o_aniversario_del_concilio_de_nicea_7_de_junio_de_2025
Homilia,2025-06-07,Jubileo de los Movimientos - Vigilia de Pentecostés (7 de junio de 2025),https://www.vatican.va/content/leo-xiv/es/homilies/2025/documents/20250607-veglia-pentecoste.html,"VIGILIA DE PENTECOSTÉS CON MOVIMIENTOS, ASOCIACIONES Y NUEVAS COMUNIDADES
HOMILÍA DEL SANTO PADRE LEÓN XIV
Plaza de San Pedro Sábado, 7 de junio de 2025
[ Multimedia ]
___________________________________
Queridas hermanas y hermanos,
El Espíritu creador, que hemos invocado con el canto — Veni creator Spiritus— , es el Espíritu que descendió sobre Jesús, el protagonista silencioso de su misión: «El Espíritu del Señor está sobre mí» ( Lc 4,18). Pidiéndole que visite nuestras mentes, multiplique los lenguajes, encienda los sentidos, infunda el amor, reconforte los cuerpos y done la paz, nos hemos abierto a acoger el Reino de Dios. Es esta la conversión según el Evangelio: encaminarnos hacia el Reino que ya está cerca.
En Jesús vemos y de Jesús escuchamos que todo se transforma, porque Dios reina, porque Dios está cerca. En esta vigilia de Pentecostés nos encontramos íntimamente vinculados por la proximidad de Dios, por su Espíritu que une nuestras historias a la de Jesús. Estamos involucrados en las cosas nuevas que Dios hace, para que su voluntad de vida se cumpla y prevalezca sobre la voluntad de muerte.
«Me ha consagrado por la unción. Él me envió a llevar la Buena Noticia a los pobres, a anunciar la liberación a los cautivos y la vista a los ciegos, a dar la libertad a los oprimidos y proclamar un año de gracia del Señor» ( Lc 4,18-19). Percibimos aquí el perfume del crisma con el que fue marcada nuestra frente. El Bautismo y la Confirmación, queridos hermanos y hermanas, nos han unido a la misión transformadora de Jesús, al Reino de Dios. Como el amor nos hace familiar el olor de una persona querida, así reconocemos esta noche los unos en los otros el perfume de Cristo. Es un misterio que sorprende y nos hace pensar.
En Pentecostés María, los Apóstoles, las discípulas y los discípulos que con ellos fueron colmados con un Espíritu de unidad, que radicaba para siempre sus diversidades en el único Señor Jesucristo. No muchas misiones, sino una única misión. No introvertidos y belicosos, sino extrovertidos y luminosos. Esta Plaza de San Pedro, que es como un abrazo abierto y acogedor, expresa magníficamente la comunión de la Iglesia, experimentada por cada uno de ustedes en las distintas experiencias asociativas y comunitarias, muchas de las cuales representan frutos del Concilio Vaticano II .
La tarde de mi elección , mirando con conmoción al pueblo de Dios aquí reunido, recordé la palabra “sinodalidad”, que expresa felizmente el modo en el cual el Espíritu modela la Iglesia. En esta palabra resuena el syn —que quiere decir con — que constituye el secreto de la vida de Dios. Dios no es soledad. Dios es “con” en sí mismo —Padre, Hijo y Espíritu Santo— y es Dios con nosotros. Al mismo tiempo, sinodalidad nos recuerda el camino — odós — porque donde está el Espíritu hay movimiento, hay camino. Somos un pueblo en camino. Esta conciencia no nos aleja, sino que nos sumerge en la humanidad, como levadura en la masa, que la fermenta toda. El año de gracia del Señor, del que es expresión el Jubileo, tiene en sí este fermento. En un mundo quebrantado y sin paz el Espíritu Santo nos educa a caminar juntos. La tierra descasará, la justicia se afirmará, los pobres se alegrarán y la paz volverá si dejamos de movernos como predadores y comenzamos a hacerlo como peregrinos. Ya no cada uno por su cuenta, sino armonizando nuestros pasos con los pasos de los demás. No consumiendo el mundo con voracidad, sino cultivándolo y custodiándolo, como nos enseña la Encíclica Laudato si’ .
Queridos hermanos y hermanas, Dios ha creado el mundo para que nosotros estuviésemos juntos. “Sinodalidad” es el nombre eclesial de esta conciencia. Es el camino que pide a cada uno reconocer la propia deuda y el propio tesoro, sintiéndose parte de una totalidad, fuera de la cual todo se marchita, incluso el más original de los carismas. Miren: toda la creación existe sólo en la modalidad del existir juntos, a veces peligroso, pero aun así juntos siempre (cf. Carta enc., Laudato si’ 16 ; 117 ). Y esto que nosotros llamamos “historia” toma forma sólo en la modalidad de reunirse, de una convivencia, frecuentemente en medio de disensos, pero aun así una convivencia. Lo contrario es mortal y desgraciadamente está ante nuestros ojos cada día. Que sus agregaciones y comunidades sean entonces lugares donde se practique la fraternidad y la participación, no sólo en cuanto lugares de encuentro, sino en cuanto lugares de espiritualidad. El Espíritu de Jesús cambia al mundo, porque cambia los corazones. Inspira, en efecto, esa dimensión contemplativa de la vida que aleja la autoafirmación, la murmuración, el espíritu de controversia, el dominio de las conciencias y de los recursos. El Señor es el Espíritu y donde está el Espíritu del Señor hay libertad (cf. 2 Co 3,17). La auténtica espiritualidad nos compromete, por tanto, al desarrollo humano integral, actualizando entre nosotros la palabra de Jesús. Donde esto sucede hay alegría. Alegría y esperanza.
La evangelización, queridos hermanos y hermanas, no es una conquista humana del mundo, sino la infinita gracia que se difunde a través de vidas transformadas por el Reino de Dios. Es el camino de las bienaventuranzas, un itinerario que recorremos juntos, en continua tensión entre el “ya” y el “todavía no”, hambrientos y sedientos de justicia, pobres de espíritu, misericordiosos, mansos, puros de corazón, que trabajan por la paz. Para seguir a Jesús en este camino que Él ha elegido no sirven poderosos protectores, compromisos mundanos o estrategias emocionales. La evangelización es obra de Dios y, si a veces pasa a través de nuestras personas, es por los vínculos que hace posible. Estén por tanto profundamente ligados a cada una de las Iglesias particulares y a las comunidades parroquiales donde alimentan y gastan sus carismas. Cerca de sus obispos y en sinergia con todos los otros miembros del Cuerpo de Cristo actuaremos, entonces, en armoniosa sintonía. Los desafíos que la humanidad enfrenta serán menos espantosos, el futuro será menos oscuro, el discernimiento menos difícil, si juntos obedeciéramos al Espíritu.
Que María, Reina de los Apóstoles y Madre de la Iglesia, interceda por nosotros.",2025-06-07_homilia_jubileo_de_los_movimientos_vigilia_de_pentecostes_7_de_junio_de_2025
