tipo,fecha,titulo,url,texto,filename
Discurso,2025-06-06,A los participantes en los siguientes Capítulos Generales: Sociedad de Misiones Africanas; Tercera Orden Regular de San Francisco; Formadores de los Siervos del Paráclito (6 de junio de 2025),https://www.vatican.va/content/leo-xiv/es/speeches/2025/june/documents/20250606-capitoli-generali.html,"DISCURSO DEL SANTO PADRE LEÓN XIV A LOS PARTICIPANTES EN LOS SIGUIENTES CAPITULOS GENERALES: SOCIEDAD DE MISIONES AFRICANAS; TERCERA ORDEN REGULAR DE SAN FRANCISCO; FORMADORES DE LOS SIERVOS DEL PARÁCLITO
Sala del Consistorio Viernes, 6 de junio de 2025
[ Multimedia ]
___________________________________
En el nombre del Padre, del Hijo y del Espíritu Santo.
¡La paz esté con ustedes!
Queridos hermanos y hermanas, ¡bienvenidos!
Saludo a los Superiores Generales presentes, especialmente a los recién elegidos, a los miembros de los órganos de gobierno y a todos ustedes, pertenecientes a la Tercera Orden Regular de San Francisco – ¿quién es el nuevo General? ¿Ya ha sido reelegido? Ah, todavía no, bien; también a la Sociedad de las Misiones Africanas y al Instituto de los Siervos del Paráclito .
Muchos de ustedes vienen a este encuentro en el contexto del Capítulo General, en un momento importante para su vida y para la de toda la Iglesia. Recemos, pues, ante todo al Señor por sus Institutos y por todas las personas consagradas, para que «teniendo como único fin y por encima de todo a Dios, unan la contemplación, con la que se adhieren a Dios con la mente y con el corazón, y el ardor apostólico, con el que se esfuerzan por colaborar en la obra de la redención» (Conc. Ecum. Vat. II, Decr. Perfectae caritatis , 5).
Ustedes aquí representan tres realidades carismáticas nacidas en momentos diferentes de la historia de la Iglesia, en respuesta a necesidades contingentes de diversa índole, pero unidas y complementarias en la armoniosa belleza del Cuerpo místico de Cristo (cf. Id., Const. dogm. Lumen gentium , 7).
La fundación más antigua, entre las aquí presentes, es la de la Tercera Orden Regular de San Francisco , cuyos inicios se remontan al mismo Santo de Asís, salvo la elevación a Orden que tuvo lugar posteriormente por obra del Papa Nicolás V (cf. Bula Pastoralis officii , 20 de julio de 1447). Los temas que abordan en el 113º Capítulo General —la vida común, la formación y las vocaciones— conciernen en cierta medida a toda la gran Familia de Dios. Sin embargo, es importante que, como dice el título que han dado a sus trabajos, los aborden a la luz de su carisma «penitencial». Esto nos recuerda, en efecto, que, según las propias palabras de San Francisco, solo a través de un camino constante de conversión podemos ofrecer a los hermanos «las fragantes palabras de nuestro Señor Jesucristo» ( Primera carta a los fieles , 19).
De fecha más reciente es la Sociedad de Misiones Africanas , fundada el 8 de diciembre de 1856 por el venerable obispo Melchior de Marion Brésillac, signo de esa misión que está en el corazón mismo de la vida de la Iglesia (cf. Francisco, Exhort. Ap. Evangelii gaudium , 273). La historia de su Instituto, queridos hermanos, da buen testimonio de esta verdad: la fidelidad a la misión, en efecto, les ha permitido superar a lo largo del tiempo mil dificultades internas y externas a sus comunidades y les ha hecho crecer, sacando de las adversidades la ocasión y la inspiración para partir hacia nuevos horizontes apostólicos en África y luego en otras partes del mundo. A este respecto, es muy hermosa la exhortación que les dejó el fundador de mantenerse fieles, en el anuncio, a la sencillez de la predicación apostólica y, al mismo tiempo, siempre dispuestos a abrazar la «locura de la Cruz» (cf. 1 Cor 1, 17-25): sencillos y tranquilos, incluso ante las incomprensiones y las burlas del mundo. Libres de cualquier condicionamiento porque «llenos» de Cristo, y capaces de llevar a los hermanos al encuentro con Él porque animados por una única aspiración: anunciar a todo el mundo su Evangelio (cf. Flp 1,12-14.21). ¡Qué gran signo para toda la Iglesia y para todo el mundo!
Y llegamos al instituto de fundación más reciente: los Siervos del Paráclito . Siervos de ese Espíritu que habita en nosotros (cf. Rom 8,9) por el don del Bautismo y que sana « quod est saucium », es decir, lo que está herido, como cantaremos dentro de unos días en la secuencia de Pentecostés. Siervos del Espíritu que sana: así los quiso el padre Gerald Fitzgerald, que en 1942 inició su obra de atención a los sacerdotes en dificultad, « Pro Christo sacerdote », como dice su lema (cf. Constituciones , 4,4). Desde entonces, en diversas partes del mundo, llevan a cabo su ministerio de cercanía humilde, paciente, delicada y discreta hacia personas profundamente heridas, proponiéndoles itinerarios terapéuticos que, junto a una vida espiritual sencilla e intensa, personal y comunitaria, acompañan de una asistencia profesional altamente cualificada y diferenciada según las necesidades. Su presencia también nos recuerda algo importante: que todos nosotros, aunque llamados a ser ministros de Cristo, médicos de almas (cf. Lc 5, 31-32) para nuestros hermanos y hermanas, somos ante todo enfermos que necesitan curación. Como dice san Agustín, utilizando la imagen de una barca, todos nosotros «en esta vida tenemos como hendiduras propias de nuestra mortalidad y fragilidad, por las que entra el pecado desde las olas de este siglo» ( Discurso 278 , 13,13). Y el santo obispo de Hipona propone un remedio para el mal: «Para vaciarnos y no hundirnos —dice—, pongamos mano... a esta exhortación... ¡Perdonemos!» ( ibíd. ). Perdonemos, porque en todas partes, «en nuestras parroquias, en las comunidades, en las asociaciones y en los movimientos, en definitiva, en todas partes donde haya cristianos, todos [...] [puedan] encontrar un oasis de misericordia» (Francisco, Bula Misericordiae Vultus , 11 de abril de 2015, 12).
Queridos, gracias por su visita, que hoy en esta sala nos muestra a la Iglesia en tres dimensiones luminosas de su belleza: el compromiso de la conversión, el entusiasmo de la misión y el calor de la misericordia. Gracias por el gran trabajo que realizan en todo el mundo. Los bendigo y rezo por ustedes, en esta novena de Pentecostés, para que sean cada vez más instrumentos dóciles del Espíritu Santo según los designios de Dios. Gracias. __________________________________ Boletín de la Oficina de Prensa de la Santa Sede , 6 de junio de 2025",2025-06-06_discurso_a_los_participantes_en_los_siguientes_capitulos_generales_sociedad_de_misiones_africanas_tercera_orden_regular_de_san_francisco_formadores_de_los_siervos_del_paraclito_6_de_junio_de_2025
Discurso,2025-06-05,A los Superiores y Oficiales de la Secretaría de Estado (5 de junio de 2025),https://www.vatican.va/content/leo-xiv/es/speeches/2025/june/documents/20250605-segreteria-distato.html,"DISCURSO DEL SANTO PADRE LEÓN XIV A LOS SUPERIORES Y A LOS OFICIALES DE LA SECRETARÍA DE ESTADO
Sala Clementina Jueves, 5 de junio de 2025
[ Multimedia ]
___________________________________
Eminencia, señor Cardenal Parolin ,
Excelencias, queridos hermanos en el episcopado y en el sacerdocio,
queridas hermanas y queridos hermanos.
Agradezco ante todo al Secretario de Estado por estas palabras de introducción que ha pronunciado, y por la continua colaboración que me está ofreciendo mientras realizo los primeros pasos de este Pontificado.
Estoy muy contento de encontrarme con ustedes, que ofrecen un precioso servicio a la vida de la Iglesia ayudándome a sacar adelante la misión que me ha sido confiada. En efecto, como afirma la Praedicate Evangelium , la Secretaría de Estado , en cuanto secretaría papal regida por el Secretario de Estado, ayuda de cerca al Romano Pontífice en el ejercicio de su suprema misión (cf. art. 44-45).
Me consuela saber que no estoy solo y que comparto la responsabilidad de mi ministerio universal junto con ustedes.
No está en el texto, pero digo muy sinceramente que en estas pocas semanas ―aún no se ha cumplido un mes de mi servicio en este ministerio petrino―, está claro que el Papa solo no puede ir adelante y que es necesario, es muy necesario, poder contar con la colaboración de muchos en la Santa Sede, pero de manera especial con todos ustedes, de la Secretaría de Estado. Se lo agradezco de corazón.
La historia de esta Institución se remonta, como sabemos, a finales del siglo XV. Con el tiempo, ha ido asumiendo un rostro cada vez más universal y se ha ampliado considerablemente, con una progresión que la ha llevado a asumir nuevas tareas, a causa de las nuevas exigencias tanto en el ámbito eclesial como en las relaciones con los Estados y las Organizaciones internacionales. Actualmente, casi la mitad de ustedes son laicos. Y las mujeres, laicas y religiosas, son más de cincuenta.
Este desarrollo ha hecho que hoy la Secretaría de Estado refleje en sí misma el rostro de la Iglesia. Se trata de una gran comunidad que trabaja junto con el Papa: juntos compartimos las interrogantes, las dificultades, los desafíos y las esperanzas del Pueblo de Dios, presentes en el mundo entero. Lo hacemos expresando siempre dos dimensiones esenciales: la encarnación y la catolicidad .
Estamos encarnados en el tiempo y en la historia, porque si Dios ha elegido el camino humano y el lenguaje de los hombres, también la Iglesia está llamada a seguir esta senda, de manera que la alegría del Evangelio pueda alcanzar a todos y sea transmitida a las culturas y a los lenguajes actuales. Y, al mismo tiempo, tratamos de mantener siempre una mirada católica, universal, que nos permita valorar las diversas culturas y sensibilidades. De este modo podremos ser un centro promotor, comprometido en la construcción de la comunión entre la Iglesia de Roma y las Iglesias locales, así como con las relaciones de amistad dentro de la comunidad internacional.
En las últimas décadas, estas dos dimensiones —estar encarnados en el tiempo y tener una mirada universal— se han vuelto más constitutivas del trabajo de la Curia. Hacia este camino nos ha llevado la reforma de la Curia Romana llevada a cabo por san Pablo VI , el cual, inspirándose en la visión del Concilio Vaticano II , percibió con fuerza la urgencia de que la Iglesia estuviera atenta a los desafíos de la historia, considerando «el ritmo sumamente acelerado de la vida actual» y cómo han «cambiado las circunstancias de nuestros tiempos» ( Regimini Ecclesiae universae , 15 agosto 1967). Al mismo tiempo, él subrayó la necesidad de un servicio que exprese la catolicidad de la Iglesia y, con ese propósito, dispuso que «todos los que ayuden a la Sede Apostólica en su gobierno, sean llamados de todas partes» ( ibíd .).
Mientras que la encarnación nos lleva a lo concreto de la realidad y a temas específicos y particulares, tratados por los distintos organismos de la Curia, la universalidad, recordando el misterio de la unidad multiforme de la Iglesia, nos pide un trabajo de síntesis que pueda ayudar a la acción del Papa. Y el vínculo de conjunción y de síntesis, es precisamente la Secretaría de Estado. Por eso, san Pablo VI —experto en la Curia Romana— quiso dar a esta Oficina una nueva estructura, constituyéndola de hecho como un punto de conexión y, consecuentemente, estableciéndola en su rol fundamental de coordinación de los Dicasterios y de las Instituciones de la Sede Apostólica.
Este rol de coordinación de la Secretaría de Estado se retoma en la reciente Constitución Apostólica Praedicate Evangelium , entre las múltiples tareas confiadas a la Sección para los Asuntos Generales, bajo la dirección del Sustituto con la ayuda del Asesor (cf. art. 45-46). Junto a la Sección para los Asuntos Generales, la misma Constitución identifica a la Sección para las Relaciones con los Estados y Organismos Internacionales, guiada por el Secretario con la ayuda de dos Subsecretarios, a la que corresponde el cuidado de las relaciones diplomáticas y políticas de la Sede Apostólica con los Estados y demás sujetos de derecho internacional en este delicado momento de la historia. La Sección para el Personal Diplomático de la Santa Sede, con su Secretario y el Subsecretario, trabaja en cambio en el cuidado de las Representaciones Pontificias y de los Miembros del Cuerpo Diplomático aquí en Roma y el mundo.
Sé que estas tareas son muy exigentes y, algunas veces, pueden ser incomprendidas. Por ello, quisiera expresarles mi cercanía y, sobre todo, mi profunda gratitud. Gracias por las competencias que ponen a disposición de la Iglesia, por su trabajo casi siempre escondido y por el espíritu evangélico que lo inspira. Y permítanme, precisamente por este reconocimiento que hago, dirigirles una exhortación refiriéndome una vez más a san Pablo VI: que este lugar no sea contaminado por las ambiciones y antagonismos, al contrario, sean una verdadera comunidad de fe y de caridad, «de hermanos y de hijos del Papa», que se desviven generosamente por el bien de la Iglesia (cf. Discurso a la Curia Romana , 21 septiembre 1963).
Los encomiendo a todos a la intercesión de la Santísima Virgen María, Madre de la Iglesia. Y, mientras les agradezco ―porque sé que rezan por mí todos los días, y lo espero tanto―, los bendigo de todo corazón; a ustedes, a sus seres queridos y a su trabajo. Muchas gracias.",2025-06-05_discurso_a_los_superiores_y_oficiales_de_la_secretaria_de_estado_5_de_junio_de_2025
