tipo,fecha,titulo,url,texto,filename
Ángelus,2025-07-06,"Ángelus, 6 de julio de 2025",https://www.vatican.va/content/leo-xiv/es/angelus/2025/documents/20250706-angelus.html,"PAPA LEÓN XIV
ÁNGELUS
Plaza de San Pedro Domingo, 6 de julio de 2025
[ Multimedia ]
________________________________________
Queridos hermanos y hermanas, ¡feliz domingo!
El Evangelio de hoy ( Lc 10,1-12.17-20) nos recuerda la importancia de la misión, a la que todos estamos llamados, cada uno según su vocación y en las situaciones concretas en las que el Señor lo ha puesto.
Jesús envía a setenta y dos discípulos (v. 1). Este número simbólico indica que la esperanza del Evangelio está destinada a todos los pueblos. Tal es la amplitud del corazón de Dios: su abundante cosecha, es decir, la obra que Él realiza en el mundo para que todos sus hijos sean alcanzados por su amor y sean salvados.
Al mismo tiempo, Jesús dice: «La cosecha es abundante, pero los trabajadores son pocos. Rueguen al dueño de los sembrados que envíe trabajadores para la cosecha» (v. 2).
Por un lado, Dios, como un sembrador, ha salido generosamente al mundo a sembrar y ha puesto en el corazón del hombre y de la historia el deseo de infinito, de una vida plena, de una salvación que lo libere. Por eso la mies es mucha, el Reino de Dios germina como una semilla en la tierra y los hombres y mujeres de hoy, incluso cuando parecen abrumados por tantas otras cosas, esperan una verdad más grande, buscan un sentido más pleno para su vida, desean justicia y llevan en su interior un anhelo de vida eterna.
Por otra parte, son pocos los obreros que van a trabajar al campo sembrado por el Señor y que, antes aún, son capaces de reconocer, con los ojos de Jesús, el buen grano listo para la cosecha (cf. Jn 4,35-38). Hay algo grande que el Señor quiere hacer en nuestra vida y en la historia de la humanidad, pero son pocos los que se dan cuenta, los que se detienen para acoger el don, los que lo anuncian y lo llevan a los demás.
Queridos hermanos y hermanas, la Iglesia y el mundo no necesitan personas que cumplen con sus deberes religiosos mostrando su fe como una etiqueta exterior; necesitan, en cambio, obreros deseosos de trabajar en el campo de la misión, discípulos enamorados que den testimonio del Reino de Dios dondequiera que se encuentren. Quizás no falten los “cristianos de ocasión”, que de vez en cuando dan cabida a algún buen sentimiento religioso o participan en algún evento; pero son pocos los que están dispuestos a trabajar cada día en el campo de Dios, cultivando en su corazón la semilla del Evangelio para luego llevarla a la vida cotidiana, a la familia, a los lugares de trabajo y de estudio, a los diversos entornos sociales y a quienes se encuentran en necesidad.
Para hacer esto no se necesitan demasiadas ideas teóricas sobre conceptos pastorales; se necesita, sobre todo, rezar al dueño de la mies. En primer lugar, pues, está la relación con el Señor, cultivar el diálogo con Él. Entonces Él nos convertirá en sus obreros y nos enviará al campo del mundo como testigos de su Reino.
Pidamos a la Virgen María, que se entregó generosamente diciendo «Yo soy la servidora del Señor», y participando de esta forma en la obra de la salvación, que interceda por nosotros y nos acompañe en el camino del seguimiento del Señor, para que también nosotros podamos convertirnos en alegres trabajadores del Reino de Dios.
____________________
Después del Ángelus
Queridos hermanos y hermanas,
Saludo con afecto a todos ustedes, fieles de Roma, peregrinos de Italia y de diversos países. Con el gran calor de este período, su camino para atravesar las Puertas Santas es aún más valiente y admirable.
En particular, saludo a las Hermanas Franciscanas Misioneras del Sagrado Corazón; a los alumnos y padres de la Escuela de Strzyzow y a los fieles de Legnica, en Polonia; al grupo greco-católico de Ucrania.
Saludo también a los peregrinos de Romano di Lombardia, Melìa (Reggio Calabria), Sassari y a la comunidad latinoamericana de la diócesis de Florencia.
Quisiera expresar mi más sincero pésame a todas las familias que han perdido a sus seres queridos, en particular por las niñas que se encontraban en el campamento estivo, durante la catástrofe causada por las inundaciones del río Guadalupe en Texas, Estados Unidos. Recemos por ellos.
Queridos hermanos, la paz es un deseo de todos los pueblos y es el grito doloroso de los que están desgarrados por la guerra. Pidamos al Señor que toque los corazones e inspire las mentes de los gobernantes, para que sustituyan la violencia de las armas por la búsqueda del diálogo.
Esta tarde me trasladaré a Castel Gandolfo, donde pienso permanecer para un breve período de descanso. Deseo a todos que puedan disfrutar de un tiempo de vacaciones para reponer fuerzas físicas y espirituales.
¡Feliz domingo a todos!",2025-07-06_ángelus_angelus_6_de_julio_de_2025
Discurso,2025-07-05,A las Hermanas Agustinas Siervas de Jesús y María (5 de julio de 2025),https://www.vatican.va/content/leo-xiv/es/speeches/2025/july/documents/20250705-agostiniane.html,"SALUTO DEL SANTO PADRE LEONE XIV ALLE SUORE AGOSTINIANE SERVE DI GESÙ E MARIA
Sabato, 5 luglio 2025
[ Multimedia ]
____________________________________
En el nombre del Padre, del Hijo y del Espíritu Santo.
¡La paz esté con ustedes!
Queridas hermanas,
me alegra encontrarme con ustedes al término de su Capítulo provincial: en esta semana de oración, discernimiento y proyecto común han podido renovar su adhesión al carisma de su fundadora, la venerable hermana María Teresa Spinelli.
Mientras continúa su proceso de canonización, ¡también prosigue su camino de santidad! Como Hermanas Agustinas, Siervas de Jesús y María, las animo a siempre dejarse guiar de manera renovada por el nombre que llevan. En efecto, el servicio que realizan cada día se realiza ante todo en la consagración de la vida al Señor, y se fortalece en la sincera devoción a su Madre y a la nuestra.
Imitando a sor María Teresa, serán pacientes en las tribulaciones, porque es precisamente en nuestras pruebas donde el Señor confirma su fidelidad; serán valientes en la misión, porque la labor educativa a la que se dedican forma mentes sabias y corazones capaces de escuchar y de sentir pasión por la humanidad; serán perseverantes en el seguimiento de Cristo, que es «el camino, la verdad y la vida» ( Jn 14,6) y, por lo tanto, criterio de toda nuestra iniciativa cultural. Sabemos que una cultura sin verdad se convierte en instrumento de los poderosos: en lugar de liberar las conciencias, las confunde y las distrae según los intereses del mercado, de la moda o del éxito mundano.
A este respecto, les aconsejo que retomen una obra del santo doctor, nuestro padre Agustín, el De Magistro, para meditarla en un futuro próximo, recogiendo los frutos de su Capítulo. En este escrito, Agustín afirma que la enseñanza exterior debe conducir siempre al encuentro con el Maestro interior, que es Jesús (cf.I, 11). En su nombre, deseo todo bien a sus comunidades y les imparto de corazón la bendición apostólica. ¡Gracias! _________________________ Boletín de la Oficina de Prensa de la Santa Sede, 05 de julio de 2025",2025-07-05_discurso_a_las_hermanas_agustinas_siervas_de_jesus_y_maria_5_de_julio_de_2025
Discurso,2025-06-30,A las participantes en los Capítulos Generales: Hijas de la Divina Caridad; Hermanas de la Orden de San Basilio Magno y Hermanas de la Congregación Agustinas Hermanas del Amparo; y Hermanas Franciscanas de los Sagrados Corazones (30 de junio de 2025),https://www.vatican.va/content/leo-xiv/es/speeches/2025/june/documents/20250630-capitoli-generali-suore.html,"DISCURSO DEL SANTO PADRE LEÓN XIV A LAS REPRESENTANTES DE ALGUNOS INSTITUTOS RELIGIOSOS FEMENINOS
Sala Clementina Lunes, 30 de junio de 2025
[ Multimedia ]
__________
En el nombre del Padre, del Hijo y del Espíritu Santo.
¡La paz esté con ustedes!
Queridas hermanas, ¡buenos días y bienvenidas!
Me alegra encontrarme con ustedes, algunas vienen con ocasión del Capítulo General, otras para la peregrinación jubilar. En todos los casos vienen ante la tumba de Pedro a renovar su amor al Señor y su fidelidad a la Iglesia.
Pertenecen a congregaciones nacidas en momentos y circunstancias diferentes: Hermanas de la Orden de San Basilio Magno, Hijas de la Divina Caridad, Hermanas Agustinas del Amparo, Hermanas Franciscanas de los Sagrados Corazones. Sin embargo, sus historias muestran una dinámica común, por la cual la luz de grandes modelos de vida espiritual del pasado —como Agustín, Basilio y Francisco— por medio de la ascesis, la valentía y la santidad de vida de fundadores y fundadoras, ha suscitado y hecho crecer nuevos caminos de servicio, sobre todo en relación a los más débiles: niños, chicas y chicos pobres, huérfanos, migrantes, a los que se han agregado con el tiempo ancianos y enfermos, además de tantos otros ministerios de caridad.
Las varias vicisitudes de su pasado y la vivacidad del presente hacen experimentar cómo la fidelidad a la sabiduría antigua del Evangelio es el mejor motor para quien, impulsado por el Espíritu Santo, recorre nuevos caminos de donación, dedicados al amor de Dios y del prójimo en la escucha atenta de los signos de los tiempos (cf. Conc. Ecum. Vat. II, Const. past. Gaudium et spes , 4; 11).
Pensando precisamente en esto, el Concilio Vaticano II , hablando de los Institutos religiosos dedicados a servicios de caridad, ha subrayado la importancia de que en ellos «toda la vida […] de sus miembros ha de estar imbuida de espíritu apostólico, y toda su actividad apostólica ha de estar, a su vez, informada de espíritu religioso» (Decr. Perfectae caritatis , 8), para que los religiosos «primordialmente respondan a su llamamiento a seguir a Cristo y servirle en sus miembros […], [en] unión íntima con Él» ( i bíd . ).
San Agustín, a este respecto, hablando de la primacía de Dios en la vida cristiana, afirma: «Para ti Dios es todo: si tienes hambre, Dios es tu pan; si tienes sed, Dios es tu agua; si estás en tinieblas, Dios es tu luz, porque permanece incorruptible; si estás desnudo, Dios es tu vestido de inmortalidad» ( Tratados sobre el Evangelio de San Juan , 13, 5). Nos hace bien dejarnos interrogar por estas palabras: ¿en qué medida esto es verdadero para mí? ¿Cuánto sacia el Señor mi sed de vida, de amor, de luz? Son preguntas importantes. En efecto, este enraizamiento en Cristo es lo que ha llevado a quienes nos han precedido —hombres y mujeres como nosotros, con cualidades y límites como los nuestros— a hacer cosas que quizá nunca hubieran pensado que podían realizar, permitiéndoles esparcir semillas de bien que, a través de siglos y continentes, hoy han alcanzado prácticamente todo el mundo, como demuestra la presencia de ustedes.
Algunas de ustedes, como ya he mencionado, están realizando el Capítulo General, otras están aquí para el Jubileo. En cualquier caso, se trata de tomar decisiones importantes de las que depende el propio futuro, de las hermanas y de la Iglesia. Por eso me parece muy oportuno concluir repitiéndonos a todos nosotros el hermoso deseo que san Pablo dirigía a los cristianos de Éfeso: «Que Cristo habite en sus corazones por la fe, y sean arraigados y edificados en el amor. Así podrán comprender, con todos los santos, cuál es la anchura y la longitud, la altura y la profundidad, en una palabra, ustedes podrán conocer el amor de Cristo, que supera todo conocimiento, para ser colmados por la plenitud de Dios» ( Ef 3,17-19). Gracias por su trabajo y su fidelidad. Que las acompañe la Virgen María, junto con mi bendición.",2025-06-30_discurso_a_las_participantes_en_los_capitulos_generales_hijas_de_la_divina_caridad_hermanas_de_la_orden_de_sa
