tipo,fecha,titulo,url,texto,filename
Discurso,2025-09-18,A los participantes en los Capítulos Generales de: Misioneros de la Preciosísima Sangre; Sociedad de María; Frailes Franciscanos de la Inmaculada; Ursulinas de María Inmaculada (18 de septiembre de 2025),https://www.vatican.va/content/leo-xiv/es/speeches/2025/september/documents/20250918-capitoli-generali.html,"DISCURSO DEL SANTO PADRE LEÓN XIV A LOS PARTICIPANTES EN LOS CAPITULOS GENERALES Y ASAMBLEAS DE VARIAS CONGREGACIONES E INSTITUTOS: MISIONEROS DE LA PRECIOSÍSIMA SANGRE; SOCIEDAD DE MARÍA (MARISTAS); FRAILES FRANCISCANOS DE LA INMACULADA; URSOLINAS DE MARÍA INMACULADA
Giovedì, 18 settembre 2025
[ Multimedia ]
____________________________________
En el nombre del Padre, del Hijo y del Espíritu Santo.
¡La paz esté con ustedes!
¡Buenos días a todos y bienvenidos!
Queridos hermanos y hermanas, Eminencia,
estoy muy contento de encontrarme con ustedes con motivo de sus capítulos y asambleas.
Saludo a la superiora y a los superiores generales presentes y a todos ustedes, comprometidos en estos días en una labor de escucha y discernimiento. Algunas de sus Congregaciones son electivas, y también esto es un gran don para la Iglesia y una gran responsabilidad, que confiamos juntos al Señor.
La de sus Institutos «es un testimonio espléndido y variado, en el que se refleja la multiplicidad de los dones otorgados por Dios a los fundadores y fundadoras que, abiertos a la acción del Espíritu Santo, han sabido interpretar los signos de los tiempos y responder de un modo clarividente a las exigencias que iban surgiendo poco a poco» (San Juan Pablo II , Exhort. ap. Vita consecrata , 9).
Así, Brigida de Jesús Morello, ya en el siglo XVII, a través de la formación de las jóvenes, en una época en la que la sociedad no siempre reconocía plenamente su valor, inauguró una obra de promoción de la mujer que daría muchos frutos en el futuro. Del mismo modo, San Gaspar del Bufalo, dos siglos más tarde, en Roma, con las misiones populares y la difusión de la devoción a la Sangre de Cristo, se comprometió a combatir el espíritu rampante de «impiedad e irreligión» que afligía a su época. Una empresa similar emprendió en Francia el padre Jean-Claude Colin, inspirándose en su apostolado en el espíritu de humildad y escondimiento de María de Nazaret. Por último, en los años noventa del siglo XX, siguiendo los pasos de San Francisco y San Maximiliano Kolbe, nacieron los Frailes Franciscanos de la Inmaculada.
Esta es la poliédrica herencia que les trae aquí hoy, y de ella podemos destacar algunos aspectos unificadores.
El primero es la importancia, en la vocación religiosa que comparten, de la vida en común, como lugar de santificación y fuente de inspiración, testimonio y fuerza en el apostolado. En ella «la energía del Espíritu que está en uno pasa contemporáneamente a todos» ( íbid ., 42) y «no solo se disfruta del propio don, sino que se multiplica al hacer a los otros partícipes de él, y se goza del fruto de los dones del otro como si fuera del propio» ( ibíd .). No en vano, el Espíritu Santo inspiró a quienes les precedieron a unirse a las hermanas y hermanos que la Providencia puso en su camino, para que en la comunión de los buenos se multiplicara y creciera el bien. Así fue en los inicios de sus fundaciones y a lo largo de los siglos, y así sigue siendo ahora.
El segundo aspecto en el que me gustaría detenerme es el valor fundamental, en la consagración religiosa, de la obediencia como acto de amor. Jesús nos dio ejemplo de ello en su relación con el Padre: «No busco mi voluntad, sino la voluntad de aquel que me ha enviado» ( Jn 5,30). A este respecto, san Agustín subraya con fuerza la estrecha relación que existe, en la vida cristiana, entre la obediencia y el amor verdadero: «Les importa la caridad —dice en un discurso—; ahora bien, la obediencia es su hija [...], la raíz está bajo tierra, los frutos a la vista. No creo en lo que está arraigado en la tierra si no veo lo que cuelga de la rama. ¿Tienes la caridad? ¡Muéstrame su fruto! Haz que yo vea la obediencia [...]. Que yo pueda abrazar a la hija para reconocer la [fecundidad de] la madre» ( Sermo 359 B, 12). Hoy en día, hablar de obediencia no está muy de moda: se considera una renuncia a la propia libertad. Pero no es así. La obediencia, en su significado más profundo de escucha activa y generosa del otro, es un gran acto de amor con el que se acepta morir a uno mismo para que el hermano y la hermana puedan crecer y vivir. Profesada y vivida con fe, traza un camino luminoso de entrega, que puede ayudar mucho al mundo en el que vivimos a redescubrir el valor del sacrificio, la capacidad de relaciones duraderas y una madurez en el estar juntos que va más allá del «sentir» del momento para consolidarse en la fidelidad. La obediencia es una escuela de libertad en el amor.
Por último, el tercer aspecto en el que me gustaría detenerme es la atención a los signos de los tiempos. Sin esta mirada abierta y atenta a las necesidades reales de los hermanos, ninguna de sus Congregaciones habría nacido jamás. Sus fundadores y fundadoras fueron personas capaces de observar, evaluar, amar y luego partir, incluso a riesgo de grandes sufrimientos, incluso a costa de perder lo propio, para servir a los hermanos en sus necesidades reales, reconociendo en la indigencia del prójimo la voz de Dios. Por eso es importante que trabajen en la memoria viva de esos valientes comienzos, no en el sentido de «hacer arqueología o cultivar inútiles nostalgias, sino de recorrer el camino de las generaciones pasadas para redescubrir en él la chispa inspiradora, los ideales, los proyectos, los valores que las han impulsadon» ( Francisco , Carta apostólica A todos los consagrados con motivo del Año de la Vida Consagrada , 21 de noviembre de 2014, I, 1), identificando sus potencialidades, tal vez aún inexploradas, para ponerlas al servicio del «aquí y ahora».
Queridísimos, sé cuánto bien hacen cada día, en muchas partes del mundo, un bien a menudo desconocido a los ojos de los seres humanos, ¡pero no a los de Dios! Les doy las gracias y los bendigo de corazón, animándolos a continuar con fe y generosidad su misión. ¡Gracias! _____________________
Boletín de la Oficina de Prensa de la Santa Sede, 18 de septiembre de 2025",2025-09-18_discurso_a_los_participantes_en_los_capitulos_generales_de_misioneros_de_la_preciosisima_sangre_sociedad_de_m
Audiencia,2025-09-17,"Audiencia general del 17 de septiembre de 2025 Ciclo de catequesis - Jubileo 2025. Jesucristo, nuestra esperanza. III. La Pascua de Jesús. 7. La muerte. «Un sepulcro nuevo, en el que nadie había sido depositado aún» (Jn 19,40-41)",https://www.vatican.va/content/leo-xiv/es/audiences/2025/documents/20250917-udienza-generale.html,"LEÓN XIV
AUDIENCIA GENERAL
Plaza de San Pedro Miércoles, 17 de septiembre de 2025
[ Multimedia ]
___________________________________
Ciclo de catequesis - Jubileo 2025. Jesucristo, nuestra esperanza. III. La Pascua de Jesús. 6. La muerte. «Un sepulcro nuevo, en el que nadie había sido depositado aún» (Jn 19,40-41)
Queridos hermanos y hermanas,
en nuestro camino de las catequesis sobre Jesús esperanza nuestra, hoy contemplamos el misterio del Sábado Santo. El Hijo de Dios yace en la tumba. Pero esta su “ausencia” no es un vacío: es espera, plenitud contenida, promesa custodiada en la oscuridad. Es el día del gran silencio, en el que el cielo parece mudo y la tierra inmóvil, pero es justamente allí que se cumple el misterio más profundo de la fe cristiana. Es un silencio grávido de sentido, como el vientre de una madre que custodia al hijo todavía no nacido, pero ya vivo.
El cuerpo de Jesús, bajado de la cruz, fue envuelto con cuidado, como se hace con aquello que es valioso.  El evangelista Juan nos dice que fue sepultado en un jardín, dentro « una tumba nueva, en la que todavía nadie había sido sepultado » ( Jn 19,41). Nada es dejado a la casualidad. Aquel jardín recuerda al Edén perdido, el lugar en el que Dios y el hombre estaban unidos. Y aquella tumba nunca antes usada habla de algo que todavía debe suceder: es un umbral, no un final. En el inicio de la creación Dios había plantado un jardín, ahora también la nueva creación toma forma en un jardín: con una tumba cerrada que pronto se abrirá
El Sábado Santo es también un día de descanso. Según la ley judía, el séptimo día no se debe trabajar: de hecho, luego de seis días de creación, Dios descansó (cfr Gen 2,2). Ahora, también el Hijo, luego de haber completado su obra de salvación, descansa. No porque está cansado, sino porque ha concluido su trabajo. No porque se ha rendido, sino porque ha amado hasta el final. No hay nada más que agregar. Este descanso es el sello de la obra cumplida, es la confirmación de aquello que tenía que hacerse y que ha sido completado. Es un descanso lleno de la presencia oculta del Señor.
Fatigamos en detenernos y descansar. Vivimos como si la vida nunca fuese suficiente. Corremos por producir, por demostrar, por no perder terreno. Pero el Evangelio nos enseña que saber detenerse es un gesto de confianza que tenemos que aprender a cumplir. El Sábado Santo nos invita a descubrir que la vida no depende siempre de aquello que hacemos, sino también de cómo sabemos desistir de cuanto hemos podido hacer.
En el sepulcro, Jesús, la Palabra viviente del Padre, calla. Pero es justamente en aquel silencio que la vida nueva inicia a fermentar. Como una semilla en la tierra, como la oscuridad antes del amanecer. Dios no tiene miedo del tiempo que pasa, porque es Señor también de la espera. Así, también nuestro tiempo “no útil”, aquel de las pausas, de los vacíos, de los momentos estériles, puede convertirse en vientre de resurrección. Todo silencio acogido puede ser la premisa de una Palabra nueva. Todo tiempo detenido puede convertirse en tiempo de gracia, si lo ofrecemos a Dios.
Jesús, sepultado en la tierra, es el rostro mansueto de un Dios que no ocupa todo el espacio. Es el Dios que deja hacer, que espera, que se retira para dejarnos la libertad. Es el Dios que se fía, también cuando todo parece terminado. Y nosotros, en ese sábado detenido, aprendemos que no tenemos que tener prisa de resurgir: más es necesario descansar, acoger el silencio, dejarse abrazar por el límite. A veces buscamos respuestas rápidas, soluciones inmediatas. Pero Dios trabaja en lo profundo, en el tiempo lento de la confianza. El sábado de la sepultura se convierte así en las entrañas de las que pueden brotar las fuerzas de una luz invencible, aquella de la Pascua.
Queridos amigos, la esperanza cristiana no nace en el ruido, sino en el silencio de una espera habitada por el amor. No es hija de la euforia, sino de un confiado abandono. Nos lo enseña la virgen María: ella encarna esta espera, esta esperanza. Cuando nos parezca que todo está detenido, que la vida es un camino interrumpido, acordémonos del Sábado Santo. También en la tumba, Dios está preparando la sorpresa más grande. Y si sabemos acoger con gratitud aquello acontecido, descubriremos que, justamente en la pequeñez, y en el silencio, Dios ama transfigurar la realidad haciendo nuevas todas las cosas con la fidelidad de su amor. La verdadera alegría nace de la espera habitada, de la fe paciente, de la esperanza que cuanto ha vivido en el amor, ciertamente, resurgirá a la vida eterna.
__________________
Saludos
Saludo cordialmente a los peregrinos de lengua española, en modo particular a los grupos provenientes de España de México, de Perú, de toda América Latina. En medio del ruido y de la prisa en que a veces nos encontramos, pidamos la intercesión de la Virgen María para que nos enseñe, como ella, a vivir el Sábado Santo descubriendo el sentido del silencio y de la contemplación. Que el Señor los bendiga. Muchas gracias.
__________
Llamamiento
Expreso mi profunda cercanía al pueblo palestino en Gaza, que continúa viviendo en el miedo y sobreviviendo en condiciones inaceptables, obligado a la fuerza -una vez más- a desplazarse de sus propias tierras.
Ante el Señor Omnipotente, que ha ordenado “No matarás” y frente a la entera historia humana, toda persona tiene siempre una dignidad inviolable, que se debe respetar y custodiar.
Renuevo el llamamiento al alto el fuego, a la liberación de los rehenes, a la solución diplomática negociada, al respeto integral del derecho humanitario internacional.
Invito a todos a unirse a mi encarecida oración, para que pronto surja un amanecer de paz y de justicia.
__________________
Resumen leído por el Santo Padre en español
Queridos hermanos y hermanas:
En esta catequesis contemplamos el misterio del Sábado Santo. La “ausencia” de Cristo en el sepulcro no es un vacío; es promesa, es espera, es un silencio cargado de sentido, como el de una madre que custodia en el vientre a su hijo aún no nacido, pero ya vivo. El cuerpo de Jesús es bajado de la cruz para ser sepultado en un jardín, el cual evoca aquel del Edén, en el que Dios y el hombre estaban unidos. El silencio de Cristo no es estéril, es signo de que se está gestando algo nuevo, Cristo está reestableciendo la relación entre Dios y el hombre.
El Sábado Santo es también el día del descanso, según la ley judía. Jesús, después de haber contemplado su obra de salvación, reposa. No lo hace por estar cansado o por haberse rendido, es más bien la confirmación de que lo que había que hacer se ha llevado a cabo. A veces nos cuesta descansar, vivimos de prisa para producir, para demostrar, para no perder terreno. Sin embargo, así como el Sábado Santo nos enseña que cada silencio puede ser el preámbulo de una palabra nueva, también cada pausa puede convertirse en un tiempo de gracia.",2025-09-17_audiencia_audiencia_general_del_17_de_septiembre_de_2025_ciclo_de_catequesis_jubileo_2025_jesucristo_nuestra_e
Homilia,2025-09-15,Vigilia del Jubileo de la Consolación (15 de septiembre de 2025),https://www.vatican.va/content/leo-xiv/es/homilies/2025/documents/20250915-veglia-giubileo-consolazione.html,"JUBILEO DE LA CONSOLACIÓN
VIGILIA DE ORACIÓN PRESIDIDA POR EL SANTO PADRE LEÓN XIV
Basílica de San Pedro Lunes, 15 de septiembre de 2025
[ Multimedia ]
____________________________________
«Consuelen, consuelen a mi pueblo» ( Is 40,1). Esta es la invitación del profeta Isaías, que hoy nos alcanza de modo apremiante también a nosotros: nos llama a compartir la consolación de Dios con tantos hermanos y hermanas que viven situaciones de debilidad, de tristeza, de dolor. Para quienes están en el llanto, en la desesperación, en la enfermedad y en el luto, resuena claro y fuerte el anuncio profético de la voluntad del Señor de poner fin al sufrimiento y transformarlo en alegría. En este sentido, quisiera agradecer nuevamente a las dos personas que han dado sus testimonios. Todo el dolor se puede transformar con la gracia de Jesucristo. ¡Gracias! Esta Palabra compasiva, hecha carne en Cristo, es el buen samaritano del que nos habló el Evangelio. Él es quien cura nuestras heridas, Él es quien cuida de nosotros. En los momentos de oscuridad, aun contra toda evidencia, Dios no nos deja solos; al contrario, precisamente en esas circunstancias estamos llamados más que nunca a esperar en su cercanía de Salvador que nunca abandona.
Buscamos a quien nos consuele y a menudo no lo encontramos. A veces incluso nos resulta insoportable la voz de quienes, con sinceridad, intentan compartir nuestro dolor. Es verdad. Hay situaciones en las que las palabras no sirven y se vuelven casi superfluas. Quizás en esos momentos sólo quedan las lágrimas del llanto, si es que todavía no se han agotado. El Papa Francisco recordaba las lágrimas de María Magdalena, desorientada y sola, junto al sepulcro vacío de Jesús. «Simplemente llora ―decía―. Miren, a veces en nuestra vida los anteojos para ver a Jesús son las lágrimas. Hay un momento en nuestra vida en que sólo las lágrimas nos preparan para ver a Jesús. Y ¿cuál es el mensaje de esta mujer? “He visto al Señor”» [1] .
Queridas hermanas y hermanos, las lágrimas son un lenguaje que expresa sentimientos profundos del corazón herido. Las lágrimas son un grito mudo que implora compasión y consuelo. Pero aun antes son liberación y purificación de los ojos, del sentir, del pensar. No hay que avergonzarse de llorar; es una manera de expresar nuestra tristeza y la necesidad de un mundo nuevo; es un lenguaje que habla de nuestra humanidad débil y puesta a prueba, pero llamada a la alegría.
Donde hay dolor surge inevitablemente la pregunta: ¿Por qué todo este mal? ¿De dónde proviene? ¿Por qué me tenía que pasar justamente a mí? En sus Confesiones , san Agustín escribe: «Buscaba yo el origen del mal [...]. ¿Cuál es su raíz y cuál su semilla? [...] Puesto que Dios, bueno, hizo todas las cosas buenas [...]. ¿De dónde viene el mal? [...] Tales cosas revolvía yo en mi pecho [...]. Sin embargo, de modo estable se afincaba en mi corazón, en orden a la Iglesia Católica, la fe de tu Cristo, Señor y Salvador nuestro; informe ciertamente en muchos puntos y como fluctuando [...], mas con todo, no la abandonaba ya mi alma» (VII, 5).
En el paso de las preguntas a la fe lo que nos educa es la Sagrada Escritura. De hecho, hay preguntas que nos repliegan sobre nosotros mismos, nos dividen interiormente y nos separan de la realidad. Hay pensamientos de los que no puede nacer nada. Si nos aíslan y nos desesperan, también humillan la inteligencia. Mejor es, como en los Salmos, que la pregunta sea protesta, lamento, invocación de esa justicia y de esa paz que Dios nos ha prometido. Entonces tendemos un puente hacia el cielo, incluso cuando parece mudo. En la Iglesia buscamos el cielo abierto, que es Jesús, el puente de Dios hacia nosotros. Existe una consolación que nos alcanza cuando “se afinca en el corazón” esa fe que nos parece “informe y como fluctuando”, como una barca en la tormenta.
Donde está el mal, allí debemos buscar el alivio y la consolación que lo vencen y no le dan tregua. En la Iglesia quiere decir: nunca solos. Apoyar la cabeza en un hombro que te consuela, que llora contigo y te da fuerza, es una medicina de la que nadie puede privarse porque es signo de amor. Donde el dolor es profundo, aún más fuerte debe ser la esperanza que nace de la comunión. Y esta esperanza no defrauda.
Los testimonios que hemos escuchado transmiten esta certeza. Que el dolor no debe generar violencia; que la violencia no es la última palabra, porque es vencida por el amor que sabe perdonar. ¿Qué mayor liberación podemos esperar alcanzar sino la que proviene del perdón, que por gracia puede abrir el corazón a pesar de haber sufrido toda clase de brutalidades? La violencia padecida no puede ser borrada, pero el perdón concedido a quienes la generaron es una anticipación en la tierra del Reino de Dios, es fruto de su acción que pone fin al mal y establece la justicia. La redención es misericordia y puede hacer mejor nuestro futuro, mientras aún aguardamos el regreso del Señor. Solo Él enjugará toda lágrima y abrirá el libro de la historia permitiéndonos leer las páginas que hoy no podemos justificar ni comprender (cf. Ap 5).
También a ustedes, hermanos y hermanas que han sufrido la injusticia y la violencia del abuso, María les repite hoy: “Yo soy tu madre”. Y el Señor, en lo secreto del corazón, les dice: “Tú eres mi hijo, tú eres mi hija”. Nadie les puede quitar este don personal ofrecido a cada uno. Y la Iglesia, de la cual algunos miembros lamentablemente los han herido, hoy se arrodilla junto a ustedes ante la Madre. Que todos podamos aprender de ella a amparar a los más pequeños y frágiles con ternura. Que aprendamos a atender sus heridas, a caminar juntos. Que podamos recibir de María Dolorosa la fuerza de reconocer que la vida no se define sólo por el mal padecido, sino por el amor de Dios que nunca nos abandona y que guía a toda la Iglesia.
Las palabras de san Pablo, además, nos sugieren que, cuando se recibe consolación de Dios, entonces se es capaz de ofrecer consolación también a los demás: Él ―escribe el Apóstol― «nos reconforta en todas nuestras tribulaciones, para que nosotros podamos dar a los que sufren el mismo consuelo que recibimos de Dios» ( 2 Co 1,4). Los secretos de nuestro corazón no están ocultos a Dios. No hemos de impedirle consolarnos, engañándonos con que podemos contar sólo con nuestras fuerzas.
Hermanas y hermanos, al finalizar esta Vigilia se les ofrecerá un pequeño regalo: el Agnus Dei . Es un signo que podremos llevar a nuestras casas para recordar que el misterio de Jesús, de su muerte y resurrección, es la victoria del bien sobre el mal. Él es el Cordero que da el Espíritu Santo Consolador, que nunca nos deja, nos conforta en la necesidad y nos fortalece con su gracia (cf. Hch 15,31).
Aquellos a los que amamos y que nos han sido arrebatados por la hermana muerte no están perdidos ni desaparecen en la nada. Su vida pertenece al Señor que, como Buen Pastor, los abraza y los estrecha junto a sí, y nos los devolverá un día para que podamos gozar de una felicidad eterna y compartida.
Queridos amigos, así como existe el dolor personal, también en nuestros días existe el dolor colectivo de pueblos enteros que, aplastados por el peso de la violencia, del hambre y de la guerra, imploran paz. Es un grito inmenso, que nos compromete a rezar y actuar para que cese toda violencia y para que quienes sufren puedan recuperar serenidad; y compromete ante todo a Dios, cuyo corazón palpita de compasión, para que venga su Reino. La verdadera consolación que debemos ser capaces de transmitir es la de mostrar que la paz es posible, y que brota en cada uno de nosotros si no la sofocamos. Que los responsables de las naciones escuchen particularmente el grito de tantos niños inocentes, para garantizarles un futuro que los proteja y los consuele.
En medio de tanta prepotencia, estamos seguros, Dios no dejará que falten corazones y manos que lleven ayuda y consolación, constructores de paz capaces de animar a quienes están en el dolor y la tristeza. Y juntos, como Jesús nos enseñó, invocaremos con mayor verdad: “¡Venga a nosotros tu Reino!”.


________________________________
[1] Francisco, Meditación matutina en la Capilla de la Domus Sanctae Marthae (2 abril 2013).
",2025-09-15_homilia_vigilia_del_jubileo_de_la_consolacion_15_de_septiembre_de_2025
