tipo,fecha,titulo,url,texto,filename
Ángelus,2025-09-21,"Ángelus, 21 de septiembre de 2025",https://www.vatican.va/content/leo-xiv/es/angelus/2025/documents/20250921-angelus.html,"PAPA LEÓN XIV
ÁNGELUS
Plaza de San Pedro Domingo, 21 de septiembre de 2025
[ Multimedia ]
________________________________________
Queridos hermanos y hermanas, ¡feliz domingo!
La palabra que escuchamos hoy en el Evangelio ( Lc 16,1-13) nos hace reflexionar sobre el uso de los bienes materiales y, más en general, sobre cómo estamos administrando el bien más valioso de todos, que es nuestra propia vida.
En el relato vemos que un administrador es llamado por su señor a “rendir cuentas”. Se trata de una imagen que nos comunica algo muy importante: nosotros no somos dueños de nuestra vida ni de los bienes que disfrutamos; todo nos ha sido dado como don por el Señor y Él ha confiado este patrimonio a nuestro cuidado, a nuestra libertad y responsabilidad. Un día seremos llamados a rendir cuentas de cómo hemos administrado nuestra vida, nuestros bienes y los recursos de la tierra, a Dios y a los hombres, a la sociedad y sobre todo a quienes vendrán después de nosotros.
El administrador de la parábola ha buscado simplemente su propio beneficio y, cuando llega el día en el que debe rendir cuentas y le quitan la administración, debe pensar qué hacer para su futuro. En esta difícil situación, él comprende que el valor más importante no es la acumulación de los bienes materiales, porque las riquezas de este mundo pasan; y, entonces, se le ocurre una idea brillante: llama a sus deudores y “recorta” sus deudas, renunciando por tanto a la parte que le hubiera tocado a él. De esta manera, pierde la riqueza material, pero gana amigos, que estarán dispuestos a ayudarlo y sostenerlo.
Reflexionando sobre este relato, Jesús nos exhorta: «Gánense amigos con el dinero de la injusticia, para que el día en que este les falte, ellos los reciban en las moradas eternas» (v. 9).
El administrador de la parábola, en efecto, aun en la gestión de la riqueza deshonesta de este mundo, encuentra un modo para tener amigos, saliendo de la soledad del propio egoísmo; mucho más nosotros, que somos discípulos y vivimos en la luz del Evangelio, debemos usar los bienes del mundo y nuestra misma vida pensando en la riqueza verdadera, que es la amistad con el Señor y con los hermanos.
Queridos hermanos, la parábola nos invita a preguntarnos: ¿cómo estamos administrando los bienes materiales, los recursos de la tierra y la vida que Dios nos ha dado? Podemos seguir el criterio del egoísmo, poniendo la riqueza en primer lugar y pensando sólo en nosotros mismos; pero esto nos aísla de los demás y esparce el veneno de una competición que a menudo provoca conflictos. O bien podemos reconocer que hemos de administrar todo lo que tenemos como don de Dios, y usarlo como instrumento para compartir, para crear redes de amistad y solidaridad, para edificar el bien, para construir un mundo más justo, más equitativo y más fraterno.
Pidamos a la Virgen Santa que interceda por nosotros y nos ayude a administrar bien todo aquello que el Señor nos confía, con justicia y responsabilidad.
______________________
Palabras después del Angelus
Saludo con afecto a todos ustedes, presentes en la Plaza de San Pietro y a los que están conectados a través de los medios de comunicación.
Me dirijo en primer lugar a los representantes de diversas asociaciones católicas, comprometidas en la solidaridad con la población de la Franja de Gaza. Queridos amigos, aprecio su iniciativa y muchas otras que en toda la Iglesia expresan cercanía a los hermanos y hermanas que sufren en esa tierra martirizada. Con ustedes y con los pastores de las Iglesias de Tierra Santa repito: no hay futuro basado en la violencia, en el exilio forzado, en la venganza. Los pueblos necesitan paz: quien los ama de verdad, trabaja por la paz.
Saludo a los peregrinos de las Diócesis de Mindelo, Capo Verde, y a los de la Diócesis de Como; También a los grupos provenientes de Angola, Polonia – en particular de Bliżyn –, de Ciudad Real en España, de Porto en Portugal y de Mwanza en Tanzania.
Saludo a los sacerdotes de la Compañía de Jesús que comienzan el itinerario de estudios en Roma; a la Sociedad de San Vicente de Paul; a los fieles de Sora, Pescara, Macerata, San Giovanni in Marignano, Venezia, Bassano del Grappa, Santa Caterina Villarmosa, Taranto, Somma Vesuviana, Ponzano Romano y a los varios grupos de la diócesis de Padua.
Me complace dar la bienvenida al Coro del Colegio de Abogados de Verona; al Coro femenino de Malo, en Vicenza; a la Fundación Oasi Nazareth de Corato; a la Asociación H-Earth Mani e Cuori ; incluyendo un recuerdo especial para las personas que padecen Alzheimer y ataxia.
¡Gracias a todos! ¡Les deseo un feliz domingo!",2025-09-21_ángelus_angelus_21_de_septiembre_de_2025
Discurso,2025-09-20,Jubileo de los Trabajadores por la Justicia - Audiencia con el Santo Padre (20 de septiembre de 2025),https://www.vatican.va/content/leo-xiv/es/speeches/2025/september/documents/20250920-giubileo-operatori-giustizia.html,"JUBILEO DE LOS TRABAJADORES POR LA JUSTICIA
DISCURSO DEL SANTO PADRE LEÓN XIV
Plaza de San Pedro Sábado, 20 de septiembre de 2025
[ Multimedia ]
____________________________________
¡Muy buenos días a todos! Good morning and welcome!
Queridos hermanos y hermanas:
Me alegra recibirlos con ocasión del Jubileo dedicado a quienes, de distintas maneras, trabajan en el amplio campo de la justicia. Saludo a las distinguidas autoridades presentes, venidas de muchos países en representación de diferentes cortes, y a todos ustedes que cada día realizan un servicio necesario para la relación ordenada entre las personas, las comunidades y los estados. Saludo también a los demás peregrinos que se han unido a este Jubileo. El Jubileo nos convierte a todos en peregrinos que, al redescubrir los signos de la esperanza que no defrauda, desean «recuperar la confianza necesaria —tanto en la Iglesia como en la sociedad— en los vínculos interpersonales, en las relaciones internacionales, en la promoción de la dignidad de toda persona y en el respeto de la creación» ( Bula de convocación del Jubileo , 25).
Qué mejor ocasión para reflexionar más de cerca sobre la justicia y su función, que sabemos es indispensable tanto para el desarrollo ordenado de la sociedad como virtud cardinal que inspira y orienta la conciencia de cada hombre y mujer. La justicia, en efecto, está llamada a cumplir una función superior en la convivencia humana, que no puede reducirse a la simple aplicación de la ley o al trabajo de los jueces, ni limitarse a los aspectos procedimentales.
«Tú amas la justicia y odias la iniquidad» ( Sal 45,8), nos recuerda la expresión bíblica, exhortando a cada uno de nosotros a hacer el bien y evitar el mal. O también, ¡cuánta sabiduría contiene la máxima “Dar a cada uno lo que es suyo”! Y, sin embargo, todo esto no agota el deseo profundo de lo justo que está en cada uno de nosotros, esa sed de justicia que es el instrumento clave para construir el bien común en toda sociedad humana. En la justicia se unen la dignidad de la persona, su relación con el otro y la dimensión de la comunidad hecha de convivencia, estructuras y reglas comunes. Una circularidad de la relación social que pone en el centro el valor de cada ser humano, que debe protegerse mediante la justicia frente a los diferentes conflictos que pueden surgir en la acción individual, o en la pérdida de sentido común que incluso puede afectar a instituciones y estructuras.
La tradición nos enseña que la justicia es, ante todo, una virtud, es decir, una disposición firme y estable que orienta nuestra conducta según la razón y la fe [1] . La virtud de la justicia, en particular, consiste en la «constante y firme voluntad de dar a Dios y al prójimo lo que les es debido» [2] . En esta perspectiva, para el creyente, la justicia dispone «a respetar los derechos de cada uno y a establecer en las relaciones humanas la armonía que promueve la equidad respecto a las personas y al bien común» [3] , objetivo que garantiza un orden en defensa del débil, de aquel que pide justicia porque es víctima de opresión, exclusión o indiferencia.
Son muchos los episodios evangélicos en los que la acción humana es evaluada desde una justicia capaz de derrotar el mal del abuso, como recuerda la insistencia de la viuda que logra que el juez recupere el sentido de lo justo (cf. Lc 18,1-8). Pero también una justicia superior que paga al trabajador de la última hora igual que al que trabajó todo el día (cf. Mt 20,1-16); o aquella que hace de la misericordia la clave de interpretación de la relación y lleva a perdonar acogiendo al hijo que estaba perdido y fue encontrado (cf. Lc 15,11-32), o aún más, a perdonar no siete veces, sino setenta veces siete (cf. Mt 18,21-35). Es la fuerza del perdón, propia del mandamiento del amor, la que aparece como elemento constitutivo de una justicia capaz de unir lo sobrenatural con lo humano.
La justicia evangélica, entonces, no aparta de la justicia humana, sino que la interroga y transforma: la impulsa a ir siempre más allá, porque la orienta hacia la búsqueda de la reconciliación. El mal no sólo debe sancionarse, sino también repararse, y para ello es necesaria una mirada profunda hacia el bien de las personas y el bien común. Es una tarea difícil, pero no imposible para quien, consciente de desempeñar un servicio más exigente que otros, se compromete a mantener una vida intachable.
Como sabemos, la justicia se hace concreta cuando se orienta hacia los demás, cuando a cada uno se le da lo que le corresponde, hasta alcanzar la igualdad en la dignidad y en las oportunidades entre los seres humanos. Somos conscientes, sin embargo, de que la igualdad real no es la meramente formal ante la ley. Esta igualdad, aunque indispensable para el correcto ejercicio de la justicia, no elimina el hecho de que existen crecientes discriminaciones cuyo primer efecto es precisamente la falta de acceso a la justicia. La verdadera igualdad, en cambio, es la posibilidad de que todos puedan realizar sus aspiraciones y ver garantizados los derechos inherentes a su dignidad, respaldados por un sistema de valores comunes y compartidos, capaces de inspirar normas y leyes que sostengan el funcionamiento de las instituciones.
Hoy, lo que interpela a los operadores de justicia es precisamente la búsqueda o la recuperación de los valores olvidados en la convivencia, su cuidado y su respeto. Se trata de un proceso necesario, frente a la expansión de conductas y estrategias que muestran desprecio por la vida humana desde su inicio, que niegan derechos fundamentales para la existencia personal y no respetan la conciencia de la que nacen las libertades. Precisamente mediante los valores que están en la base de la vida social, la justicia asume su papel central en la convivencia de las personas y de las comunidades humanas. Como escribía san Agustín: «la justicia no puede ser sino prudente, fuerte y templada» [4] . Esto requiere la capacidad de pensar siempre a la luz de la verdad y de la sabiduría, de interpretar la ley yendo más allá de lo puramente formal, para captar el sentido profundo de la verdad a la que servimos. Tender hacia la justicia, entonces, requiere amarla como una realidad a la que sólo se llega si se unen la atención constante, el desinterés radical y un discernimiento perseverante. Quien ejerce la justicia se pone al servicio de las personas, del pueblo y del estado, con plena y constante dedicación. La grandeza de la justicia no disminuye cuando se aplica en lo pequeño, sino que siempre resalta cuando se ejerce con fidelidad al derecho y respeto a la persona, en cualquier parte del mundo [5] .
«Bienaventurados los que tienen hambre y sed de justicia, porque serán saciados» ( Mt 5,6). Con esta bienaventuranza, el Señor Jesús quiso expresar la tensión espiritual a la que es necesario estar abiertos, no sólo para alcanzar una verdadera justicia, sino sobre todo para buscarla, en particular, aquellos que deben aplicarla en las diferentes situaciones históricas. Tener “hambre y sed” de justicia significa ser conscientes de que exige el esfuerzo personal de interpretar la ley de la manera más humana posible, pero también pide aspirar a una “saciedad” que solo puede cumplirse en una justicia mayor, que trasciende las situaciones particulares.
Queridos amigos, el Jubileo también invita a reflexionar sobre un aspecto de la justicia que muchas veces no se aborda lo suficiente: la realidad de tantos países y pueblos que tienen “hambre y sed de justicia”, porque sus condiciones de vida son tan injustas e inhumanas que resultan inaceptables. Al panorama internacional actual deberían aplicarse estas afirmaciones siempre válidas: «No puede gobernarse un estado sin justicia. Porque donde no hay justicia no puede haber tampoco un Derecho. Lo que se hace según Derecho se hace con justicia. Pero lo que se hace injustamente es imposible que sea según Derecho. […] Donde no hay justicia no hay Estado. La justicia, por otra parte, es la virtud que da a cada uno lo suyo. Ahora bien, ¿qué justicia humana es aquella que arranca al hombre del Dios verdadero?» [6] . Las exigentes palabras de san Agustín nos inspiran a todos a dar siempre lo mejor en el ejercicio de la justicia al servicio del pueblo, con la mirada puesta en Dios, para respetar plenamente la justicia, el derecho y la dignidad de las personas.
Con este deseo, les agradezco y bendigo de corazón a cada uno de ustedes, a sus familias y a su trabajo.

[1] Cf. Catecismo de la Iglesia Católica , n. 1804.
[2] Ibíd , n. 1807.
[3] Ibíd.
[4] S. Agustín, Cartas 167, 2, 5.
[5] Cf. Íd., De doctrina christiana IV, 18, 35.
[6] Íd., De civitate Dei , XIX, 21, 1.",2025-09-20_discurso_jubileo_de_los_trabajadores_por_la_justicia_audiencia_con_el_santo_padre_20_de_septiembre_de_2025
Discurso,2025-09-19,"A los participantes en el encuentro promovido por el Consejo Episcopal Latinoamericano (CELAM), la Pontificia Academia para la Vida y el Instituto Juan Pablo II (19 de septiembre de 2025)",https://www.vatican.va/content/leo-xiv/es/speeches/2025/september/documents/20250919-incontro.html,"DISCURSO DEL SANTO PADRE LEÓN XIV A LOS PARTICIPANTES EN LOS ENCUENTROS PROMOVIDOS POR EL CONSEJO EPISCOPAL LATINOAMERICANO (CELAM), LA PONTIFICIA ACADEMIA PARA LA VIDA Y EL INSTITUTO JUAN PABLO II
Sala del Consistorio Viernes, 19 de septiembre de 2025
[ Multimedia ]
____________________________________
En el nombre del Padre, del Hijo, y del Espíritu Santo.
La paz esté con ustedes.
Muy buenos días, perdonen que llego un poco atrasado, gracias por la paciencia. Vamos a compartir unos pocos momentos, pero es un gusto.
Estoy contento de recibirlos hoy en el hogar de Pedro, el hogar de la Iglesia donde todos debemos sentirnos una gran familia reunidos en torno al fuego de su amor. Ustedes han dialogado durante estos días siguiendo un método sinodal, reflexionando sobre algunas cuestiones de actualidad que afectan la vida familiar. Vivir la sinodalidad en la familia requiere “caminar juntos”, compartiendo penas y alegrías, dialogando respetuosa y sinceramente entre todos sus miembros, aprendiendo a escucharse y a llegar a tomar las decisiones familiares importantes para todos.
Siguiendo este tema, y como diría nuestro querido Papa Francisco , les propongo tres palabras para reflexionar juntos: jubileo , esperanza y familia .
Jubileo , en el Antiguo Testamento, evocaba el regreso: volver a la tierra, a la condición primera de hombres libres, a los orígenes de la justicia y de la misericordia de Dios (cf. Lv 25). Hoy ese volver debemos leerlo como un llamado a regresar al centro de nuestra vida, a Dios mismo, al Dios de Jesucristo.
El Jubileo nos invita también a pensar en nuestras raíces: a la fe recibida de nuestros padres, a la oración perseverante de nuestras abuelas desgranando las cuentas del rosario, a su vida sencilla, humilde y honesta que, como fermento, sostuvo a tantas familias y comunidades. En ellas aprendimos que Jesús es el Camino, la Verdad y la Vida (cf. Jn 14,6). En Él encontramos nuestra verdadera alegría: el júbilo de sabernos en casa, en el lugar donde debemos estar.
El Jubileo de la Esperanza es un camino hacia el encuentro con esa Verdad que es Dios mismo. Jesús, al comenzar su misión describe este jubileo como año de gracia (cf. Lc 4,19) y después de la resurrección llama a los discípulos a “volver a Galilea” (cf. Mt 28,10). No debemos caer en el peligro de fundar nuestras vidas en seguridades humanas y en expectativas mundanas. En ámbito social podríamos traducir esta tentación en el intento de “ir tirando”, como decía san Pier Giorgio Frassati (cf. Carta a Isidoro Bonini , 27 de febrero de 1925), recientemente canonizado. Asimismo, somos conscientes de que hoy en día hay auténticas amenazas a la dignidad de la familia, como, por ejemplo, los problemas relativos a la pobreza, la falta de trabajo y de acceso a los sistemas de salud, los abusos a los más vulnerables, las migraciones, las guerras (cf. Francisco , Exhort. ap. postsin. Amoris laetitia , 44-46). Las instituciones públicas y la Iglesia tienen la responsabilidad de buscar cómo promover el diálogo y fortalecer los elementos en la sociedad que favorezcan la vida en familia y la educación de sus miembros (cf. S. Juan Pablo II , Carta enc. Sollicitudo rei socialis , 8).
En ese contexto, podemos entender la familia como un don y una tarea. Es crucial fomentar la corresponsabilidad y el protagonismo de las familias en la vida social, política y cultural, promoviendo su valiosa contribución en la comunidad. En cada hijo, en cada esposa o esposo, Dios nos encomienda a su Hijo, a su Madre, como hizo con san José, para ser, junto a ellos, base, fermento y testimonio del amor de Dios en medio de los hombres. Para ser Iglesia doméstica y hogar donde arda el fuego del Espíritu Santo, difunda su calor, aporte sus dones y experiencias para el bien común y los convoque a todos a vivir en esperanza.
San Pablo VI , en su célebre homilía en Nazaret , exhortaba a seguir el ejemplo de la Sagrada Familia, acompañando, sosteniendo al otro en el silencio, en el trabajo y en la oración, para que Dios realice en él el proyecto de amor que le ha reservado. Este es el amor que se encarna en cada vida nacida a la fe desde el bautismo y ungida “para proclamar este año de gracia” a todos, que encontrará a Jesús en la Eucaristía y en el sacramento del perdón, que lo seguirá en la misión como sacerdote, como padre cristiano o como consagrado, hasta el encuentro definitivo, hasta la meta de nuestra esperanza.
Queridos hermanos y hermanas, la conclusión de esta reflexión debe ser una llamada al compromiso y a esa alegría desbordante que invadió a los discípulos al encontrar a Jesús Resucitado y los llevó a proclamar su nombre por toda la tierra. San Agustín definía ese “júbilo” como un regocijo que no se puede expresar con palabras y que es propio, especialmente, del Inefable (cf. Comentario al Salmo 94, 3). Sean nuestras familias ese canto silencioso de esperanza, capaz de difundir con su vida la luz de Cristo, «para que la alegría del Evangelio - citando Papa Francisco - llegue hasta los confines de la tierra y ninguna periferia se prive de su luz» ( Francisco , Exhort. ap. Evangelii gaudium , 288).
A todos ustedes los encomiendo a la intercesión de la Sagrada Familia de Nazaret, modelo perfecto que Dios ofrece como respuesta al grito desesperado de ayuda de tantas familias. Al imitarla, nuestros hogares serán antorchas vivas de la luz de Dios. Que el Señor los bendiga. Muchas gracias.
El Señor esté con ustedes.
Bendito sea el nombre del Señor.
Nuestra ayuda es el nombre del Señor.
Les bendiga Dios Todopoderoso, Padre, Hijo, y Espíritu Santo.
Amén.
Muchas gracias. Felicidades por la labor realizada.",2025-09-19_discurso_a_los_participantes_en_el_encuentro_promovido_por_el_consejo_episcopal_latinoamericano_celam_la_pont
