tipo,fecha,titulo,url,texto,filename
Ángelus,2025-06-15,"Ángelus, 15 de junio de 2025",https://www.vatican.va/content/leo-xiv/es/angelus/2025/documents/20250615-angelus.html,"PAPA LEÓN XIV
ÁNGELUS
Plaza de San Pedro Domingo, 15 de junio de 2025
[ Multimedia ]
________________________________________
Queridos hermanos y hermanas, ¡buenos días!:
Acabamos de concluir la celebración eucarística por el Jubileo del Deporte, y ahora con alegría dirijo mi saludo a todos ustedes, deportistas de diversas las edades y procedencias. Les exhorto a vivir la actividad deportiva, incluso a nivel competitivo, siempre con espíritu de gratuidad, con espíritu “lúdico” en el sentido noble de este término, porque en el juego y en la sana diversión el ser humano se asemeja a su Creador.
Quiero subrayar que el deporte es un camino para construir la paz, porque es una escuela de respeto y lealtad, que hace crecer la cultura del encuentro y la fraternidad. Hermanas y hermanos, los animo a practicar este estilo de manera consciente, oponiéndose a toda forma de violencia y opresión.
¡El mundo actual lo necesita tanto! De hecho, hay muchos conflictos armados. En Myanmar, a pesar del cese del fuego, continúan los combates, con daños incluso a las infraestructuras civiles. Invito a todas las partes a emprender el camino del diálogo inclusivo, el único que puede conducir a una solución pacífica y estable.
En la noche del 13 al 14 de junio, en la ciudad de Yelwata, en el área administrativa local de Gouma, en el estado de Benue, Nigeria, se produjo una terrible masacre en la que unas doscientas personas fueron asesinadas con extrema crueldad, la mayoría de ellas desplazados internos acogidos por la misión católica local. Rezo para que la seguridad, la justicia y la paz prevalezcan en Nigeria, un país querido y tan afectado por diversas formas de violencia. Y rezo especialmente por las comunidades cristianas rurales del estado de Benue, que son víctimas incesantes de la violencia.
Pienso también en la República de Sudán, devastada por la violencia desde hace ya más de dos años. Me ha llegado la triste noticia de la muerte del sacerdote Luke Jumu, párroco de El Fasher, víctima de un bombardeo. Mientras aseguro mis oraciones por él y por todas las víctimas, renuevo el llamamiento a los combatientes para que se detengan, protejan a los civiles y emprendan un diálogo por la paz. Exhorto a la comunidad internacional a intensificar sus esfuerzos para proporcionar al menos la asistencia esencial a la población, gravemente afectada por la crisis humanitaria.
Seguimos rezando por la paz en Oriente Medio, en Ucrania y en todo el mundo.
Esta tarde, en la Basílica de San Pablo Extramuros, será beatificado Floribert Bwana Chui, joven mártir congoleño. Fue asesinado a los veintiséis años porque, como cristiano, se oponía a la injusticia y defendía a los pequeños y a los pobres. ¡Que su testimonio dé valor y esperanza a los jóvenes de la República Democrática del Congo y de toda África!
¡Feliz domingo a todos! Y a ustedes, jóvenes, les digo: ¡los espero dentro de un mes para el Jubileo de los jóvenes! Que la Virgen María, Reina de la Paz, interceda por nosotros.
Angelus Domini…",2025-06-15_ángelus_angelus_15_de_junio_de_2025
Homilia,2025-06-15,Santa Misa por el Jubileo del Deporte en la solemnidad de la Santísima Trinidad (15 de junio de 2025),https://www.vatican.va/content/leo-xiv/es/homilies/2025/documents/20250615-omelia-giubileo-sport.html,"SOLEMNIDAD DE LA SANTÍSIMA TRINIDAD JUBILEO DEL DEPORTE
HOMILÍA DEL SANTO PADRE LEÓN XIV
Basílica de San Pedro Domingo, 15 de junio de 2025
[ Multimedia ]
________________________________________
Queridos hermanos y hermanas:
En la primera Lectura hemos escuchado estas palabras: «Así habla la Sabiduría de Dios: “El Señor me creó como primicia de sus caminos, antes de sus obras, desde siempre. […] Cuando él afianzaba el cielo, yo estaba allí; […] yo estaba a su lado como un hijo querido y lo deleitaba día tras día, recreándome delante de él en todo tiempo, recreándome sobre la faz de la tierra, y mi delicia era estar con los hijos de los hombres» ( Pr 8,22.27.30-31). Para san Agustín, la Trinidad y la sabiduría están íntimamente relacionadas. La sabiduría divina se revela en la Santísima Trinidad, y la sabiduría nos lleva siempre a la verdad.
Y hoy, mientras c elebramos la solemnidad de la Santísima Trinidad, estamos viviendo el Jubileo del Deporte . El binomio Trinidad-deporte no es precisamente habitual, sin embargo, la asociación no es absurda. De hecho, toda buena actividad humana lleva consigo un reflejo de la belleza de Dios, y sin duda el deporte es una de ellas. Después de todo, Dios no es estático, no está cerrado en sí mismo. Es comunión, relación viva entre el Padre, el Hijo y el Espíritu Santo, que se abre a la humanidad y al mundo. La teología llama a esta realidad pericoresis , es decir, “danza”: una danza de amor recíproco.
Es de este dinamismo divino de donde brota la vida. Hemos sido creados por un Dios que se complace y se regocija en dar la existencia a sus criaturas, que “juega”, como nos ha recordado la primera lectura (cf. Pr 8,30-31). Algunos Padres de la Iglesia hablan incluso, con audacia, de un Deus ludens , de un Dios que se divierte (cf. S. Salonio de Ginebra, in Expositio Mystica in Parabolas Salomonis et Ecclesiasten ; S. Gregorio Nacianceno, Carmina , I, 2, 589). Es por eso que el deporte puede ayudarnos a encontrar a Dios Trinidad: porque requiere un movimiento del yo hacia el otro, ciertamente exterior, pero también y sobre todo interior. Sin esto, se reduce a una estéril competencia de egoísmos.
Pensemos en una expresión que, en italiano, se utiliza habitualmente para animar a los atletas durante las competiciones: los espectadores gritan: “ Dai !” [en español “¡Dale!”]. Quizás no nos damos cuenta, pero es un imperativo precioso; es el imperativo del verbo “dar”. Y esto nos puede hacer reflexionar: no se trata solo de dar una prestación física, quizá extraordinaria, sino de darse uno mismo, de «jugársela». Se trata de entregarse por los demás —por el propio crecimiento, por los aficionados, por los seres queridos, por los entrenadores, por los colaboradores, por el público, incluso por los adversarios— y, si se es verdaderamente deportista, esto vale independientemente del resultado. San Juan Pablo II —un deportista, como sabemos— hablaba así de ello: “El deporte es alegría de vivir, juego, fiesta, y como tal debe valorarse […] mediante la recuperación de su gratuidad, de su capacidad para estrechar lazos de amistad, para favorecer el diálogo y la apertura de unos hacia otros, […] por encima de las duras leyes de la producción y el consumo y de cualquier otra consideración puramente utilitaria y hedonista de la vida” (cf. Homilía para el Jubileo de los Deportistas , 12 abril 1984).
Desde este punto de vista, mencionamos en particular tres aspectos que hacen del deporte, hoy en día, un medio valioso para la formación humana y cristiana.
En primer lugar, en una sociedad marcada por la soledad , en la que el individualismo exagerado ha desplazado el centro de gravedad del “nosotros” al “yo”, terminando por ignorar al otro, el deporte —especialmente cuando se practica en equipo— enseña el valor de la colaboración, de caminar juntos, de ese compartir que, como hemos dicho, está en el corazón mismo de la vida de Dios (cf. Jn 16, 14-15). De este modo, puede convertirse en un importante instrumento de recomposición y encuentro, entre los pueblos, en las comunidades, en los entornos escolares y laborales, en las familias.
En segundo lugar, en una sociedad cada vez más digital , en la que las tecnologías, aunque acercan a personas lejanas, a menudo alejan a quienes están cerca, el deporte valora la concreción de estar juntos, el sentido del cuerpo, del espacio, del esfuerzo, del tiempo real. Así, frente a la tentación de huir a mundos virtuales, ayuda a mantener un contacto saludable con la naturaleza y con la vida concreta, único lugar en el que se ejerce el amor (cf. 1 Jn 3,18).
En tercer lugar, en una sociedad competitiva , donde parece que sólo los fuertes y los ganadores merecen vivir, el deporte también enseña a perder, poniendo a prueba al hombre, en el arte de la derrota , con una de las verdades más profundas de su condición: la fragilidad, el límite, la imperfección. Esto es importante, porque es a partir de la experiencia de esta fragilidad que nos abrimos a la esperanza. El atleta que nunca se equivoca, que no pierde jamás, no existe. Los campeones no son máquinas infalibles, sino hombres y mujeres que, incluso cuando caen, encuentran el valor para levantarse. Recordemos una vez más, a este respecto, las palabras de san Juan Pablo II , quien decía que Jesús es “ el verdadero atleta de Dios ”, porque venció al mundo no con la fuerza, sino con la fidelidad del amor (cf. Homilía en la Misa por el Jubileo de los deportistas , 29 octubre 2000).
No es casualidad que, en la vida de muchos santos de nuestro tiempo, el deporte haya tenido un papel significativo, tanto como práctica personal que como vía de evangelización. Pensemos en el beato Pier Giorgio Frassati, patrono de los deportistas, que será proclamado santo el próximo 7 de septiembre. Su vida, sencilla y luminosa, nos recuerda que, así como nadie nace campeón, tampoco nadie nace santo. Es el entrenamiento diario del amor lo que nos acerca a la victoria definitiva (cf. Rm 5,3-5) y nos hace capaces de trabajar en la construcción de un mundo nuevo. Así lo afirmaba también san Pablo VI , veinte años después del final de la Segunda Guerra Mundial, recordando a los miembros de una asociación deportiva católica lo mucho que el deporte había contribuido a devolver la paz y la esperanza a una sociedad devastada por las consecuencias de la guerra (cf. Discurso a los miembros del C.S.I. , 20 marzo 1965). Decía, “es la formación de una sociedad nueva a la que se dirigen vuestros esfuerzos: […] conscientes de que el deporte, en los sanos elementos formativos que valora, puede ser un instrumento muy útil para la elevación espiritual de la persona humana, condición primera e indispensable de una sociedad ordenada, serena y constructiva” (cf. ibíd ).
Queridos deportistas, la Iglesia les confía una misión maravillosa: ser, en las actividades que realizan, reflejo del amor de Dios Trinidad para bien de ustedes y sus hermanos. Comprométanse con entusiasmo en esta misión: como atletas, como formadores, como sociedad, como grupos, como familias. El Papa Francisco solía subrayar que María, en el Evangelio, se nos presenta activa, en movimiento, incluso “corriendo” (cf . Lc 1,39), dispuesta, como saben hacer las madres, ponerse en movimiento ante la señal de Dios, para socorrer a sus hijos (cf. Discurso a los voluntarios de la JMJ , 6 agosto 2023). Le pedimos que acompañe nuestros esfuerzos y nuestros impulsos, y que los oriente siempre hacia lo mejor, hasta la victoria más grande: la de la eternidad, el «campo infinito» donde el juego no tendrá fin y la alegría será plena (cf. 1 Co 9,24-25; 2 Tim 4,7-8).",2025-06-15_homilia_santa_misa_por_el_jubileo_del_deporte_en_la_solemnidad_de_la_santisima_trinidad_15_de_junio_de_2025
Discurso,2025-06-12,Al Clero de la diócesis de Roma (12 de junio de 2025),https://www.vatican.va/content/leo-xiv/es/speeches/2025/june/documents/20250612-clero-romano.html,"DISCURSO DEL SANTO PADRE LEÓN XIV AL CLERO DE LA DIÓCESIS DE ROMA
Aula Pablo VI Jueves, 12 de junio de 2025
[ Multimedia ]
___________________________________
Quiero pedir un fuerte aplauso para todos los que están aquí y para todos los sacerdotes y diáconos de Roma.
Queridos presbíteros y diáconos que prestan su servicio en la diócesis de Roma, queridos seminaristas, ¡les saludo a todos con afecto y amistad!
Agradezco a Su Eminencia, el cardenal vicario, sus palabras de saludo y la presentación que ha hecho, contando un poco de su presencia en esta ciudad.
He deseado encontrarme con ustedes para conocerlos de cerca y comenzar a caminar juntos. Les doy las gracias por su vida entregada al servicio del Reino, por sus esfuerzos cotidianos, por tanta generosidad en el ejercicio del ministerio, por todo lo que viven en silencio y que, a veces, va acompañado de sufrimiento o incomprensión. Realizan servicios diferentes, pero todos ustedes son preciosos a los ojos de Dios y en la realización de su proyecto.
La diócesis de Roma preside en la caridad y en la comunión, y puede cumplir esta misión gracias a cada uno de ustedes, en el vínculo de gracia con el obispo y en la fecunda corresponsabilidad con todo el pueblo de Dios. La nuestra es una diócesis muy particular, porque muchos sacerdotes llegan de diferentes partes del mundo, especialmente por motivos de estudio; y esto implica que también la vida pastoral —pienso sobre todo en las parroquias— está marcada por esta universalidad y por la acogida recíproca que ello conlleva.
A partir precisamente de esta mirada universal que ofrece Roma, quisiera compartir cordialmente con ustedes algunas reflexiones.
La primera nota, que me está particularmente cerca, es la de la unidad y la comunión . En la oración llamada «sacerdotal», como sabemos, Jesús pidió al Padre que los suyos sean uno (cf. Jn 17, 20-23). El Señor sabe bien que solo unidos a Él y entre nosotros podemos dar fruto y dar al mundo un testimonio creíble. La comunión presbiteral aquí en Roma se ve favorecida por el hecho de que, según una antigua tradición, se suele vivir juntos, en rectorías, colegios u otras residencias. El presbítero está llamado a ser hombre de comunión, porque él es el primero en vivirla y alimentarla continuamente. Sabemos que esta comunión se ve hoy obstaculizada por un clima cultural que favorece el aislamiento o la autorreferencialidad. Ninguno de ustedes está exento de estas insidias que amenazan la solidez de nuestra vida espiritual y la fuerza de nuestro ministerio.
Pero debemos vigilar porque, además del contexto cultural, la comunión y la fraternidad entre nosotros también encuentran algunos obstáculos, por así decirlo «internos», que afectan a la vida eclesial de la diócesis, a las relaciones interpersonales y también a lo que habita en el corazón, especialmente ese sentimiento de cansancio que sobreviene porque hemos vivido fatigas particulares, porque no nos hemos sentido comprendidos y escuchados, o por otras razones. Quisiera ayudarles, caminar con ustedes, para que cada uno recupere la serenidad en su ministerio; pero precisamente por eso les pido un impulso en la fraternidad presbiteral, que hunde sus raíces en una vida espiritual sólida, en el encuentro con el Señor y en la escucha de su Palabra. Alimentados por esta savia, logramos vivir relaciones de amistad, compitiendo en estimarnos unos a otros (cf. Rom 12,10); sentimos la necesidad del otro para crecer y alimentar la misma tensión eclesial.
La comunión también debe traducirse en compromiso en esta diócesis; con carismas diferentes, con itinerarios formativos diferentes y también con servicios diferentes, pero único debe ser el esfuerzo por sostenerla. Pido a todos que presten atención al camino pastoral de esta Iglesia, que es local, pero, por quien la guía, es también universal. Caminar juntos es siempre garantía de fidelidad al Evangelio; juntos y en armonía, tratando de enriquecer a la Iglesia con el propio carisma, pero teniendo en el corazón el ser el único cuerpo del que Cristo es la Cabeza.
La segunda nota que deseo entregarle es la de la ejemplaridad . Con motivo de las ordenaciones sacerdotales del pasado 31 de mayo, en la homilía recordé la importancia de la transparencia de la vida, basándome en las palabras de San Pablo a los ancianos de Éfeso: «Ustedes saben cómo me he comportado» ( Hch 20,18). Se lo pido con corazón de padre y de pastor: ¡comprometámonos todos a ser sacerdotes creíbles y ejemplares! Somos conscientes de los límites de nuestra naturaleza y el Señor nos conoce en profundidad; pero hemos recibido una gracia extraordinaria, se nos ha confiado un tesoro precioso del que somos ministros, servidores. Y al servidor se le pide fidelidad. Ninguno de nosotros está exento de las sugestiones del mundo y la ciudad, con sus mil propuestas podría incluso alejarnos del deseo de una vida santa, induciendo una nivelación a la baja en el que se pierden los valores profundos del ser presbíteros. Déjense atraer una vez más por la llamada del Maestro, para sentir y vivir el amor de la primera hora, el que les impulsó a tomar decisiones difíciles y a hacer renuncias valientes. Si juntos intentamos ser ejemplares en una vida humilde, entonces podremos expresar la fuerza renovadora del Evangelio para cada hombre y cada mujer.
Una última nota que deseo entregarles es la de mirar los desafíos de nuestro tiempo con clave profética . Estamos preocupados y afligidos por todo lo que sucede cada día en el mundo: nos hieren las violencias que generan muerte, nos interpelan las desigualdades, las pobrezas, tantas formas de marginación social, el sufrimiento difundido que toma los rasgos de un malestar que ya no perdona a nadie. Y estas realidades no solo ocurren en otros lugares, lejos de nosotros, sino que también afectan a nuestra ciudad de Roma, marcada por múltiples formas de pobreza y por graves emergencias como la de la vivienda. Una ciudad en la que, como señalaba el papa Francisco, a la «gran belleza» y al encanto del arte debe corresponder también «el simple decoro y la normal funcionalidad de los lugares y de las situaciones de la vida ordinaria, cotidiana. Porque una ciudad más habitable para sus ciudadanos es también más acogedora para todos» ( Homilía en las vísperas con Te Deum , 31 de diciembre de 2023).
El Señor nos ha querido precisamente en este tiempo lleno de desafíos que, a veces, nos parecen más grandes que nuestras fuerzas. Estamos llamados a abrazar estos desafíos, a interpretarlos evangélicamente, a vivirlos como ocasiones de testimonio. ¡No huyamos ante ellos! Que el compromiso pastoral, como el del estudio, se convierta para todos en una escuela para aprender a construir el Reino de Dios en el hoy de una historia compleja y estimulante. En tiempos recientes hemos tenido el ejemplo de santos sacerdotes que supieron conjugar la pasión por la historia con el anuncio del Evangelio, como don Primo Mazzolari y don Lorenzo Milani, profetas de paz y justicia. Y aquí en Roma hemos tenido a don Luigi Di Liegro que, ante tanta pobreza, dio su vida para buscar caminos de justicia y promoción humana. Bebamos de la fuerza de estos ejemplos para seguir sembrando semillas de santidad en nuestra ciudad.
Muy queridos, les aseguro mi cercanía, mi afecto y mi disponibilidad para caminar con ustedes. Encomendemos al Señor nuestra vida sacerdotal y pidámosle que crezcamos en la unidad, en la ejemplaridad y en el compromiso profético para servir a nuestro tiempo. Nos acompañe la sentida exhortación de san Agustín, que dijo: «Amar esta Iglesia, permanecer en esta Iglesia, ser esta Iglesia. Amar al buen Pastor, al Esposo hermoso, que no engaña a nadie y no quiere que nadie perezca. Oren también por las ovejas descarriadas: que también ellas vengan, también ellas reconozcan, también ellas amen, para que haya un solo rebaño y un solo pastor» ( Discurso 138 , 10). ¡Gracias! _________________________ Boletín de la Oficina de Prensa de la Santa Sede , 12 de junio de 2025",2025-06-12_discurso_al_clero_de_la_diocesis_de_roma_12_de_junio_de_2025
