tipo,fecha,titulo,url,texto,filename
Discurso,2025-05-15,A los Hermanos de las Escuelas Cristianas (15 de mayo de 2025),https://www.vatican.va/content/leo-xiv/es/speeches/2025/may/documents/20250515-fratelli-scuole-cristiane.html,"DISCURSO DEL SANTO PADRE LEÓN XIV A LOS HERMANOS DE LAS ESCUELAS CRISTIANAS
Jueves, 15 de mayo de 2025
[ Multimedia ]
___________________________________
En el nombre del Padre, del Hijo y del Espíritu Santo, ¡la paz esté con ustedes!
Eminencia,
queridos hermanos y hermanas, ¡bienvenidos!
Me alegra mucho recibirlos en el tercer centenario de la promulgación de la bula In apostolicae dignitatis solio , con la que el Papa Benedicto XIII aprobó su Instituto y su Regla (26 de enero de 1725). Coincide también con el 75º aniversario de la proclamación, por parte del Papa Pío XII , de San Juan Bautista de La Salle como «Patrono celestial de todos los educadores» (cf. Lett. Ap. Quod ait , 15 de mayo de 1950: AAS 12, 1950, 631-632).
Después de tres siglos, es hermoso constatar cómo su presencia sigue trayendo consigo la frescura de una rica y vasta realidad educativa, con la que aún hoy, en diversas partes del mundo, con entusiasmo, fidelidad y espíritu de sacrificio, se dedican a la formación de los jóvenes.
Precisamente a la luz de estas conmemoraciones, quisiera detenerme a reflexionar con ustedes sobre dos aspectos de su historia que considero importantes para todos nosotros: la atención a la actualidad y la dimensión ministerial y misionera de la enseñanza en la comunidad.
Los inicios de su obra hablan mucho de «actualidad». San Juan Bautista de La Salle comenzó respondiendo a la petición de ayuda de un laico, Adriano Nyel, que luchaba por mantener en pie sus «escuelas para pobres». Su fundador reconoció en su petición de ayuda una señal de Dios, aceptó el reto y se puso manos a la obra. Así, más allá de sus propias intenciones y expectativas, dio vida a un nuevo sistema de enseñanza: el de las Escuelas Cristianas , gratuitas y abiertas a todos. Entre los elementos innovadores que introdujo en esta revolución pedagógica, recordamos la enseñanza dirigida a las clases y no a los alumnos individuales; la adopción, como lengua de enseñanza, en lugar del latín, del francés, accesible a todos; las clases dominicales, a las que también podían asistir los jóvenes obligados a trabajar entre semana; la participación de las familias en los itinerarios escolares, según el principio del «triángulo educativo», válido aún hoy. Así, los problemas, a medida que se presentaban, en lugar de desanimarlo, lo estimulaban a buscar respuestas creativas y a adentrarse en caminos nuevos y a menudo inexplorados.
Todo esto no puede sino hacernos pensar y suscitar en nosotros preguntas útiles. ¿Cuáles son, en el mundo juvenil de nuestros días, los retos más urgentes que hay que afrontar? ¿Qué valores hay que promover? ¿Con qué recursos se puede contar?
Los jóvenes de nuestro tiempo, como los de todas las épocas, son volcanes de vida, de energía, de sentimientos, de ideas. Lo vemos en las cosas maravillosas que saben hacer en tantos campos. Pero también necesitan ayuda para hacer crecer en armonía tanta riqueza y para superar lo que, aunque de manera diferente al pasado, todavía puede impedir su sano desarrollo.
Si, por ejemplo, en el siglo XVII el uso de la lengua latina era para muchos una barrera comunicativa insuperable, hoy hay otros obstáculos que afrontar. Pensemos en el aislamiento que provocan los modelos relacionales cada vez más extendidos, basados en la superficialidad, el individualismo y la inestabilidad afectiva; en la difusión de esquemas de pensamiento debilitados por el relativismo; en el predominio de ritmos y estilos de vida en los que no hay suficiente espacio para la escucha, la reflexión y el diálogo, en la escuela, en la familia, a veces entre los propios compañeros, con la soledad que ello conlleva.
Se trata de retos exigentes, de los que, sin embargo, también nosotros, como San Juan Bautista de La Salle, podemos hacer trampolines para explorar caminos, elaborar instrumentos y adoptar lenguajes nuevos, con los que seguir tocando el corazón de los alumnos, animándolos y estimulándolos a afrontar con valentía todos los obstáculos para dar lo mejor de sí mismos en la vida, según los designios de Dios. En este sentido, es loable la atención que prestan en sus escuelas a la formación de los docentes y a la creación de comunidades educativas en las que el esfuerzo didáctico se enriquece con la aportación de todos. Los animo a continuar por este camino.
Pero antes de concluir, quisiera mencionar otro aspecto de la realidad lasaliana que considero importante: la docencia vivida como ministerio y misión , como consagración en la Iglesia. San Juan Bautista de La Salle no quería que entre los maestros de las Escuelas Cristianas hubiera sacerdotes, sino solo «hermanos», para que todos sus esfuerzos se dirigieran, con la ayuda de Dios, a la educación de los alumnos. Le gustaba decir: «Su altar es la cátedra», promoviendo así en la Iglesia de su tiempo una realidad hasta entonces desconocida: la de los maestros y catequistas laicos investidos, en la comunidad, de un verdadero «ministerio», según el principio de evangelizar educando y educar evangelizando (cf. Francisco, Discurso a los participantes en el Capítulo General de los Hermanos de las Escuelas Cristianas , 21 de mayo de 2022).
Así, el carisma de la escuela, que ustedes abrazan con el cuarto voto de la enseñanza, además de un servicio a la sociedad y una valiosa obra de caridad, aparece aún hoy como una de las expresiones más bellas y elocuentes de ese munus sacerdotal, profético y real que todos hemos recibido en el Bautismo, como subrayan los documentos del Concilio Vaticano II . En sus realidades educativas, así, los religiosos hacen proféticamente visible, a través de su consagración, el ministerio bautismal que impulsa a todos (cf. Const. dogm. Lumen gentium, 44 ), cada uno según su estado y sus tareas, sin diferencias, a «contribuir como miembros vivos […] al crecimiento de la Iglesia y a su santificación permanente» ( ibídem , 33 ).
Por este motivo, deseo que las vocaciones a la consagración religiosa lasaliana crezcan, sean alentadas y promovidas, en sus escuelas y fuera de ellas, y que, en sinergia con todos los demás componentes formativos, contribuyan a suscitar entre los jóvenes que las frecuentan caminos alegres y fecundos de santidad.
¡Gracias por lo que hacen! Rezo por ustedes y les imparto la Bendición Apostólica, que de muy buen grado extiendo a toda la Familia Lasaliana. _______________________________________ Boletín de la Oficina de Prensa de la Santa Sede , 15 de mayo de 2025",2025-05-15_discurso_a_los_hermanos_de_las_escuelas_cristianas_(15_de_mayo_de_2025)
Discurso,2025-05-14,A los participantes en el Jubileo de las Iglesias Orientales (14 de mayo de 2025),https://www.vatican.va/content/leo-xiv/es/speeches/2025/may/documents/20250514-giubileo-chiese-orientali.html,"DISCURSO DEL SANTO PADRE LEÓN XIV A LOS PARTICIPANTES EN EL JUBILEO DE LAS IGLESIAS ORIENTALES
Aula Pablo VI Miércoles, 14 de mayo de 2025
[ Multimedia ]
___________________________________
En el nombre del Padre y del Hijo y del Espíritu Santo, ¡la paz esté con ustedes!
Beatitudes, Eminencias, Excelencias, queridos sacerdotes, consagradas y consagrados, hermanos y hermanas,
Cristo ha resucitado. ¡Ha resucitado verdaderamente! Los saludo con las palabras que, en muchas regiones, el Oriente cristiano no se cansa de repetir en este tiempo pascual, profesando el núcleo central de la fe y de la esperanza. Y es hermoso verlos aquí precisamente con motivo del Jubileo de la esperanza, de la que la resurrección de Jesús es el fundamento indestructible. ¡Bienvenidos a Roma! Me alegra encontrarme con ustedes y dedicar a los fieles orientales uno de los primeros encuentros de mi pontificado.
Ustedes son valiosos. Al mirarlos, pienso en la variedad de sus procedencias, en la historia gloriosa y en los duros sufrimientos que muchas de sus comunidades han padecido o padecen. Y quisiera reiterar lo que dijo el papa Francisco sobre las Iglesias orientales: «Son Iglesias que deben ser amadas: custodian tradiciones espirituales y sapienciales únicas, y tienen tanto que decirnos sobre la vida cristiana, la sinodalidad y la liturgia; piensen en los Padres antiguos, en los Concilios, en el monacato: tesoros inestimables para la Iglesia» ( Discurso a los participantes en la Asamblea de la ROACO, 27 de junio de 2024 ).
Deseo citar también al Papa León XIII , que fue el primero en dedicar un documento específico a la dignidad de sus Iglesias, dada ante todo por el hecho de que «la obra de la redención humana comenzó en Oriente» (cf. Lett. ap. Orientalium dignitas , 30 de noviembre de 1894 ). Sí, ustedes tienen «un papel único y privilegiado, por ser el marco originario de la Iglesia primitiva» (San Juan Pablo II, Carta. ap. Orientale Lumen , 5). Es significativo que algunas de sus liturgias —que estos días están celebrando solemnemente en Roma según las diversas tradiciones— sigan utilizando la lengua del Señor Jesús. Pero el papa León XIII hizo un sentido llamamiento para que «la legítima variedad de la liturgia y la disciplina oriental [...] redunde en [...] gran decoro y utilidad de la Iglesia» ( Lett. ap. Orientalium dignitas ). Su preocupación de entonces es muy actual, porque en nuestros días muchos hermanos y hermanas orientales, entre los que se encuentran varios de ustedes, obligados a huir de sus territorios de origen a causa de la guerra y las persecuciones, de la inestabilidad y de la pobreza, corren el riesgo, al llegar a Occidente, de perder, además de su patria, también su identidad religiosa. Así, con el paso de las generaciones, se pierde el patrimonio inestimable de las Iglesias orientales.
Hace más de un siglo, León XIII señaló que «la conservación de los ritos orientales es más importante de lo que se cree» y, con este fin, prescribió incluso que «cualquier misionero latino, del clero secular o regular, que con consejos o ayudas atraiga a algún oriental al rito latino» sea «destituido y excluido de su cargo» ( ibíd . ). Acogemos el llamamiento a custodiar y promover el Oriente cristiano, sobre todo en la diáspora; aquí, además de erigir, donde sea posible y oportuno, circunscripciones orientales, es necesario sensibilizar a los latinos. En este sentido, pido al Dicasterio para las Iglesias Orientales , al que agradezco su trabajo, que me ayude a definir principios, normas, y directrices a través de los cuales los pastores latinos puedan apoyar concretamente a los católicos orientales de la diáspora, y a preservar sus tradiciones vivas y a enriquecer con su especificidad el contexto en el que viven.
La Iglesia los necesita. ¡Cuán grande es la contribución que el Oriente cristiano puede darnos hoy! ¡Cuánta necesidad tenemos de recuperar el sentido del misterio, tan vivo en sus liturgias, que involucran a la persona humana en su totalidad, cantan la belleza de la salvación y suscitan asombro por la grandeza divina que abraza la pequeñez humana! ¡Y cuán importante es redescubrir, también en el Occidente cristiano, el sentido del primado de Dios, el valor de la mistagogia, de la intercesión incesante, de la penitencia, del ayuno, del llanto por los propios pecados y de toda la humanidad ( penthos ), tan típicos de las espiritualidades orientales! Por eso es fundamental custodiar sus tradiciones sin diluirlas, tal vez por practicidad y comodidad, para que no se corrompan por un espíritu consumista y utilitarista.
Sus espiritualidades, antiguas y siempre nuevas, son medicinales. En ellas, el sentido dramático de la miseria humana se funde con el asombro por la misericordia divina, de modo que nuestras bajezas no provocan desesperación, sino que invitan a acoger la gracia de ser criaturas sanadas, divinizadas y elevadas a las alturas celestiales. Necesitamos alabar y dar gracias sin cesar al Señor por esto. Con ustedes podemos rezar las palabras de San Efrén el sirio y decir a Jesús: «Gloria a ti, que hiciste de tu cruz un puente sobre la muerte. […] Gloria a ti, que te revestiste del cuerpo mortal y lo transformaste en fuente de vida para todos los mortales» ( Discurso sobre el Señor , 9). Es un don que hay que pedir: saber ver la certeza de la Pascua en cada tribulación de la vida y no desanimarnos recordando, como escribía otro gran padre oriental, que «el mayor pecado es no creer en las energías de la Resurrección» (San Isaac de Nínive, Sermones ascéticos , I, 5).
¿Quién, pues, más que ustedes, puede cantar palabras de esperanza en el abismo de la violencia? ¿Quién más que ustedes, que conocen de cerca los horrores de la guerra, hasta el punto de que el Papa Francisco llamó a sus Iglesias «martiriales» ( Discurso a la ROACO , cit.)? Es cierto: desde Tierra Santa hasta Ucrania, desde el Líbano hasta Siria, desde Oriente Medio hasta Tigray y el Cáucaso, ¡cuánta violencia! Y sobre todo este horror, sobre la masacre de tantas vidas jóvenes, que deberían provocar indignación, porque, en nombre de la conquista militar, son personas las que mueren, se alza un llamamiento: no tanto el del Papa, sino el de Cristo, que repite: «¡La paz esté con ustedes!» ( Jn 20,19.21.26). Y especifica: «Les dejo la paz, les doy mi paz. No como la da el mundo, yo se la doy a ustedes» ( Jn 14,27). La paz de Cristo no es el silencio sepulcral después del conflicto, no es el resultado de la opresión, sino un don que mira a las personas y reactiva su vida. Recemos por esta paz, que es reconciliación, perdón, valentía para pasar página y volver a comenzar.
Para que esta paz se difunda, yo emplearé todos mis esfuerzos. La Santa Sede está a disposición para que los enemigos se encuentren y se miren a los ojos, para que a los pueblos se les devuelva la esperanza y se les restituya la dignidad que merecen, la dignidad de la paz. Los pueblos quieren la paz y yo, con el corazón en la mano, digo a los responsables de los pueblos: ¡encontremos, dialoguemos, negociemos! La guerra nunca es inevitable, las armas pueden y deben callar, porque no resuelven los problemas, sino que los aumentan; porque pasarán a la historia quienes siembran la paz, no quienes cosechan víctimas; porque los demás no son ante todo enemigos, sino seres humanos: no son malos a quienes odiar, sino personas con quienes hablar. Rechacemos las visiones maniqueas típicas de los relatos violentos, que dividen el mundo entre buenos y malos.
La Iglesia no se cansará de repetirlo: que callen las armas. Y quiero dar gracias a Dios por todos aquellos que, en el silencio, en la oración, en la entrega, tejen tramas de paz ; y a los cristianos —orientales y latinos— que, especialmente en Oriente Medio, perseveran y resisten en sus tierras, más fuertes que la tentación de abandonarlas. A los cristianos hay que darles la posibilidad, no solo con palabras, de permanecer en sus tierras con todos los derechos necesarios para una existencia segura. ¡Les ruego que se comprometan por esto!
Y gracias, gracias a ustedes, queridos hermanos y hermanas de Oriente, de donde surgió Jesús, el Sol de justicia, por ser «luces del mundo» (cf. Mt 5,14). Sigan brillando por la fe, la esperanza y la caridad, y por nada más. Que sus Iglesias sean un ejemplo, y que los pastores promuevan con rectitud la comunión, sobre todo en los Sínodos de los Obispos, para que sean lugares de colegialidad y de auténtica corresponsabilidad. Cuiden la transparencia en la gestión de los bienes, den testimonio de una dedicación humilde y total al santo pueblo de Dios, sin apegos a los honores, a los poderes del mundo y a la propia imagen. San Simeón el Nuevo Teólogo daba un bello ejemplo: «Como quien, echando polvo sobre la llama de un horno encendido, la apaga, del mismo modo las preocupaciones de esta vida y todo tipo de apego a cosas mezquinas y sin valor destruyen el calor del corazón encendido al principio» ( Capítulos prácticos y teológicos , 63). El esplendor del Oriente cristiano pide, hoy más que nunca, libertad de toda dependencia mundana y de toda tendencia contraria a la comunión, para ser fieles en la obediencia y en el testimonio evangélicos.
Les doy las gracias por esto y les bendigo de corazón, pidiéndoles que recen por la Iglesia y que eleven sus poderosas oraciones de intercesión por mi ministerio. ¡Gracias! ______________________________________
Boletín de la Oficina de Prensa de la Santa Sede , 14 de mayo de 2025",2025-05-14_discurso_a_los_participantes_en_el_jubileo_de_las_iglesias_orientales_(14_de_mayo_de_2025)
Discurso,2025-05-12,Audiencia del Santo Padre León XIV a los representantes de los medios de comunicación  (12 de mayo de 2025),https://www.vatican.va/content/leo-xiv/es/speeches/2025/may/documents/20250512-media.html,"DISCURSO DEL SANTO PADRE LEÓN XIV A LOS REPRESENTANTES DE LOS MEDIOS DE COMUNICACIÓN
Aula Pablo VI Lunes, 12 de mayo de 2025
[ Multimedia ]
___________________________________

Buenos días, y muchas gracias por esta maravillosa acogida. Dicen que cuando se aplaude al comenzar, no tiene mucha importancia. Pero, si están todavía despiertos al finalizar y aún quieren aplaudir, se lo agradezco mucho.
Hermanos y hermanas:
Les doy la bienvenida a ustedes, representantes de los medios de comunicación de todo el mundo. Les agradezco el trabajo que han hecho y están haciendo en este tiempo, que para la Iglesia es esencialmente un tiempo de gracia.
En el “Sermón de la montaña” Jesús proclamó: «Felices los que trabajan por la paz» ( Mt 5,9). Se trata de una bienaventuranza que nos desafía a todos y que nos toca de cerca, llamando a cada uno a comprometerse en la realización de un tipo de comunicación diferente, que no busca el consenso a cualquier coste, no se reviste de palabras agresivas, no asume el modelo de la competición, no separa nunca la investigación de la verdad del amor con el que humildemente debemos buscarla. La paz comienza por cada uno de nosotros, por el modo en el que miramos a los demás, escuchamos a los demás, hablamos de los demás; y, en este sentido, el modo en que comunicamos tiene una importancia fundamental; debemos decir “no” a la guerra de las palabras y de las imágenes, debemos rechazar el paradigma de la guerra.
Permítanme entonces reiterar hoy la solidaridad de la Iglesia con los periodistas encarcelados por haber intentado contar la verdad, y por medio de estas palabras también pedir la liberación de los mismos. La Iglesia reconoce en estos testigos —pienso en aquellos que informan sobre la guerra incluso a costa de la vida— la valentía de quien defiende la dignidad, la justicia y el derecho de los pueblos a estar informados, porque sólo los pueblos informados pueden tomar decisiones con libertad. El sufrimiento de estos periodistas detenidos interpela la conciencia de las naciones y de la comunidad internacional, pidiéndonos a todos que custodiemos el bien precioso de la libertad de expresión y de prensa.
Gracias, queridos amigos, por su servicio a la verdad. Ustedes han estado en Roma durante estas semanas para informar sobre la Iglesia, su diversidad y, junto a ella, su unidad. Han acompañado los ritos de la Semana Santa, después han trasmitido el dolor por la muerte del Papa Francisco, acaecida sin embargo a la luz de la Pascua. Esa misma fe pascual nos ha introducido en el espíritu del cónclave, que les ha visto particularmente comprometidos en jornadas fatigosas y, también en esta ocasión, han conseguido comunicar la belleza del amor de Cristo que nos une a todos y nos hace ser un único pueblo, guiado por el Buen Pastor.
Vivimos tiempos difíciles de atravesar y describir, que representan un desafío para todos nosotros, de los que no debemos escapar. Por el contrario, nos piden a cada uno que, en nuestras distintas responsabilidades y servicios, no cedamos nunca a la mediocridad. La Iglesia debe aceptar el desafío del tiempo y, del mismo modo, no pueden existir una comunicación y un periodismo fuera del tiempo y de la historia. Como nos recuerda san Agustín, que decía: «Vivamos bien, y serán buenos los tiempos. Los tiempos somos nosotros» ( Sermón 80,8).
Gracias, por todo lo que han hecho para abandonar los estereotipos y los lugares comunes, a través de los cuales leemos frecuentemente la vida cristiana y la misma vida de la Iglesia. Gracias, porque han conseguido percibir lo esencial de lo que somos y trasmitirlo al mundo entero gracias a los distintos medios de comunicación.
Hoy, uno de los desafíos más importantes es el de promover una comunicación capaz de hacernos salir de la “torre de Babel” en la que a veces nos encontramos, de la confusión de lenguajes sin amor, frecuentemente ideológicos y facciosos. Por eso, su servicio, con las palabras que usan y el estilo que adoptan, es importante. La comunicación, de hecho, no es sólo trasmisión de informaciones, sino creación de una cultura, de ambientes humanos y digitales que sean espacios de diálogo y de contraste. Y, considerando la evolución tecnológica, esta misión se hace más necesaria aún. Pienso, particularmente, en la inteligencia artificial con su potencial inmenso, que requiere, sin embargo, responsabilidad y discernimiento para orientar los instrumentos al bien de todos, de modo que puedan producir beneficios para la humanidad. Y esta responsabilidad nos concierne a todos, de acuerdo a la edad y a los roles sociales.
Queridos amigos, aprenderemos con el tiempo a conocernos mejor. Hemos vivido —podemos decir juntos— días verdaderamente especiales. Los hemos, los han compartido a través de los distintos medios de comunicación: la televisión, la radio, la web y las redes sociales. Quisiera que cada uno de nosotros pudiera decir que ellos nos han desvelado una pizca del misterio de nuestra humanidad, y que nos han dejado un deseo de amor y de paz. Por eso, hoy les repito a ustedes la invitación que hizo el Papa Francisco en su último mensaje para la Jornada Mundial de las Comunicaciones Sociales . Desarmemos la comunicación de cualquier prejuicio, rencor, fanatismo y odio; purifiquémosla de la agresividad. No sirve una comunicación estridente, de fuerza, sino más bien una comunicación capaz de escucha, de recoger la voz de los débiles que no tienen voz. Desarmemos las palabras y contribuiremos a desarmar la tierra. Una comunicación desarmada y desarmante nos permite compartir una mirada distinta sobre el mundo y actuar de modo coherente con nuestra dignidad humana.
Ustedes están en primera línea para describir los conflictos y las esperanzas de paz, las situaciones de injusticia y de pobreza, así como el trabajo silencioso de muchos en favor de un mundo mejor. Por eso les pido que elijan de forma juiciosa y valiente el camino de una comunicación para la paz.
Gracias a todos. Que Dios los bendiga.",2025-05-12_discurso_audiencia_del_santo_padre_león_xiv_a_los_representantes_de_los_medios_de_comunicación__(12_de_mayo_de_2025)
