tipo,fecha,titulo,url,texto,filename
Homilia,2025-05-18,V Domingo de Pascua – Celebración Eucarística por el inicio del ministerio petrino del obispo de Roma León XIV (18 de mayo de 2025),https://www.vatican.va/content/leo-xiv/es/homilies/2025/documents/20250518-inizio-pontificato.html,"CELEBRACIÓN EUCARÍSTICA CON MOTIVO DEL INICIO DEL MINISTERIO PETRINO DEL OBISPO DE ROMA LEÓN XIV
HOMILÍA DE SU SANTIDAD EL PAPA LEÓN XIV
Plaza de San Pedro Domingo 18 de mayo de 2025
[ Multimedia ]
___________________
Queridos hermanos cardenales, hermanos en el episcopado y en el sacerdocio, distinguidas autoridades y miembros del Cuerpo diplomático, Un saludo a los peregrinos que han venido con ocasión del Jubileo de las Cofradías.
Hermanos y hermanas,
los saludo a todos con el corazón lleno de gratitud, al inicio del ministerio que me ha sido confiado. Escribía san Agustín: «Nos has hecho para ti, [Señor,] y nuestro corazón está inquieto hasta que descanse en ti» ( Confesiones , 1,1.1).
En estos últimos días, hemos vivido un tiempo particularmente intenso. La muerte del Papa Francisco ha llenado de tristeza nuestros corazones y, en esas horas difíciles, nos hemos sentido como esas multitudes que el Evangelio describe «como ovejas que no tienen pastor» ( Mt 9,36). Precisamente en el día de Pascua recibimos su última bendición y, a la luz de la resurrección, afrontamos ese momento con la certeza de que el Señor nunca abandona a su pueblo, lo reúne cuando está disperso y lo cuida «como un pastor a su rebaño» ( Jr 31,10).
Con este espíritu de fe, el Colegio de los cardenales se reunió para el cónclave; llegando con historias personales y caminos diferentes, hemos puesto en las manos de Dios el deseo de elegir al nuevo sucesor de Pedro, el Obispo de Roma, un pastor capaz de custodiar el rico patrimonio de la fe cristiana y, al mismo tiempo, de mirar más allá, para saber afrontar los interrogantes, las inquietudes y los desafíos de hoy. Acompañados por sus oraciones, hemos experimentado la obra del Espíritu Santo, que ha sabido armonizar los distintos instrumentos musicales, haciendo vibrar las cuerdas de nuestro corazón en una única melodía.
Fui elegido sin tener ningún mérito y, con temor y trepidación, vengo a ustedes como un hermano que quiere hacerse siervo de su fe y de su alegría, caminando con ustedes por el camino del amor de Dios, que nos quiere a todos unidos en una única familia.
Amor y unidad : estas son las dos dimensiones de la misión que Jesús confió a Pedro.
Nos lo narra ese pasaje del Evangelio que nos conduce al lago de Tiberíades, el mismo donde Jesús había comenzado la misión recibida del Padre: “pescar” a la humanidad para salvarla de las aguas del mal y de la muerte. Pasando por la orilla de ese lago, había llamado a Pedro y a los primeros discípulos a ser como Él “pescadores de hombres”; y ahora, después de la resurrección, les corresponde precisamente a ellos llevar adelante esta misión: no dejar de lanzar la red para sumergir la esperanza del Evangelio en las aguas del mundo; navegar en el mar de la vida para que todos puedan reunirse en el abrazo de Dios.
¿Cómo puede Pedro llevar a cabo esta tarea? El Evangelio nos dice que es posible sólo porque ha experimentado en su propia vida el amor infinito e incondicional de Dios, incluso en la hora del fracaso y la negación. Por eso, cuando es Jesús quien se dirige a Pedro, el Evangelio usa el verbo griego agapao —que se refiere al amor que Dios tiene por nosotros, a su entrega sin reservas ni cálculos—, diferente al verbo usado para la respuesta de Pedro, que en cambio describe el amor de amistad, que intercambiamos entre nosotros.
Cuando Jesús le pregunta a Pedro: «Simón, hijo de Juan, ¿me amas?» ( Jn 21,16), indica pues el amor del Padre. Es como si Jesús le dijera: sólo si has conocido y experimentado el amor de Dios, que nunca falla, podrás apacentar a mis corderos; sólo en el amor de Dios Padre podrás amar a tus hermanos “aún más”, es decir, hasta ofrecer la vida por ellos.
A Pedro, pues, se le confía la tarea de “amar aún más” y de dar su vida por el rebaño. El ministerio de Pedro está marcado precisamente por este amor oblativo, porque la Iglesia de Roma preside en la caridad y su verdadera autoridad es la caridad de Cristo. No se trata nunca de atrapar a los demás con el sometimiento, con la propaganda religiosa o con los medios del poder, sino que se trata siempre y solamente de amar como lo hizo Jesús.
Él —afirma el mismo apóstol Pedro— «es la piedra que ustedes, los constructores, han rechazado, y ha llegado a ser la piedra angular» ( Hch 4,11). Y si la piedra es Cristo, Pedro debe apacentar el rebaño sin ceder nunca a la tentación de ser un líder solitario o un jefe que está por encima de los demás, haciéndose dueño de las personas que le han sido confiadas (cf. 1 P 5,3); por el contrario, a él se le pide servir a la fe de sus hermanos, caminando junto con ellos.  Todos, en efecto, hemos sido constituidos «piedras vivas» ( 1 P 2,5), llamados con nuestro Bautismo a construir el edificio de Dios en la comunión fraterna, en la armonía del Espíritu, en la convivencia de las diferencias. Como afirma san Agustín: «Todos los que viven en concordia con los hermanos y aman a sus prójimos son los que componen la Iglesia» ( Sermón 359,9).
Hermanos y hermanas, quisiera que este fuera nuestro primer gran deseo: una Iglesia unida, signo de unidad y comunión, que se convierta en fermento para un mundo reconciliado .
En nuestro tiempo, vemos aún demasiada discordia, demasiadas heridas causadas por el odio, la violencia, los prejuicios, el miedo a lo diferente, por un paradigma económico que explota los recursos de la tierra y margina a los más pobres. Y nosotros queremos ser, dentro de esta masa, una pequeña levadura de unidad, de comunión y de fraternidad. Nosotros queremos decirle al mundo, con humildad y alegría: ¡miren a Cristo! ¡Acérquense a Él! ¡Acojan su Palabra que ilumina y consuela! Escuchen su propuesta de amor para formar su única familia: en el único Cristo nosotros somos uno . Y esta es la vía que hemos de recorrer juntos, unidos entre nosotros, pero también con las Iglesias cristianas hermanas, con quienes transitan otros caminos religiosos, con aquellos que cultivan la inquietud de la búsqueda de Dios, con todas las mujeres y los hombres de buena voluntad, para construir un mundo nuevo donde reine la paz.
Este es el espíritu misionero que debe animarnos, sin encerrarnos en nuestro pequeño grupo ni sentirnos superiores al mundo; estamos llamados a ofrecer el amor de Dios a todos, para que se realice esa unidad que no anula las diferencias, sino que valora la historia personal de cada uno y la cultura social y religiosa de cada pueblo.
Hermanos, hermanas, ¡esta es la hora del amor! La caridad de Dios, que nos hace hermanos entre nosotros, es el corazón del Evangelio. Con mi predecesor León XIII, hoy podemos preguntarnos: si esta caridad prevaleciera en el mundo, «¿no parece que acabaría por extinguirse bien pronto toda lucha allí donde ella entrara en vigor en la sociedad civil?» (Carta enc. Rerum novarum , 20).
Con la luz y la fuerza del Espíritu Santo, construyamos una Iglesia fundada en el amor de Dios y signo de unidad, una Iglesia misionera, que abre los brazos al mundo, que anuncia la Palabra, que se deja cuestionar por la historia, y que se convierte en fermento de concordia para la humanidad.
Juntos, como un solo pueblo, todos como hermanos, caminemos hacia Dios y amémonos los unos a los otros.",2025-05-18_homilia_v_domingo_de_pascua_–_celebración_eucarística_por_el_inicio_del_ministerio_petrino_del_obispo_de_roma_león_xiv_(18_de_mayo_de_2025)
Angelus,2025-05-18,"Regina Caeli, 18 de mayo de 2025",https://www.vatican.va/content/leo-xiv/es/angelus/2025/documents/20250518-regina-caeli.html,"PAPA LEÓN XIV
Santa Misa de Inicio del Ministerio Petrino
Regina Caeli al finalizar la Misa
Plaza de San Pedro Domingo 18 de mayo de 2025
[ Multimedia ]
________________________________________

Al final de esta celebración , los saludo y les doy las gracias a todos ustedes, romanos y fieles de tantas partes del mundo, que han querido participar.
Expreso mi gratitud en particular a las Delegaciones oficiales de numerosos países, así como a los representantes de las Iglesias y Comunidades eclesiales y de otras religiones.
Dirijo un cordial saludo a los miles de peregrinos que han acudido de todos los continentes con ocasión del Jubileo de las Cofradías. Queridos hermanos, les agradezco que mantengan vivo el gran patrimonio de la piedad popular.
Durante la Misa sentí fuertemente la presencia espiritual del Papa Francisco, que desde el cielo nos acompaña. En esta dimensión de comunión de los santos recuerdo que ayer en Chambéry, Francia, fue beatificado el sacerdote Camille Costa de Beauregard, que vivió entre finales del siglo XIX y principios del XX, testigo de una gran caridad pastoral.
En la alegría de la fe y de la comunión no podemos olvidarnos de los hermanos y hermanas que sufren a causa de las guerras. En Gaza, los niños, las familias y los ancianos supervivientes están pasando hambre. En Myanmar, nuevas hostilidades han destruido vidas inocentes. La atormentada Ucrania espera por fin negociaciones para una paz justa y duradera.
Por eso, mientras encomendamos a María el servicio del Obispo de Roma, Pastor de la Iglesia universal, desde la “barca de Pedro” contemplémosla a ella, Estrella del mar, Madre del Buen Consejo, como signo de esperanza. Imploremos por su intercesión el don de la paz, el auxilio y el consuelo para los que sufren y, para todos nosotros, la gracia de ser testigos del Señor Resucitado.","2025-05-18_angelus_regina_caeli,_18_de_mayo_de_2025"
Discurso,2025-05-16,Al Cuerpo Diplomático (16 de mayo de 2025),https://www.vatican.va/content/leo-xiv/es/speeches/2025/may/documents/20250516-corpo-diplomatico.html,"AUDIENCIA AL CUERPO DIPLOMÁTICO ACREDITADO ANTE LA SANTA SEDE
DISCURSO DEL SANTO PADRE LEÓN XIV
Sala Clementina Viernes, 16 de mayo de 2025
[ Multimedia ]
___________________________________
Eminencia, Excelencias, señoras y señores, la paz esté con ustedes:
Doy gracias a S.E. el Sr. George Poulides, Embajador de la República de Chipre y Decano del Cuerpo Diplomático, por las cordiales palabras que me ha dirigido en nombre de todos ustedes y por su trabajo incansable, que lleva adelante con la fuerza, la pasión y la simpatía que lo caracterizan, dotes por los que ha merecido la estima de todos mis Predecesores, que ha conocido en estos años de misión ante la Santa Sede y, en particular, del recordado Papa Francisco.
Deseo además expresarles mi gratitud por los numerosos mensajes de felicitación enviados luego de mi elección, así como por las precedentes condolencias que han llegado al fallecer el Papa Francisco , incluso de países con los que la Santa Sede no mantiene relaciones diplomáticas. Se trata de una significativa manifestación de estima, que alienta a profundizar las mutuas relaciones.
En nuestro diálogo, quisiera que predominase siempre el sentido de ser familia —la comunidad diplomática representa, en efecto, la entera familia de los pueblos—, que comparte las alegrías y los dolores de la vida junto con los valores humanos y espirituales que la animan. La diplomacia pontificia es, de hecho, una expresión de la misma catolicidad de la Iglesia y, en su acción diplomática, la Santa Sede está animada por una urgencia pastoral que la impulsa no a buscar privilegios sino a intensificar su misión evangélica al servicio de la humanidad. Ésta combate la indiferencia y apela continuamente a las conciencias, como ha hecho incansablemente mi venerado Predecesor, siempre atento al clamor de los pobres, los necesitados y los marginados, como también a los desafíos que caracterizan nuestro tiempo, desde la protección de la creación hasta la inteligencia artificial.
Además de ser un signo concreto de la atención que sus países reservan a la Sede Apostólica, su presencia hoy es para mí un don, que permite renovar la aspiración de la Iglesia —y mía personal— de alcanzar y abrazar a cada pueblo y a cada persona de esta tierra, deseosa y necesitada de verdad, de justicia y de paz. En cierto sentido, mi propia experiencia de vida, desplegada entre América del Norte, América del Sur y Europa, pone de manifiesto esta aspiración de traspasar los confines para encontrarse con personas y culturas diferentes.
Por medio del constante y paciente trabajo de la Secretaría de Estado, intento consolidar el conocimiento y el diálogo con ustedes y con sus países, muchos de los cuales he tenido ya la gracia de visitar a lo largo de mi vida, especialmente cuando fui Prior General de los Agustinos. Confío en que la Divina Providencia me conceda tener en el futuro ocasión de encontrarme con las realidades de las que ustedes provienen, permitiéndome acoger las oportunidades que se presenten para confirmar en la fe a tantos hermanos y hermanas dispersos por el mundo y construir nuevos puentes con todas las personas de buena voluntad.
En nuestro diálogo, quisiera que tuviéramos presente las tres palabras clave que constituyen los pilares de la acción misionera de la Iglesia y de la labor de la diplomacia de la Santa Sede.
La primera palabra es paz . Muchas veces la consideramos una palabra “negativa”, o sea, como mera ausencia de guerra o de conflicto, porque la contraposición es parte de la naturaleza humana y nos acompaña siempre, impulsándonos en demasiadas ocasiones a vivir en un constante “estado de conflicto”; en casa, en el trabajo, en la sociedad. La paz entonces pareciera una simple tregua, una pausa de descanso entre una discordia y otra, porque, aunque uno se esfuerce, las tensiones están siempre presentes, un poco como las brasas que arden bajo las cenizas, prontas a reavivarse en cualquier momento.
En la perspectiva cristiana —como también en la de otras experiencias religiosas— la paz es ante todo un don, el primer don de Cristo: «Les doy mi paz» ( Jn 14,27). Pero es un don activo, apasionante, que nos afecta y compromete a cada uno de nosotros, independientemente de la procedencia cultural y de la pertenencia religiosa, y que exige en primer lugar un trabajo sobre uno mismo. La paz se construye en el corazón y a partir del corazón, arrancando el orgullo y las reivindicaciones, y midiendo el lenguaje, porque también se puede herir y matar con las palabras, no sólo con las armas.
En esta óptica, considero fundamental el aporte que las religiones y el diálogo interreligioso pueden brindar para favorecer contextos de paz. Eso, naturalmente, exige el pleno respeto de la libertad religiosa en cada país, porque la experiencia religiosa es una dimensión fundamental de la persona humana, sin la cual es difícil —si no imposible— realizar esa purificación del corazón necesaria para construir relaciones de paz.
A partir de este trabajo, que todos estamos llamados a realizar, se pueden extirpar las premisas de cualquier conflicto y de cualquier destructiva voluntad de conquista. Esto exige también una sincera voluntad de diálogo, animada por el deseo de encontrarse más que de confrontarse. En esta perspectiva es necesario revitalizar la diplomacia multilateral y esas instituciones internacionales que han sido queridas y pensadas en primer lugar para poner remedio a los conflictos que pudiesen surgir en el seno de la comunidad internacional. Ciertamente, es necesaria también la voluntad de dejar de producir instrumentos de destrucción y de muerte, porque, como recordaba el Papa Francisco en su último Mensaje Urbi et Orbi , «la paz tampoco es posible sin un verdadero desarme [ y] la exigencia que cada pueblo tiene de proveer a su propia defensa no puede transformarse en una carrera general al rearme» [1] .
La segunda palabra es justicia . Procurar la paz exige practicar la justicia. Como ya he tenido modo de señalar, he elegido mi nombre pensando principalmente en León XIII , el Papa de la primera gran encíclica social, la Rerum novarum . En el cambio de época que estamos viviendo, la Santa Sede no puede eximirse de hacer sentir su propia voz ante los numerosos desequilibrios y las injusticias que conducen, entre otras cosas, a condiciones indignas de trabajo y a sociedades cada vez más fragmentadas y conflictivas. Es necesario, además, esforzarse por remediar las desigualdades globales, que trazan surcos profundos de opulencia e indigencia entre continentes, países e, incluso, dentro de las mismas sociedades.
Es tarea de quien tiene responsabilidad de gobierno aplicarse para construir sociedades civiles armónicas y pacíficas. Esto puede realizarse sobre todo invirtiendo en la familia, fundada sobre la unión estable entre el hombre y la mujer, «bien pequeña, es cierto, pero verdadera sociedad y más antigua que cualquiera otra» [2] . Además, nadie puede eximirse de favorecer contextos en los que se tutele la dignidad de cada persona, especialmente de aquellas más frágiles e indefensas, desde el niño por nacer hasta el anciano, desde el enfermo al desocupado, sean estos ciudadanos o inmigrantes.
Mi propia historia es la de un ciudadano, descendiente de inmigrantes, que a su vez ha emigrado. Cada uno de nosotros, en el curso de la vida, se puede encontrar sano o enfermo, ocupado o desocupado, en su patria o en tierra extranjera. Su dignidad, sin embargo, es siempre la misma, la de una creatura querida y amada por Dios.
La tercera palabra es verdad . No se pueden construir relaciones verdaderamente pacíficas, incluso dentro de la comunidad internacional, sin verdad. Allí donde las palabras asumen connotaciones ambiguas y ambivalentes, y el mundo virtual, con su percepción distorsionada de la realidad, prevalece sin control; es difícil construir relaciones auténticas, porque decaen las premisas objetivas y reales de la comunicación.
Por su parte, la Iglesia no puede nunca eximirse de decir la verdad sobre el hombre y sobre el mundo, recurriendo a lo que sea necesario, incluso a un lenguaje franco, que inicialmente puede suscitar alguna incomprensión. La verdad, sin embargo, no se separa nunca de la caridad, que siempre tiene radicada la preocupación por la vida y el bien de cada hombre y mujer. Por otra parte, en la perspectiva cristiana, la verdad no es la afirmación de principios abstractos y desencarnados, sino el encuentro con la persona misma de Cristo, que vive en la comunidad de los creyentes. De ese modo, la verdad no nos aleja; por el contrario, nos permite afrontar con mayor vigor los desafíos de nuestro tiempo, como las migraciones, el uso ético de la inteligencia artificial y la protección de nuestra amada tierra. Son desafíos que requieren el compromiso y la colaboración de todos, porque nadie puede pensar en afrontarlos solo.
Queridos embajadores:
Mi ministerio comienza en el corazón del Año jubilar, dedicado de manera particular a la esperanza. Es un tiempo de conversión y de renovación, y sobre todo la ocasión para dejar atrás las contiendas y comenzar un camino nuevo, animados por la esperanza de poder construir, trabajando juntos, cada uno según sus propias sensibilidades y responsabilidades, un mundo en el que cada uno de nosotros pueda realizar la propia humanidad en la verdad, en la justicia y en la paz. Espero que esto pueda suceder en todos los contextos, empezando por los más que más sufren, como Ucrania y Tierra Santa.
Les agradezco todo el trabajo que hacen para construir puentes entre sus países y la Santa Sede, y de todo corazón los bendigo, bendigo a sus familias y a sus pueblos. Gracias.
[Bendición]
Y gracias por todo el trabajo que hacen.
________________________________
[1] Mensaje «Urbi et Orbi» (20 abril 2025).
[2] León XIII, Carta enc. Rerum novarum (15 mayo 1891), 9.",2025-05-16_discurso_al_cuerpo_diplomático_(16_de_mayo_de_2025)
