tipo,fecha,titulo,url,texto,filename
Ángelus,2025-06-22,"Ángelus, 22 de junio de 2025,Solemnidad del Cuerpo y la Sangre de Cristo",https://www.vatican.va/content/leo-xiv/es/angelus/2025/documents/20250622-angelus.html,"SOLEMNIDAD DEL CUERPO Y LA SANGRE DE CRISTO
PAPA LEÓN XIV
ÁNGELUS
Plaza de San Pedro Domingo, 22 de juio de 2025
[ Multimedia ]
________________________________________
Queridos hermanos y hermanas, ¡feliz domingo!
Hoy, en muchos países, se celebra la Solemnidad del Cuerpo y la Sangre de Cristo, el Corpus Domini , y el Evangelio narra el milagro de los panes y los peces (cf. Lc 9,11-17).
Para dar de comer a las miles de personas que acudieron a escucharlo y a pedirle curación, Jesús invita a los Apóstoles a que le presenten lo poco que tienen, bendice los panes y los peces y les ordena que los distribuyan entre todos. El resultado es sorprendente, no sólo cada uno recibe comida suficiente, sino que sobra en abundancia (cf. Lc 9,17).
El milagro, más allá del prodigio, es un “signo” y nos recuerda que los dones de Dios, incluso los más pequeños, crecen cuanto más se comparten.
Sin embargo, al leer todo esto en el día del Corpus Domini , reflexionamos sobre una realidad aún más profunda. Sabemos, en efecto, que en la raíz de todo compartir humano hay uno más grande que lo precede: el de Dios hacia nosotros. Él, el Creador, que nos dio la vida, para salvarnos pidió a una de sus criaturas que fuera su Madre, para asumir un cuerpo frágil, limitado, mortal, como el nuestro, poniéndose en sus manos como un niño. Así compartió hasta sus últimas consecuencias nuestra pobreza, eligiendo valerse, para redimirnos, precisamente de lo poco que podíamos ofrecerle (cf. Nicolás Cabásilas, La vida en Cristo , IV, 3).
Pensemos en lo bonito que es, cuando hacemos un regalo —quizás pequeño, acorde con nuestras posibilidades— ver que es apreciado por quien lo recibe; lo contentos que nos sentimos cuando comprobamos que, a pesar de su sencillez, ese regalo nos une aún más a quienes amamos. Pues bien, en la Eucaristía, entre nosotros y Dios, sucede precisamente esto, el Señor acoge, santifica y bendice el pan y el vino que ponemos en el altar, junto con la ofrenda de nuestra vida, y los transforma en el Cuerpo y la Sangre de Cristo, sacrificio de amor para la salvación del mundo. Dios se une a nosotros acogiendo con alegría lo que le presentamos y nos invita a unirnos a Él recibiendo y compartiendo con igual alegría su don de amor. De este modo —dice san Agustín—, como el “conjunto de muchos granos se ha transformado en un solo pan, así en la concordia de la caridad se forma un solo cuerpo de Cristo” (cf. Sermón 229/A, 2).
Queridos hermanos, esta noche haremos la Procesión Eucarística . Celebraremos juntos la Santa Misa y luego nos pondremos en camino, llevando el Santísimo Sacramento por las calles de nuestra ciudad. Cantaremos, rezaremos y, finalmente, nos reuniremos en la Basílica de Santa María la Mayor para implorar la bendición del Señor sobre nuestros hogares, nuestras familias y toda la humanidad. Partiendo desde el altar y el sagrario, que esta celebración sea un signo luminoso de nuestro compromiso de ser cada día portadores de comunión y paz los unos para los otros, en el compartir y en la caridad.
____________________

Después del Ángelus

Queridos hermanos y hermanas:
Continúan llegando noticias alarmantes desde Oriente Medio, sobre todo desde Irán. En este escenario dramático, que incluye a Israel y Palestina, corre el riesgo de caer en el olvido el sufrimiento diario de la población, especialmente de Gaza y los demás territorios, donde la necesidad de una ayuda humanitaria adecuada es cada vez más urgente.
Hoy más que nunca, la humanidad clama y pide la paz. Es un grito que exige responsabilidad y razón, y no debe ser sofocado por el estruendo de las armas ni por las palabras retóricas que incitan al conflicto. Todo miembro de la comunidad internacional tiene la responsabilidad moral de detener la tragedia de la guerra, antes de que se convierta en una vorágine irreparable. No existen conflictos “lejanos” cuando está en juego la dignidad humana.
La guerra no resuelve los problemas, sino que los amplifica y produce heridas profundas en la historia de los pueblos, que tardan generaciones en cicatrizar. Ninguna victoria armada podrá compensar el dolor de las madres, el miedo de los niños, el futuro robado.
¡Que la diplomacia haga callar las armas! ¡Que las naciones tracen su futuro con obras de paz, no con la violencia ni conflictos sangrientos!
Saludo a todos ustedes, romanos y peregrinos. Me complace saludar a los Parlamentarios y a los Alcaldes aquí presentes con ocasión del Jubileo de los Gobernantes y de los Administradores .
Saludo particularmente a los fieles de Bogotá y Samupués, Colombia; también a aquellos venidos de Polonia, en especial a los alumnos y profesores de un Instituto técnico de Cracovia; a la banda musical de Strengberg, Austria, a los fieles de Hannover, Alemania; a los jóvenes de Confirmación de Gioia Tauro y a los chicos de Tempio Pausania.
A todos les deseo que pasen un feliz domingo. Y bendigo a aquellos que hoy participan activamente en la fiesta del Corpus Domini , ya sea con el canto, la música, los homenajes floreales, las artesanías y, sobre todo, con la oración y la procesión.
Muchas gracias a todos y feliz domingo.",2025-06-22_ángelus_angelus_22_de_junio_de_2025solemnidad_del_cuerpo_y_la_sangre_de_cristo
Homilia,2025-06-22,"Santísimo Cuerpo y Sangre de Cristo – Santa Misa, Procesión y Bendición Eucarística (22 de junio de 2025)",https://www.vatican.va/content/leo-xiv/es/homilies/2025/documents/20250622-omelia-corpus-domini.html,"SANTÍSIMO CUERPO Y SANGRE DE CRISTO SANTA MISA, PROCESIÓNE Y BENDICIÓN EUCARÍSTICA
HOMILÍA DEL SANTO PADRE LEÓN XIV
Plaza de San Juan de Letrán Domingo, 22 de junio de 2025
[ Multimedia ]
________________________________________
Queridos hermanos y hermanas, es hermoso estar con Jesús. El Evangelio que acabamos de escuchar lo atestigua, narrando que las multitudes permanecían horas y horas con Él, que hablaba del Reino de Dios y curaba a los enfermos (cf. Lc 9,11). La compasión de Jesús por quienes sufren manifiesta la amorosa cercanía de Dios, que viene al mundo para salvarnos. Cuando Dios reina, el hombre es liberado de todo mal. Sin embargo, incluso para aquellos que reciben la buena nueva de Jesús, llega la hora de la prueba. En aquel lugar desierto, donde las multitudes han escuchado al Maestro, cae la tarde y no hay nada para comer (cf. v. 12). El hambre del pueblo y la puesta del sol son signos de un límite que se cierne sobre el mundo, sobre cada criatura: el día termina, al igual que la vida de los hombres. Es en esta hora, en el tiempo de la indigencia y de las sombras, cuando Jesús permanece entre nosotros.
Justo cuando el sol se pone y el hambre crece, mientras los propios apóstoles piden despedir a la gente, Cristo nos sorprende con su misericordia. Él tiene compasión del pueblo hambriento e invita a sus discípulos a que se ocupen de él, porque el hambre no es una necesidad que no tenga que ver con el anuncio del Reino y el testimonio de la salvación. Al contrario, esta hambre está vinculada con nuestra relación con Dios. Sin embargo, cinco panes y dos peces no parecen suficientes para alimentar al pueblo, porque los cálculos de los discípulos, aparentemente razonables revelan, en cambio, su poca fe. Ya que, en realidad, con Jesús contamos con todo lo necesario para dar fuerza y sentido a nuestra vida.
En efecto, a la urgencia del hambre, Él responde con el signo del compartir: levanta los ojos, pronuncia la bendición, parte el pan y da de comer a todos los presentes (cf. v. 16). Los gestos del Señor no inauguran un complejo ritual mágico, sino que manifiestan con sencillez el agradecimiento hacia el Padre, la oración filial de Cristo y la comunión fraterna que sostiene el Espíritu Santo. Para multiplicar los panes y los peces, Jesús divide los que hay: sólo así hay suficiente para todos, es más, sobran. Después de haber comido ―hasta saciarse―, con lo que sobró, llenaron doce canastos (cf. v. 17).
Esta es la lógica que salva al pueblo hambriento: Jesús actúa según el estilo de Dios, enseñando a hacer lo mismo. Hoy, en lugar de las multitudes que aparecen en el Evangelio, hay pueblos enteros, humillados por la codicia ajena aún más que por el hambre misma. Ante la miseria de muchos, la acumulación de unos pocos es signo de una soberbia indiferente, que produce dolor e injusticia. En lugar de compartir, la opulencia desperdicia los frutos de la tierra y del trabajo del hombre. Especialmente en este año jubilar, el ejemplo del Señor sigue siendo para nosotros un criterio urgente de acción y servicio: compartir el pan, para multiplicar la esperanza, proclama la venida del Reino de Dios.
Al salvar del hambre a las multitudes, Jesús anuncia que salvará a todos de la muerte. Este es el misterio de la fe, que celebramos en el sacramento de la Eucaristía. Así como el hambre es señal de nuestra radical indigencia vital, así también el partir el pan es signo del don divino de la salvación.
Queridos amigos, Cristo es la respuesta de Dios al hambre del hombre, porque su cuerpo es el pan de la vida eterna: ¡tomen y coman todos de él! La invitación de Jesús abarca nuestra experiencia cotidiana: para vivir, necesitamos alimentarnos de la vida, quitándosela a las plantas y a los animales. Sin embargo, comer algo exánime nos recuerda que también nosotros, por mucho que comamos, moriremos. En cambio, cuando nos alimentamos de Jesús, pan vivo y verdadero, vivimos para Él. Ofreciéndose sin reservas, el Crucificado Resucitado se entrega a nosotros, y de este modo descubrimos que hemos sido hechos para nutrirnos de Dios. Nuestra naturaleza hambrienta lleva la marca de una indigencia que es saciada por la gracia de la Eucaristía. Como escribe san Agustín, Cristo es, de verdad, « panis qui reficit, et non deficit ; panis qui sumi potest, consumi non potest » ( Sermo 130, 2), es decir, un pan que nutre y nunca falta; un pan que se puede comer pero que nunca se agota. La Eucaristía, en efecto, es la presencia verdadera, real y sustancial del Salvador (cf. Catecismo de la Iglesia Católica, 1413), que transforma el pan en sí mismo, para transformarnos en Él. Vivo y vivificante, el Corpus Domini hace de nosotros, o sea, de la Iglesia misma, el cuerpo del Señor.
Por eso, según las palabras del apóstol Pablo (cf. 1 Cor 10,17), el Concilio Vaticano II enseña que «la unidad de los fieles, que constituyen un solo cuerpo en Cristo, está representada y se realiza por el sacramento del pan eucarístico […]. Todos los hombres están llamados a esta unión con Cristo, luz del mundo, de quien procedemos, por quien vivimos y hacia quien caminamos» (Const. dogm. Lumen gentium , 3). La procesión que comenzaremos dentro de poco es un signo de ese camino. Juntos, pastores y rebaño, nos alimentamos del Santísimo Sacramento, lo adoramos y lo llevamos por las calles. Al hacerlo, lo ofrecemos a la mirada, a la conciencia y al corazón de la gente. Al corazón de quien cree, para que crea más firmemente, y al corazón de quien no cree, para que se cuestione sobre el hambre que tenemos en el alma y sobre el pan que puede saciarla.
Fortalecidos por el alimento que Dios nos da, llevemos a Jesús al corazón de todos, porque Jesús incluye a todos en la obra de la salvación, invitando a cada uno a participar en su mesa. ¡Dichosos los invitados, que se convierten en testigos de este amor!",2025-06-22_homilia_santisimo_cuerpo_y_sangre_de_cristo_santa_misa_procesion_y_bendicion_eucaristica_22_de_junio_de_2025
Discurso,2025-06-20,A los sacerdotes de la Pontificia Academia Eclesiástica que regresan tras un año misionero (20 de junio de 2025),https://www.vatican.va/content/leo-xiv/es/speeches/2025/june/documents/20250620-sacerdoti.html,"SALUDO DEL SANTO PADRE LEÓN XIV A LOS SACERDOTES DE LA PONTIFICIA ACADEMIA ECLESIÁSTICA QUE REGRESAN TRAS UN AÑO MISIONERO
Palacio Apostólico Viernes, 20 de junio de 2025
[ Multimedia ]
___________________________________
Me alegra encontrarlos hoy y dirigirles a cada uno de ustedes mi cordial saludo. Doy la bienvenida a su presidente, S. E. Mons. Salvatore Pennacchio, a su prefecto de estudios, Mons. Gabriel Viola, y a ustedes, queridos sacerdotes, que regresan de la experiencia del Año Misionero, coronamiento de su formación en la Pontificia Academia Eclesiástica.
La semana pasada, al encontrarme con sus compañeros de la Alma Mater de los diplomáticos pontificios, tuve ocasión de reiterar el valor de esta intuición formativa introducida por mi venerado predecesor. Les exhorté a ser y permanecer «pastores con los pies en la tierra», para encarnar esa figura del sacerdote al servicio del Papa en las Representaciones Pontificias, bien delineada en el Quirógrafo El ministerio petrino , con el que se quiso dar un nuevo impulso a su institución plurisecular, que pronto celebrará el 325º aniversario de su fundación.
Como afirmé en algunos encuentros en el contexto del reciente Jubileo de la Santa Sede , la custodia de esa solicitud por todas las Iglesias —propia del ministerio que me ha sido confiado— necesita el servicio fiel e insustituible de la Secretaría de Estado y de los Representantes Pontificios, con los que pronto comenzarán a colaborar.
Por eso los exhorto también a ustedes a ejercer el don de su sacerdocio con humildad y mansedumbre, con capacidad de escucha y cercanía, como fieles e incansables discípulos de Cristo, el Buen Pastor. Sean cuales sean las tareas que se les encomienden, en cualquier parte del mundo en que se encuentren, el Papa debe poder contar con sacerdotes que, en la oración como en el trabajo, no escatimen en llevar su cercanía a los pueblos y a las Iglesias con su testimonio.
Les agradezco nuevamente la docilidad y la abnegación con que en este último año se han entregado en los contextos más diversos, y bendigo de corazón el inicio de su ministerio en el servicio diplomático de la Santa Sede. ____________________
Boletín de la Oficina de Prensa de la Santa Sede, 20 de junio de 2025",2025-06-20_discurso_a_los_sacerdotes_de_la_pontificia_academia_eclesiastica_que_regresan_tras_un_ano_misionero_20_de_jun
Discurso,2025-06-20,A los participantes en los Capítulos Generales: Frailes Menores Conventuales; Orden de la Santísima Trinidad y de los Cautivos (Trinitarios) (20 de junio de 2025),https://www.vatican.va/content/leo-xiv/es/speeches/2025/june/documents/20250620-capitoli-generali.html,"DISCURSO DEL SANTO PADRE LEÓN XIV A LOS MIEMBROS DE LOS CAPÍTULOS GENERALES DE LA ORDEN DE LOS FRAILES MENORES CONVENTUALES Y DE LA ORDEN DE LA SANTÍSIMA TRINIDAD Y DE LOS CAUTIVOS
Sala Clementina Viernes, 20 de junio de 2025
[ Multimedia ]
___________________________________
En el nombre del Padre, del Hijo y del Espíritu Santo. La paz esté con ustedes
Bienvenidos a todos queridos hermanos y hermanas: Saludo especialmente a los Superiores Generales —ambos han sido confirmados— , a los consejeros y a los capitulares de la Orden de los Frailes Menores Conventuales y la Orden de la Santísima Trinidad y de los Cautivos, así como a los delegados de las Terceras Ordenes y de grupos laicales.
El poder acoger juntos a franciscanos y trinitarios me ha recordado una pintura situada en el ábside de la basílica de San Juan de Letrán, que representa una audiencia de la que esta podría ser una hermosa conmemoración. En efecto, la imagen muestra al Papa Inocencio III, recibiendo a san Francisco y a san Juan de Mata juntos, para recordar su gran contribución a la reforma de la vida religiosa.
Es interesante señalar cómo san Francisco se representa de rodillas, con un enorme libro abierto, casi como si estuviese por decir al Pontífice: “Santidad yo sólo os pido vivir la regla del Santo Evangelio sine glossa ” (cf. Test 14-15). San Juan de Mata, en cambio, está de pie y tiene en sus manos la regla que ha elaborado junto al Pontífice. Si san Francisco manifiesta la docilidad a la Iglesia, presentado su proyecto no como algo propio sino como un don divino, san Juan de Mata muestra el texto aprobado, después de estudio y discernimiento, como culminación de un trabajo absolutamente necesario para hacer realidad el propósito que Dios les ha inspirado. Ambas actitudes lejos de ser contradictorias se iluminarán mutuamente y serán pauta para el servicio que desde entonces la Santa Sede realiza en favor de todos los carismas.
Dios no sólo inspiró a ambos santos un camino espiritual y de servicio, sino también el deseo de confrontar con el Sucesor de Pedro el don recibido por el Espíritu para ponerlo a disposición de la Iglesia. San Francisco le plantea al Papa la necesidad de seguir a Jesús sin reservas, sin otros fines, sin ambigüedades ni artificios. San Juan de Mata plasma esa verdad en palabras que resultarán claves después y que san Francisco hará suyas. Un ejemplo hermoso de esto será el vivir “sin nada propio”, sin nada “escondido en la recámara del bolsillo o el corazón” como recalcaba el Papa Francisco (cf. Discurso a las Canonesas de la Orden del Espíritu Santo , 5 diciembre 2024). Otro de estos términos expresará la necesidad de que esa entrega se revierta en el servicio, de que el superior se perciba como Ministro, el que se hace menor, para ser servidor de todos. Es interesante cómo el versículo de san Mateo (cf. 20,27) ha incidido en el vocabulario de toda la vida religiosa, pues llamar prior, maestro, magister , o ministro conforman todo el ideario de la autoridad como servicio.
Para actualizar este don, ustedes los trinitarios han querido centrarse en el propósito de su Instituto: llevar consolación a aquellos que no pueden vivir su fe en libertad. Durante estos meses han hecho oración este deseo, siguiendo las palabras de san Pablo: «perseguidos, pero no abandonados; derribados, pero no aniquilados» ( 2 Co 4,9), que inspiran el lema de este capítulo. Me uno a esta oración y pido también a Dios Trinidad que sea este uno de los frutos de su asamblea, que no dejen de recordar en su oración y en su esfuerzo cotidiano a los perseguidos por causa de su fe. Esa parte, la tercera —referente a los perseguidos—, según el magisterio de San Agustín, es la parte de Dios y la que marca la vocación del libertador de su Pueblo ( Cuestiones sobre el Heptateuco , lib. II, 15). Además, esa tensión hacia los miembros de la Iglesia que más sufren, atraerá la mirada de las vocaciones, de los fieles y de los hombres de buena voluntad por esta realidad y los mantendrán disponibles a los servicios de frontera que desarrollan en la Península Arábica, Oriente Medio, África y el subcontinente indio.
Otro elemento esencial del propio propósito es el que han trabajado en este capítulo, ustedes, los frailes menores conventuales, que han discernido sobre los directorios de los capítulos general y provincial, pues en ellos “se habla de las cosas de Dios”. No es nuestro interés el que nos debe mover, sino el de Cristo, es su Espíritu el primero que debemos escuchar, para “escribir el futuro en el presente” —como dice el lema de su capítulo—. Escucharlo la voz del hermano, en el discernimiento de la comunidad, en la atención a los signos de los tiempos, a los reclamos del Magisterio. Queridos hijos de san Francisco de Asís, en el octavo centenario de la composición del Cántico de las criaturas o de Hermano sol , los exhorto a ser, cada uno personalmente y en cada una de sus fraternidades, un reclamo vivo al primado de la alabanza a Dios en la vida cristiana. Y no quiero olvidar que ustedes conventuales celebran el aniversario de su renovada presencia en extremo oriente.
Queridos hermanos, quisiera concluir este encuentro con las Alabanzas al Dios Altísimo , ese trisagio escrito por san Francisco: «Tú eres santo, Señor Dios único, que haces maravillas ( Sal 76,15). Tú eres fuerte, tú eres grande (cf. Sal 85,10), tú eres altísimo, tú eres rey omnipotente, tú, Padre santo ( Jn 17,11), rey del cielo y de la tierra (cf. Mt 11,25)».
Gracias a todos ustedes y que Dios les bendiga.",2025-06-20_discurso_a_los_participantes_en_los_capitulos_generales_frailes_menores_conventuales_orden_de_la_santisima_tr
Discurso,2025-06-18,A los participantes en el evento promovido por la Fundación Cardenal Domenico Bartolucci (18 de junio de 2025),https://www.vatican.va/content/leo-xiv/es/speeches/2025/june/documents/20250618-fondazione-bartolucci.html,"DISCURSO DEL SANTO PADRE LEÓN XIV A LOS PARTICIPANTES EN EL EVENTO PROMOVIDO POR LA FUNDACIÓN CARDENAL DOMENICO BARTOLUCCI CON MOTIVO DEL 500.º ANIVERSARIO DEL NACIMIENTO DE G.P. DA PALESTRINA
Sala Regia Miércoles, 18 de junio de 2025
[ Multimedia ]
___________________________________
Queridos hermanos y hermanas, ¡buenas tardes!
Después de escuchar estas voces angelicales, casi sería mejor no hablar y dejarnos con esta hermosa experiencia…
Quisiera saludar a Su Eminencia el cardenal Dominique Mamberti, a la hermana Raffaella Petrini, a los estimados ponentes y a los ilustres invitados. Participo con alegría en este encuentro en el que, con palabras y música, celebramos la nueva emisión filatélica promovida por la Fundación Bartolucci y realizada por Correos Vaticanos con motivo del quinto centenario de Palestrina.
Giovanni Pierluigi da Palestrina fue, en la historia de la Iglesia, uno de los compositores que más contribuyó a la promoción de la música sacra, «para la gloria de Dios y la santificación y edificación de los fieles» (San Pío X, Motu proprio Inter plurimas pastoralis officii sollicitudines , 22 de noviembre de 1903, 1), en el delicado y a la vez apasionante contexto de la Contrarreforma. Sus composiciones, solemnes y austeras, inspiradas en el canto gregoriano, unen estrechamente la música y la liturgia, «tanto dando a la oración una expresión más suave y favoreciendo la unanimidad, como enriqueciendo con mayor solemnidad los ritos sagrados» ( Conc. Ecum. Vat. II , Const. Sacrosanctum Concilium , 112).
La polifonía misma, por otra parte, es una forma musical cargada de significado, para la oración y para la vida cristiana. En primer lugar, se inspira en el Texto sagrado, al que se propone «revestir de melodías adecuadas» ( Inter sollicitudines , 1) para que llegue mejor «a la inteligencia de los fieles» ( ibíd .). Además, realiza este objetivo confiando las palabras a varias voces, que las repiten cada una a su manera y de forma original, con movimientos melódicos y armónicos variados y complementarios. Por último, armoniza el conjunto gracias a la maestría con la que el compositor desarrolla y entrelaza las melodías, respetando las reglas del contrapunto, haciendo que unas sean eco de otras, creando a veces incluso disonancias, que luego encuentran su resolución en nuevos acordes. El efecto de esta unidad dinámica en la diversidad —metáfora de nuestro camino común de fe bajo la guía del Espíritu Santo— es ayudar al oyente a entrar con mayor profundidad en el misterio expresado por las palabras, respondiendo, cuando es oportuno, con responsorios o in alternatim .
Precisamente gracias a esta riqueza de forma y contenido, la tradición polifónica romana, además de habernos dejado un inmenso patrimonio artístico y espiritual, sigue siendo hoy en día, en el ámbito musical, un punto de referencia al que mirar, con las debidas adaptaciones, en la composición sacra y litúrgica, para que a través del canto «los fieles participen plena, consciente y activamente en la Liturgia» ( Sacrosanctum Concilium , 14), con una profunda implicación de la voz, la mente y el corazón. De todo esto, la Missa Papae Marcelli , en su género, es un ejemplo por excelencia, al igual que el precioso repertorio de composiciones que nos dejó el inolvidable cardenal Domenico Bartolucci, ilustre compositor y durante casi cincuenta años director de la Capilla Musical Pontificia «Sixtina» .
Por lo tanto, doy las gracias a todos los que han hecho posible este encuentro: a la Fundación Bartolucci, a los ponentes, al coro y a todos ustedes. Los recuerdo en mi oración. San Agustín, hablando del canto del Aleluya pascual, decía: «Cantémoslo, pues, ahora, hermanos míos [...]. Como suelen cantar los caminantes, canta, pero camina [...]. Avanza, avanza en el bien [...]. ¡Canta y camina! ¡No te desvíes del camino, no mires atrás, no te detengas!» ( Sermo 256 , 3). Hagamos nuestra su invitación, especialmente en este tiempo santo de júbilo. A todos, mi bendición. _________________________________ Boletìn de la Oficina de Prensa de la Santa Sede, 18 de junio de 2025",2025-06-18_discurso_a_los_participantes_en_el_evento_promovido_por_la_fundacion_cardenal_domenico_bartolucci_18_de_junio
