tipo,fecha,titulo,url,texto,filename
Audiencia,2025-06-18,"Audiencia general del 18 de junio de 2025 Ciclo de catequesis - Jubileo 2025. Jesucristo, nuestra esperanza. II. La vida de Jesús. Las curaciones. 10. Al verlo tendido, y sabiendo que hacía tanto tiempo que estaba así, Jesús le preguntó: «¿Quieres curarte?» (Jn 5,6)",https://www.vatican.va/content/leo-xiv/es/audiences/2025/documents/20250618-udienza-generale.html,"LEÓN XIV
AUDIENCIA GENERAL
Plaza de San Pedro Miércoles, 18 de junio de 2025
[ Multimedia ]
___________________________________

Ciclo de catequesis - Jubileo 2025. Jesucristo, nuestra esperanza. II. La vida de Jesús. Las curaciones. 10. Al verlo tendido, y sabiendo que hacía tanto tiempo que estaba así, Jesús le preguntó: «¿Quieres curarte?» (Jn 5,6)
Queridos hermanos y hermanas,
seguimos contemplando a Jesús que sana. Hoy quisiera invitarlos de manera particular a pensar en las situaciones en las que nos sentimos “bloqueados” y encerrados en un camino sin salida. A veces de hecho nos parece que sea inútil continuar a esperar; nos resignamos y no tenemos más ganas de luchar. Esta situación es descrita en los Evangelios con la imagen de la parálisis. Por esta razón desearía detenerme hoy sobre la sanación de un paralítico, narrada en el quinto capítulo del Evangelio de san Juan (5,1-9).
Jesús va Jerusalén para una fiesta de los judíos. No va directamente al Templo; se detiene ante una puerta, donde seguramente se lavaban a las ovejas que luego eran ofrecidas en sacrificio. Cerca a esta puerta, se ubicaban también tantos enfermos, que, a diferencia de las ovejas, ¡eran excluidos del Templo porque eran considerados impuros! Es entonces Jesús mismo quien los alcanza en su dolor. Estas personas esperaban un prodigio que pudiese cambiar su destino; de hecho, junto a la puerta se encontraba una piscina, cuyas aguas eran consideradas taumatúrgicas, o sea capaces de sanar: en algún momento cuando el agua se agitaba, según la creencia del tiempo, quien primero se zambullía, se curaba.
De esta forma se creaba una especie de “guerra de los pobres”: podemos imaginar la triste escena de estos enfermos que se arrastraban con fatiga para tratar de entrar en la piscina. Aquella piscina se llamaba Betzatá , que significa “casa de la misericordia”: podría ser una imagen de la Iglesia, en donde los enfermos y los pobres se juntan y hasta donde el Señor llega para sanar y donar esperanza.
Jesús se dirige específicamente a un hombre que está paralizado desde hace treinta y ocho años. Ya está resignado, porque no logra sumergirse en la piscina cuando el agua se agita (cfr v. 7). En efecto, aquello que muchas veces nos paraliza es precisamente la desilusión. Nos sentimos desanimados y corremos el riesgo de caer en la dejadez.
Jesús dirige a este paralítico una pregunta que puede parecer superficial: «¿Quieres curarte?» (v. 6). En cambio, es una pregunta necesaria, porque, cuando uno se encuentra bloqueado desde hace tantos años, puede también faltarle la voluntad de sanarse. A veces preferimos permanecer en condición de enfermos, obligando a los otros a ocuparse de nosotros. Es a veces también un pretexto para no decidir qué cosa hacer con nuestra vida. Jesús en cambio reconduce a este hombre a su deseo veraz y profundo.
Este hombre de hecho responde de manera más articulada a la pregunta de Jesús, revelando su visión de la vida. Ante todo, dice que no ha tenido nadie que lo sumerja en la piscina : entonces no es suya la culpa, sino de los otros que no se preocupan por él. Esta actitud se convierte en el pretexto para evitar asumirse las propias responsabilidades. ¿Pero es verdad que no había nadie que lo ayudase? He aquí la respuesta iluminadora de San Agustín: «Si, para ser sanado tenía absolutamente necesidad de un hombre, pero de un hombre que fuese también Dios. […] Ha venido por lo tanto el hombre que era necesario; ¿por qué postergar de nuevo la sanación?». [1]
El paralítico agrega que cuando trata de sumergirse en la piscina hay siempre alguien que llega antes que él. Este hombre está expresando una visión fatalista de la vida. Pensamos que las cosas nos pasan porque no somos afortunados, porque el destino nos es adverso. Este hombre está desanimado. Se siente derrotado en la lucha de la vida.
Jesús en cambio lo ayuda a descubrir que su vida también está en sus manos. Le invita a levantarse, a alzarse de su situación crónica, y a recoger su camilla (cfr v. 8). Ese camastro no se deja o se echa: representa su pasado de enfermedad, es su historia. Hasta aquel momento el pasado lo ha bloqueado; lo ha obligado a yacer como un muerto. Ahora es él que puede cargar aquella camilla y llevarla a donde quiera: ¡puede decidir qué cosa hacer con su historia! Se trata de caminar, asumiéndose la responsabilidad de escoger cual camino recorrer. ¡Y esto gracias a Jesús!
Queridos hermanos y hermanas, pidamos al Señor el don de entender dónde se ha bloqueado nuestra vida. Intentemos dar voz a nuestro deseo de sanar. Y recemos por todos aquellos que se sienten paralizados, que no ven una salida. ¡Pidamos regresar a vivir en el Corazón de Cristo que es la verdadera casa de la misericordia!
[1] Omelia 17, 7.
__________________
Saludos
Saludo cordialmente a los peregrinos de lengua española, en modo particular a los grupos provenientes de España, México, Honduras, Chile y Argentina. Jesús nos pregunta también a nosotros: «¿Quieres curarte?». No tengamos miedo de reconocer nuestras parálisis interiores, ni de presentar al Señor nuestros desánimos. Pidamos a María Santísima que nos ayude a responder con fe al llamado de Jesús, que nos invita a levantarnos y caminar con esperanza hacia la vida nueva que Él nos ofrece. Muchas gracias. __________________
Llamamiento
Queridos hermanos y hermanas:
El corazón de la Iglesia está desgarrado por los gritos que se elevan desde los lugares en guerra, en particular desde Ucrania, Irán, Israel y Gaza. ¡No debemos acostumbrarnos a la guerra! Al contrario, hay que rechazar como una tentación el encanto de las armas poderosas y sofisticadas. En realidad, ya que en la guerra actual «al emplear en la guerra armas científicas de todo género, su crueldad intrínseca amenaza llevar a los que luchan a tal barbarie, que supere, enormemente la de los tiempos pasados» ( Concilio Vaticano II, Const. Past. Gaudium et spes , 79). Por tanto, en nombre de la dignidad humana y del derecho internacional, repito a los responsables lo que solía decir el papa Francisco: ¡la guerra es siempre una derrota! Y con Pío XII : «Nada se pierde con la paz, todo puede perderse con la guerra». ___________________________________
Resumen leído por el Santo Padre en español
Queridos hermanos y hermanas:
En la catequesis de hoy nos detenemos en el relato del paralítico de la piscina de Betsata que nos revela a Jesús como Aquel que sana. La actitud de este hombre, paralizado desde hacía 38 años, nos hace pensar cómo, a veces, también nosotros nos resignamos, perdemos la esperanza y dejamos de luchar. A su parálisis física se agregaba una peor: la parálisis de la desesperanza. El Señor va a Jerusalén, pero su primer destino no es el templo, sino que se dirige a los excluidos que yacen cerca de la puerta. Y, al notar la situación de ese hombre, le hace una pregunta que, a simple vista, podría parecer superflua, pero con la cual busca hacerlo volver a su deseo más profundo y verdadero: «¿Quieres curarte?». El enfermo responde culpando a otros y mostrando una visión fatalista: «Señor, no tengo a nadie que me sumerja, […] mientras yo voy, otro desciende antes». Jesús lo ayuda a descubrir que el presente está en sus manos. Lo invita a levantarse, a tomar su camilla —símbolo de su pasado— y a caminar. Así, el pasado ya no lo detiene y su presente se transforma porque ahora camina junto al mismo Dios que vino a su encuentro.",2025-06-18_audiencia_audiencia_general_del_18_de_junio_de_2025_ciclo_de_catequesis_jubileo_2025_jesucristo_nuestra_espera
Discurso,2025-06-16,A los participantes en la Escuela de Verano de Astrofísica promovida por la Specula Vaticana (16 de junio de 2025),https://www.vatican.va/content/leo-xiv/es/speeches/2025/june/documents/20250616-specola.html,"DISCURSO DEL SANTO PADRE LEÓN XIV A LOS PARTICIPANTIES EN LA ESCUELA DE VERANO DE ASTROFÍSICA PROMOVIDA POR LA SPECULA VATICANA
Sala del Consistorio Lunes, 16 de junio de 2025
[ Multimedia ]
___________________________________
Buenos días y bienvenidos.
Me complace tener la oportunidad de saludar a todos ustedes, estudiantes y académicos de diversas partes del mundo que participan en la Escuela de Verano de la Specola Vaticana . Les deseo lo mejor para que esta experiencia de convivencia y estudio no sea solo un enriquecimiento académico y personal, sino que también contribuya a desarrollar amistades y formas de colaboración que no pueden sino contribuir al progreso de la ciencia al servicio de nuestra única familia humana.
La Escuela de Verano de este año está dedicada, según me han dicho, al tema «Explorar el universo con el telescopio espacial James Webb ». ¡Sin duda, este debe ser un momento emocionante para ser astrónomos! Gracias a ese instrumento verdaderamente notable, por primera vez somos capaces de escudriñar en las profundidades de la atmósfera de los exoplanetas, donde podría desarrollarse la vida, y estudiar las nebulosas, donde se forman los propios sistemas planetarios. Con el Webb podemos incluso rastrear la luz antigua de galaxias lejanas, que nos habla del comienzo mismo de nuestro universo.
Los autores de las Sagradas Escrituras, al escribir hace ya tantos siglos, no pudieron disfrutar de este privilegio. Sin embargo, su imaginación poética y religiosa reflexionó sobre cómo podría haber sido el momento de la creación, cuando «las estrellas brillan alegres en sus puestos de guardia; Él las llama y ellas responden: «Aquí estamos», y resplandecen de alegría por el que las creó» ( Baruc 3, 34). Hoy, ¿no nos llenan de asombro y, de hecho, de una alegría misteriosa las imágenes del James Webb mientras contemplamos su sublime belleza?
El equipo científico del Telescopio Espacial ha trabajado duro para que estas imágenes estén disponibles al público, algo por lo que todos podemos estar agradecidos. Pero, de manera especial, todos ustedes que participan en la Escuela de Verano han recibido los conocimientos y la formación que les permitirán utilizar este extraordinario instrumento para ampliar nuestro conocimiento del cosmos, del que somos una parte minúscula pero significativa.
Por supuesto, ninguno de ustedes ha llegado hasta aquí solo. Cada uno de ustedes forma parte de una comunidad mucho más grande. Piensen en todas las personas que han trabajado durante los últimos treinta años para construir el Telescopio Espacial y sus instrumentos, y en aquellos que han trabajado para desarrollar las ideas científicas para cuya verificación fue diseñado. Además de la contribución de sus colegas científicos, ingenieros y matemáticos, es también gracias al apoyo de sus familias y de muchos de sus amigos que han podido apreciar y participar en esta extraordinaria empresa, que nos ha permitido ver de una manera nueva el mundo que nos rodea.
Por lo tanto, nunca olviden que lo que hacen es para el beneficio de todos nosotros.
Sean generosos a la hora de compartir lo que aprenden y lo que experimentan, en la medida de sus posibilidades y de cualquier forma que puedan. No duden en compartir la alegría y el asombro que les produce contemplar las «semillas» que, en palabras de San Agustín, Dios ha esparcido en la armonía del universo (cf. De Genesis ad litteram , V, 23, 44-45). Cuanta más alegría compartan, más alegría crearán y, así, a través de su búsqueda del conocimiento, cada uno de ustedes podrá contribuir a la construcción de un mundo más pacífico y justo.
Con estas reflexiones, amigos míos, les agradezco nuevamente su visita y les aseguro mis oraciones por ustedes, sus familias y su trabajo, e invoco de buen grado sobre todos ustedes las bendiciones de Dios, de sabiduría y comprensión, de alegría y paz.
Que Dios los bendiga.
[Bendición, en inglés] Gracias. ________________________________ Boletín de la Oficina de Prensa de la Santa Sede, 16 de junio de 2025",2025-06-16_discurso_a_los_participantes_en_la_escuela_de_verano_de_astrofisica_promovida_por_la_specula_vaticana_16_de_j
