tipo,fecha,titulo,url,texto,filename
Discurso,2025-05-22,A las Obras Misionales Pontificias (22 de mayo de 2025),https://www.vatican.va/content/leo-xiv/es/speeches/2025/may/documents/20250522-pom.html,"DISCURSO DEL SANTO PADRE LEÓN XIV A LAS OBRAS MISIONALES PONTIFICIAS
Sala Clementina Jueves, 22 de mayo de 2025
[ Multimedia ]
___________________________________
Eminencia, Excelencias, Secretarios Generales, Directores Nacionales y Personal de la Obras Misionales Pontificias, Queridos hermanos y hermanas.
Les doy la más cordial bienvenida a todos ustedes, que se han reunido desde más de ciento veinte países, para participar en la Asamblea General anual de las Obras Misionales Pontificias . Quisiera comenzar agradeciendo a ustedes y a sus colaboradores por su servicio comprometido, el cual es indispensable para la misión evangelizadora de la Iglesia, como yo mismo lo he podido constatar en los años de mi ministerio en Perú.
Las Obras Misionales Pontificias son efectivamente el «principal medio» para avivar la responsabilidad misionera entre todos los bautizados y sostener a las comunidades eclesiales en las zonas donde la Iglesia es joven (cf. Decreto Ad gentes , 38). Esto lo vemos en la Obra para la Propagación de la Fe, que proporciona apoyo para los programas pastorales y catequéticos, la construcción de nuevas iglesias, asistencia sanitaria y necesidades educativas en los territorios de misión. La Obra de la Santa Infancia, del mismo modo, sostiene programas de formación cristiana para niños, además de atender sus necesidades básicas y velar por su protección. Asimismo, la Obra de San Pedro Apóstol ayuda a cultivar las vocaciones misioneras, tanto sacerdotales como religiosas, mientras que la Unión Misionera se encarga de la formación de sacerdotes, religiosos y religiosas, y de todo el pueblo de Dios en la actividad misionera de la Iglesia.
La promoción del celo apostólico en el Pueblo de Dios sigue siendo un aspecto esencial de la renovación de la Iglesia, tal como la concibió el Concilio Vaticano II , y es aún más urgente en nuestros días. Nuestro mundo, herido por la guerra, la violencia y la injusticia, necesita escuchar el mensaje evangélico del amor de Dios y experimentar el poder reconciliador de la gracia de Cristo. En este sentido, la Iglesia misma, en todos sus miembros, está llamada cada vez más a ser «una Iglesia misionera, que abre los brazos al mundo, que anuncia la Palabra […] y que se convierte en fermento de concordia para la humanidad» ( Homilía de la Misa de inicio de Pontificado , 18 mayo 2025). Estamos llamados a llevar a todos los pueblos, más aún, a todas las criaturas, la promesa evangélica de una paz verdadera y duradera, que es posible porque, en palabras del Papa Francisco, «el Señor ha vencido al mundo y a su conflictividad permanente “haciendo la paz mediante la sangre de su cruz”» ( Evangelii gaudium , 229).
Es por eso que vemos la importancia de fomentar un espíritu de discipulado misionero en todos los bautizados y un sentido de urgencia en llevar a Cristo a todos los pueblos. A este respecto, quisiera agradecerles a ustedes y a sus colaboradores el esfuerzo que realizan cada año para promover la Jornada Mundial de las Misiones el penúltimo domingo de octubre, que me es de gran ayuda en mi solicitud por las Iglesias que están en zonas confiadas al Dicasterio para la Evangelización .
Hoy, como en los días posteriores a Pentecostés, la Iglesia, guiada por el Espíritu Santo, prosigue su camino a lo largo de la historia con confianza, alegría y valentía, mientras proclama el nombre de Jesús y la salvación que nace de la fe en la verdad salvífica del Evangelio. Las Obras Misionales Pontificias son una parte importante de este gran esfuerzo. En su labor de coordinar la formación misionera y animar un espíritu misionero a nivel local, quisiera pedir a los directores nacionales que den prioridad a las visitas de las diócesis, parroquias y comunidades, y que de este modo ayuden a los fieles a reconocer la importancia fundamental de las misiones y de apoyar a nuestros hermanos y hermanas que están en aquellas áreas de nuestro mundo donde la Iglesia es joven y está creciendo.
Antes de concluir el discurso de esta mañana, quisiera reflexionar con ustedes sobre dos elementos distintivos de la identidad de las Obras Misionales Pontificias. Que pueden ser descritas como comunión y universalidad . Como Obras encargadas de participar en el mandato misionero del Papa y del Colegio episcopal, ustedes están llamados a cultivar y promover en sus miembros la visión de la Iglesia como comunión de creyentes, animada por el Espíritu Santo, que nos hace entrar en la perfecta comunión y armonía de la Santísima Trinidad. En efecto, es en la Trinidad en quien todas las cosas encuentran su unidad. Esta dimensión cristiana de nuestra vida y misión la llevo en mi corazón, y se refleja en las palabras de san Agustín que elegí para mi servicio episcopal y ahora para mi ministerio pontificio: In Illo uno unum . Cristo es nuestro Salvador y en Él somos uno, la familia de Dios, más allá de la rica variedad de nuestras lenguas, culturas y experiencias.
El tomar conciencia de nuestra comunión como miembros del Cuerpo de Cristo nos abre naturalmente a la dimensión universal de la misión evangelizadora de la Iglesia, y nos inspira a ir más allá de los confines de nuestras propias parroquias, diócesis y naciones, para compartir con toda nación y pueblo la sobreabundante riqueza del conocimiento de Jesucristo (cf. Flp 3, 8).
Un enfoque renovado en la unidad y universalidad de la Iglesia corresponde precisamente al carisma auténtico de las Obras Misionales Pontificias. Como tal, debe inspirar el proceso de renovación de los estatutos que ustedes han iniciado. A este respecto, expreso mi confianza en que este proceso confirmará en su vocación de ser fermento de celo misionero dentro del Pueblo de Dios a los miembros de las Obras en todo el mundo.
Queridos amigos, nuestra celebración de este Año Santo nos interpela a todos a ser “peregrinos de esperanza”. Retomando las palabras que el Papa Francisco eligió como lema para esta Jornada Mundial de las Misiones , quisiera concluir animándolos a seguir siendo “misioneros de esperanza entre todos los pueblos”. Mientras los encomiendo a ustedes, a sus bienhechores y a todos los que están asociados a su importante labor a la amorosa intercesión de María, la Madre de la Iglesia, les imparto con afecto la Bendición Apostólica como prenda de alegría y paz duraderas en el Señor.",2025-05-22_discurso_a_las_obras_misionales_pontificias_(22_de_mayo_de_2025)
Homilia,2025-05-20,Visita al Sepulcro de San Pablo (20 de mayo de 2025),https://www.vatican.va/content/leo-xiv/es/homilies/2025/documents/20250520-visita-sanpaolo.html,"VISITA AL SEPULCRO DE SAN PABLO
HOMILÍA DEL SANTO PADRE LEÓN XIV
Basílica de San Pablo Extramuros Martes, 20 de mayo de 2025
[ Multimedia ]
___________________
La lectura bíblica que hemos escuchado es el comienzo de la bellísima carta que san Pablo dirige a los cristianos de Roma, cuyo mensaje gira en torno a tres grandes temas: la gracia , la fe y la justicia . Mientras encomendamos el inicio de este nuevo pontificado a la intercesión del Apóstol de las gentes, reflexionemos juntos sobre su mensaje.
En primer lugar, san Pablo afirma haber recibido de Dios la gracia de la llamada (cf. Rm 1,5). Es decir, reconoce que su encuentro con Cristo y su ministerio están vinculados al amor con el que Dios lo ha precedido, llamándolo a una vida nueva mientras aún estaba lejos del Evangelio y perseguía a la Iglesia. San Agustín —también él un convertido— habla de la misma experiencia diciendo: «¿Qué vamos a elegir, a no ser que antes seamos elegidos nosotros? De hecho, no amamos si antes no somos amados» ( Sermón 34,1.2). En la raíz de toda vocación está Dios, su misericordia, su bondad, generosa como la de una madre (cf. Is 66,12-14), que naturalmente, a través de su mismo cuerpo, nutre a su niño cuando todavía es incapaz de alimentarse por sí solo (cf. S. Agustín, Comentario al salmo 130 ,9).
Pero Pablo, en el mismo versículo, habla también de «la obediencia de la fe» ( Rm 1,5), y además en él comparte lo que ha vivido. El Señor, en efecto, apareciéndosele en el camino de Damasco (cf. Hch 9,1-30), no le quito su libertad, sino que dio la posibilidad de decidir, de obedecer como fruto de un esfuerzo, de luchas interiores y exteriores, que él aceptó afrontar. La salvación no aparece por encanto, sino por un misterio de gracia y de fe , del amor de Dios que nos precede, y de la adhesión confiada y libre por parte del hombre (cf. 2 Tm 1,12).
Mientras agradecemos al Señor la llamada con la que transformó la vida de Saulo, le pedimos que también nosotros sepamos responder del mismo modo a sus invitaciones, haciéndonos testigos del amor que «ha sido derramado en nuestros corazones por el Espíritu Santo, que nos ha sido dado» ( Rm 5,5). Le pedimos que sepamos cultivar y difundir su caridad, haciéndonos prójimos los unos de los otros (cf. Francisco , Homilía de las II Vísperas de la Solemnidad de la Conversión de san Pablo , 25 enero 2024), en la misma carrera de afectos que, desde el encuentro con Cristo, impulsó al antiguo perseguidor a hacerse «todo para todos» ( 1 Co 9,22), hasta el martirio. De ese modo, para nosotros como para él, en la debilidad de la carne se revela la potencia de la fe en Dios que justifica (cf. Rm 5,1-5).
Esta basílica desde hace siglos está encomendada al cuidado de una comunidad benedictina. ¿Cómo no recordar, entonces, hablando del amor como fuente y motor del anuncio del Evangelio, las insistentes exhortaciones de san Benito, en su regla, a la caridad fraterna en el cenobio y a la hospitalidad para con todos (cf. Regla , cap. LIII, LXIII)?
Quisiera concluir evocando las palabras que, más de mil años después, otro Benedicto, el Papa Benedicto XVI , dirigía a los jóvenes: «Queridos amigos —decía—, Dios nos ama. Ésta es la gran verdad de nuestra vida y que da sentido a todo lo demás. […] En el origen de nuestra existencia hay un proyecto de amor de Dios», y la fe nos lleva a «abrir nuestro corazón a este misterio de amor y a vivir como personas que se saben amadas por Dios» ( Homilía en la Vigilia de oración con los jóvenes , Madrid, 20 agosto 2011).
Aquí está la raíz, simple y única, de toda misión, incluso de la mía, como sucesor de Pedro y heredero del celo apostólico de Pablo. Que el Señor me conceda la gracia de responder fielmente a su llamada.",2025-05-20_homilia_visita_al_sepulcro_de_san_pablo_(20_de_mayo_de_2025)
